title,company,location,semantic_similarity,first_seen_date,url
"Senior Product Operations, Safety Media",uber,"San Francisco, California, United States",0.2863,2026-06-17,https://www.uber.com/global/en/careers/list/154507/
Critical Facility Engineer,meta,"Aiken, SC +15 locations",0.2842,2026-06-17,https://www.metacareers.com/profile/job_details/1690022942358388
AI Experience Policy Specialist,uber,"Phoenix, Arizona, United States",0.2841,2026-06-17,https://www.uber.com/global/en/careers/list/155800/
"Coordinator, Post Production, Documentary Series & Film, UK, Nonfiction",netflix,"London,United Kingdom",0.2829,2026-06-17,https://explore.jobs.netflix.net/careers/job/790316220189
"Software Engineer in Test, Siri",apple,Various Locations within San Francisco Bay Area,0.2823,2026-06-17,https://jobs.apple.com/en-us/details/200644887-3401/software-engineer-in-test-siri?team=SFTWR
"2026 Account Representative Intern, US - Sales",uber,"Chicago, Illinois, United States",0.2803,2026-06-17,https://www.uber.com/global/en/careers/list/156817/
"Manager, AM&D BD, AV Delivery Partnerships",uber,"New York, New York, United States; San Francisco, California, United States",0.2798,2026-06-17,https://www.uber.com/global/en/careers/list/156243/
Senior Software Engineer - Communications Platform (Backend),uber,"San Francisco, California, United States; Sunnyvale, California, United States",0.2797,2026-06-17,https://www.uber.com/global/en/careers/list/156179/
"2026 Growth Finance Intern, United States",uber,"New York, New York, United States",0.2788,2026-06-17,https://www.uber.com/global/en/careers/list/154768/
"Sr Measurement & Insights Analyst, CPG",uber,"New York, New York, United States; San Francisco, California, United States; Chicago, Illinois, United States",0.2776,2026-06-17,https://www.uber.com/global/en/careers/list/152413/
"Senior Analyst, Finance Transformation",uber,"Dallas, Texas, United States; New York, New York, United States; San Francisco, California, United States",0.2767,2026-06-17,https://www.uber.com/global/en/careers/list/156680/
DevOps Build and Tools Engineer - Special Projects,apple,,0.2738,2026-06-17,https://jobs.apple.com/en-us/details/200667446-0836/devops-build-and-tools-engineer-special-projects?team=SFTWR
"Software Engineer, Systems ML",meta,"Bellevue, WA +2 locations",0.2738,2026-06-17,https://www.metacareers.com/profile/job_details/990864127272553
Global Relocation & Immigration Business Partner,uber,"Chicago, Illinois, United States; San Francisco, California, United States; Seattle, Washington, United States; New York, New York, United States; Dallas, Texas, United States",0.2736,2026-06-17,https://www.uber.com/global/en/careers/list/151326/
"Senior Account Executive, UberEats, Southwest (Phoenix-based)",uber,"Phoenix, Arizona, United States",0.2684,2026-06-17,https://www.uber.com/global/en/careers/list/156523/
Sênior Software Engineer - VIS RE,mercadolibre,"Región Metropolitana de Santiago,Chile",0.2681,2026-06-17,https://mercadolibre.eightfold.ai/careers/job/41072937
Account Representative (Miami Based),uber,"Miami, Florida, United States",0.2664,2026-06-17,https://www.uber.com/global/en/careers/list/155944/
Design Change Engineering Program Manager,meta,"Reston, VA +1 locations",0.2649,2026-06-17,https://www.metacareers.com/profile/job_details/1537124831194967
"IS&T Services AV & Broadcast Engineer,  Employee Experience & Productivity",apple,,0.2626,2026-06-17,https://jobs.apple.com/en-us/details/200652944-0670/is-t-services-av-broadcast-engineer-employee-experience-productivity?team=SFTWR
"Acquisition Account Manager, Mid-Market EMEA",reddit,"London, United Kingdom",0.2598,2026-06-17,https://job-boards.greenhouse.io/reddit/jobs/8012700
"Technical Program Manager, Core Infrastructure",meta,"Menlo Park, CA",0.2593,2026-06-17,https://www.metacareers.com/profile/job_details/1020055507141390
Investigator,uber,"Boston, Massachusetts, United States; Dallas, Texas, United States; Phoenix, Arizona, United States; Miami, Florida, United States; Chicago, Illinois, United States",0.257,2026-06-17,https://www.uber.com/global/en/careers/list/160167/
"Account Representative, SMB UberEats, Southwest (Dallas-Based)",uber,"Dallas, Texas, United States",0.2557,2026-06-17,https://www.uber.com/global/en/careers/list/151661/
Sales Strategy & Operational Excellence Lead,anthropic,"San Francisco, CA",0.2554,2026-06-17,https://job-boards.greenhouse.io/anthropic/jobs/5191332008
"Product Manager, System Apps",apple,,0.2537,2026-06-17,https://jobs.apple.com/en-us/details/200668930-0836/product-manager-system-apps?team=MKTG
"Threat Modeler, Preparedness",openai,San Francisco,0.2534,2026-06-17,https://jobs.ashbyhq.com/openai/f735a48e-c3c2-4387-abf7-7b39452e1ec5
Sr. Ad Ops Demand Mgmt Specialist (EMEA),netflix,"London,United Kingdom",0.2532,2026-06-17,https://explore.jobs.netflix.net/careers/job/790316464180
"Partner Manager, Retail - Uber Advertising",uber,"New York, New York, United States",0.2505,2026-06-17,https://www.uber.com/global/en/careers/list/160248/
"Client Partner, Uber Advertisting - Travel & Financial Services",uber,"New York, New York, United States; San Francisco, California, United States; Chicago, Illinois, United States",0.2502,2026-06-17,https://www.uber.com/global/en/careers/list/156863/
"Account Executive, UberEats, Southwest (Bilingual Spanish Required)",uber,"Phoenix, Arizona, United States",0.2501,2026-06-17,https://www.uber.com/global/en/careers/list/160270/
Credit and Collections Lead,openai,San Francisco,0.2498,2026-06-17,https://jobs.ashbyhq.com/openai/da3bed10-dfa7-4e44-bb16-414dd56cc16b
Software Engineer L5 - Audio/Video Tools and Tests,netflix,"Los Gatos,California,United States of America",0.2484,2026-06-17,https://explore.jobs.netflix.net/careers/job/790316305359
"Senior Client Partner, Mid-Market - UK",reddit,"London, United Kingdom",0.2482,2026-06-17,https://job-boards.greenhouse.io/reddit/jobs/8012744
"Senior Account Manager, Postmates Exclusives",uber,"Los Angeles, California, United States",0.2482,2026-06-17,https://www.uber.com/global/en/careers/list/156608/
"Sales Manager, Mid-Market - UK",reddit,"London, United Kingdom",0.2481,2026-06-17,https://job-boards.greenhouse.io/reddit/jobs/8012708
Sr Software Engineer (Payments/Money Platform),uber,"Sunnyvale, California, United States",0.2476,2026-06-17,https://www.uber.com/global/en/careers/list/147019/
"Technical Program Manager, Trust Security",meta,"Redmond, WA",0.2474,2026-06-17,https://www.metacareers.com/profile/job_details/893378530462266
"Account Executive, UberEats, Southwest (Phoenix-based)",uber,"Phoenix, Arizona, United States",0.2454,2026-06-17,https://www.uber.com/global/en/careers/list/151664/
"Account Partner, Eats SMB",uber,"Miami, Florida, United States",0.2452,2026-06-17,https://www.uber.com/global/en/careers/list/155966/
"Account Representative, UberEats (Bilingual Spanish Required)",uber,"Phoenix, Arizona, United States",0.2447,2026-06-17,https://www.uber.com/global/en/careers/list/160269/
Group Transportation Sales Account Executive - US&C,uber,"New York, New York, United States; Chicago, Illinois, United States",0.2426,2026-06-17,https://www.uber.com/global/en/careers/list/159747/
New Product Technology Project Manager,apple,,0.2425,2026-06-17,https://jobs.apple.com/en-us/details/200668230-3543/new-product-technology-project-manager?team=HRDWR
"Senior Visual Designer, Emerging Creative",netflix,USA - Remote,0.2419,2026-06-17,https://explore.jobs.netflix.net/careers/job/790316471296
Analista Senior training Delivery-Mercado envíos,mercadolibre,"León,Mexico",0.2406,2026-06-17,https://mercadolibre.eightfold.ai/careers/job/42407981
"Account Representative, UberEats, Midwest (Chicago-based)",uber,"Chicago, Illinois, United States",0.2403,2026-06-17,https://www.uber.com/global/en/careers/list/154331/
"Lead, Product Content Engineering",meta,"Los Angeles, CA +3 locations",0.2381,2026-06-17,https://www.metacareers.com/profile/job_details/1371216284928254
"Head of Account Management, SMB Sales, New England",uber,"Boston, Massachusetts, United States; New York, New York, United States",0.2378,2026-06-17,https://www.uber.com/global/en/careers/list/155153/
Manager de proyectos y operaciones de tarjeta de crédito y prepaga - Fintech,mercadolibre,"Buenos Aires,Argentina",0.2376,2026-06-17,https://mercadolibre.eightfold.ai/careers/job/42474451
"Manager, Global Merchant Strategy & Operations, Grocery & Retail",uber,"Santiago, Chile",0.2336,2026-06-17,https://www.uber.com/global/en/careers/list/155166/
"Account Partner, Eats SMB",uber,"Atlanta, Georgia, United States",0.2333,2026-06-17,https://www.uber.com/global/en/careers/list/155970/
"Account Partner, Eats SMB",uber,"Nashville, Tennessee, United States",0.2297,2026-06-17,https://www.uber.com/global/en/careers/list/155197/
Sr Strategy & Operation Manager,uber,"Santiago, Chile",0.228,2026-06-17,https://www.uber.com/global/en/careers/list/152895/
"Counsel, Litigation",uber,"New York, New York, United States; San Francisco, California, United States; Chicago, Illinois, United States; Washington, District of Columbia, United States",0.2264,2026-06-17,https://www.uber.com/global/en/careers/list/160258/
"Account Representative, Nashville",uber,"Nashville, Tennessee, United States",0.2249,2026-06-17,https://www.uber.com/global/en/careers/list/154189/
Analista Senior de Seguridad de Datos,mercadolibre,"Medellín,Colombia",0.2222,2026-06-17,https://mercadolibre.eightfold.ai/careers/job/42489445
"Senior Enterprise Partner Manager, Grocery",uber,"Dallas, Texas, United States; New York, New York, United States; San Francisco, California, United States; Chicago, Illinois, United States; Toronto, Ontario, Canada",0.2209,2026-06-17,https://www.uber.com/global/en/careers/list/159739/
"Creative Producer, Experiential",airbnb,United States,0.2203,2026-06-17,https://careers.airbnb.com/positions/8008818/
"Economic Policy Manager, APAC",meta,Singapore,0.2203,2026-06-17,https://www.metacareers.com/jobs/895276696939222/
"Counsel, Safety & Insurance Litigation, US West",uber,"San Francisco, California, United States",0.2199,2026-06-17,https://www.uber.com/global/en/careers/list/160059/
"Public Affairs Director, Strategic Response",meta,"Menlo Park, CA; Washington, DC; New York, NY; San Francisco, CA",0.2138,2026-06-17,https://www.metacareers.com/jobs/1319137226865695/
"Account Representative, Chicago",uber,"Chicago, Illinois, United States",0.2132,2026-06-17,https://www.uber.com/global/en/careers/list/153272/
Engineering Manager II - Courier,uber,"New York, New York, United States",0.2099,2026-06-17,https://www.uber.com/global/en/careers/list/151758/
"Senior Product Designer, Developer Success",discord,San Francisco Bay Area or Remote (U.S.),0.2084,2026-06-17,https://job-boards.greenhouse.io/discord/jobs/8595014002
Especialista de pricing y rentabilidad - Fintech,mercadolibre,"Buenos Aires,Argentina",0.2075,2026-06-17,https://mercadolibre.eightfold.ai/careers/job/41811489
"Communications Manager, Thailand — IC6",meta,"Bangkok, Thailand",0.2071,2026-06-17,https://www.metacareers.com/profile/job_details/4026640047470533
Sr Strategy & Planning Associate - Catering and Large Orders,uber,"New York, New York, United States; San Francisco, California, United States; Toronto, Ontario, Canada",0.2059,2026-06-17,https://www.uber.com/global/en/careers/list/154499/
Senior Enterprise Account Executive,uber,"New York, New York, United States; San Francisco, California, United States; Chicago, Illinois, United States; Toronto, Ontario, Canada",0.2054,2026-06-17,https://www.uber.com/global/en/careers/list/156017/
Health Software - iOS Engineer,apple,,0.204,2026-06-17,https://jobs.apple.com/en-us/details/200666859-2459/health-software-ios-engineer?team=SFTWR
Claims Advocate,uber,"Phoenix, Arizona, United States",0.2017,2026-06-17,https://www.uber.com/global/en/careers/list/151701/
US-Manager,apple,,0.198,2026-06-17,https://jobs.apple.com/en-us/details/200664156-2880/us-manager?team=APPST
QA Engineering Lead,meta,"Burlingame, CA +2 locations",0.1885,2026-06-17,https://www.metacareers.com/profile/job_details/1288268656630116
APAC Marketing Strategic Initiatives Manager,meta,Singapore,0.1872,2026-06-17,https://www.metacareers.com/profile/job_details/1638015183935672
Network Hardware Engineer,meta,"Menlo Park, CA",0.1779,2026-06-17,https://www.metacareers.com/profile/job_details/1582197930102516
Supervisão de Segurança do Trabalho para Mercado Envios,mercadolibre,"Sul,Brazil",0.1754,2026-06-17,https://mercadolibre.eightfold.ai/careers/job/42481871
US-Lead Genius,apple,,0.1703,2026-06-17,https://jobs.apple.com/en-us/details/200668797-2645/us-lead-genius?team=APPST
Hardware System Design Lead - Apple Vision Pro,apple,,0.1696,2026-06-17,https://jobs.apple.com/en-us/details/200668218-3337/hardware-system-design-lead-apple-vision-pro?team=HRDWR
Analista Sênior de Melhoria Contínua - Mercado Envios,mercadolibre,"Sudeste,Brazil",0.1678,2026-06-17,https://mercadolibre.eightfold.ai/careers/job/42315122
Analista Sênior de Melhoria Contínua - Mercado Envios,mercadolibre,"Sudeste,Brazil",0.1678,2026-06-17,https://mercadolibre.eightfold.ai/careers/job/42470513
Analista Semi Senior de Finanzas Operativas - Mercado Crédito,mercadolibre,"Buenos Aires,Argentina",0.1623,2026-06-17,https://mercadolibre.eightfold.ai/careers/job/41990691
Analista Sênior de Qualidade e  Inventário - Mercado Envios,mercadolibre,"Sudeste,Brazil",0.161,2026-06-17,https://mercadolibre.eightfold.ai/careers/job/42449990
Social Media Creative Strategist,uber,"New York, New York, United States",0.1601,2026-06-17,https://www.uber.com/global/en/careers/list/152405/
Supervisão de Segurança do Trabalho para Mercado Envios,mercadolibre,"Sudeste,Brazil",0.154,2026-06-17,https://mercadolibre.eightfold.ai/careers/job/42481863
Analista Sênior de Treinamento - Mercado Envios,mercadolibre,"Sudeste,Brazil; Brasília, DF, BR",0.152,2026-06-17,https://mercadolibre.eightfold.ai/careers/job/41886011
"Client Partner, Apps & Games",meta,Hong Kong,0.1515,2026-06-17,https://www.metacareers.com/profile/job_details/1230985242358245
Experto en Compras de Shipping - Mercado Envíos,mercadolibre,"Distrito Federal,Mexico",0.1461,2026-06-17,https://mercadolibre.eightfold.ai/careers/job/42459950
Analista Pleno de Facilities - Mercado Envios,mercadolibre,"Sudeste,Brazil",0.1399,2026-06-17,https://mercadolibre.eightfold.ai/careers/job/41883053
Analista Sênior de Treinamento -  Mercado Envios,mercadolibre,"Sudeste,Brazil",0.1383,2026-06-17,https://mercadolibre.eightfold.ai/careers/job/42315060
WiFi MAC Design Verification Engineer,apple,,0.1372,2026-06-17,https://jobs.apple.com/en-us/details/200668661-3956/wifi-mac-design-verification-engineer?team=HRDWR
"Senior Product Designer, Social Commerce",discord,San Francisco Bay Area,0.1363,2026-06-17,https://job-boards.greenhouse.io/discord/jobs/8594977002
Optical Sensing HW - Algorithm and Modeling Engineer,apple,,0.13,2026-06-17,https://jobs.apple.com/en-us/details/200666630-0836/optical-sensing-hw-algorithm-and-modeling-engineer?team=HRDWR
"Group Product Manager, Fares platform",uber,"Seattle, Washington, United States; San Francisco, California, United States",0.1295,2026-06-17,https://www.uber.com/global/en/careers/list/149279/
Analista Pleno de Prevenção de Perdas - Mercado Envios,mercadolibre,"Sudeste,Brazil",0.1286,2026-06-17,https://mercadolibre.eightfold.ai/careers/job/42306602
Custom Circuits Debug Engineer,apple,,0.1149,2026-06-17,https://jobs.apple.com/en-us/details/200668974-0157/custom-circuits-debug-engineer?team=HRDWR
Analista de transporte - Bariloche - Mercado Envíos,mercadolibre,"Buenos Aires,Argentina",0.1122,2026-06-17,https://mercadolibre.eightfold.ai/careers/job/40817847
Haptics Firmware Engineer,apple,,0.0915,2026-06-17,https://jobs.apple.com/en-us/details/200668457-0836/haptics-firmware-engineer?team=HRDWR
Assistente de Roteirização - Mercado Envios,mercadolibre,"Sudeste,Brazil",0.0863,2026-06-17,https://mercadolibre.eightfold.ai/careers/job/41492200
