title,company,location,semantic_similarity,first_seen_date,url
"2027 Software Engineering Internship, Uber Career Prep",uber,"Seattle, King, United States; San Francisco, San Francisco, United States; Sunnyvale, Santa Clara, United States",0.3685,2026-07-20,https://www.uber.com/global/en/careers/list/302133/
"Software Engineer, Ads Conversion Measurement",openai,San Francisco,0.3683,2026-07-20,https://jobs.ashbyhq.com/openai/1b86ec8e-fe34-452d-bbff-6619579e7385
Field Security Specialist (Cyber Security Solutions Engineer),openai,"Dublin, Ireland",0.3683,2026-07-20,https://jobs.ashbyhq.com/openai/8ee5d640-de2c-4004-8857-210ef8ec3177
"Senior Debug System Engineer, Datacenter",nvidia,"US, CA, Santa Clara",0.3676,2026-07-20,https://nvidia.wd5.myworkdayjobs.com/NVIDIAExternalCareerSite/job/US-CA-Santa-Clara/Senior-Debug-System-Engineer--Datacenter_JR2021190
Sr. Front-End Engineer - Apple Business Essentials - ASE,apple,,0.3673,2026-07-20,https://jobs.apple.com/en-us/details/200672504-3337/sr-front-end-engineer-apple-business-essentials-ase?team=SFTWR
"Prime Air Ground Handler, Amazon Prime Air",amazon,"US, IL, Harvey",0.3661,2026-07-20,https://www.amazon.jobs/en/jobs/10479288/prime-air-ground-handler-amazon-prime-air
"Prime Air Ground Handler, Amazon Prime Air",amazon,"US, IL, Harvey",0.3661,2026-07-20,https://www.amazon.jobs/en/jobs/10479289/prime-air-ground-handler-amazon-prime-air
Senior Product Engineer - Datacenter,nvidia,"US, CA, Santa Clara",0.3649,2026-07-20,https://nvidia.wd5.myworkdayjobs.com/NVIDIAExternalCareerSite/job/US-CA-Santa-Clara/Senior-Product-Engineer---Datacenter_JR2020197-1
"Prime Air Ground Handler, Amazon Prime Air",amazon,"US, TX, Richardson",0.3646,2026-07-20,https://www.amazon.jobs/en/jobs/10479291/prime-air-ground-handler-amazon-prime-air
"Prime Air Ground Handler, Amazon Prime Air",amazon,"US, TX, Richardson",0.3646,2026-07-20,https://www.amazon.jobs/en/jobs/10479294/prime-air-ground-handler-amazon-prime-air
"Prime Air Ground Handler, Amazon Prime Air",amazon,"US, TX, Richardson",0.3646,2026-07-20,https://www.amazon.jobs/en/jobs/10479290/prime-air-ground-handler-amazon-prime-air
"Prime Air Ground Handler, Amazon Prime Air",amazon,"US, TX, Richmond",0.3641,2026-07-20,https://www.amazon.jobs/en/jobs/10479284/prime-air-ground-handler-amazon-prime-air
"Prime Air Ground Handler, Amazon Prime Air",amazon,"US, TX, Richmond",0.3641,2026-07-20,https://www.amazon.jobs/en/jobs/10479285/prime-air-ground-handler-amazon-prime-air
"AI Deployment Engineer, Enterprise",openai,São Paulo,0.3632,2026-07-20,https://jobs.ashbyhq.com/openai/44d19f5f-a5da-4226-9d1a-0147604773eb
"Creative Dubbing Lead - AI-Assisted Dubbing, Localization Enablement & Accessibility Programs (LEAP)",amazon,"US, CA, Culver City",0.3609,2026-07-20,https://www.amazon.jobs/en/jobs/10479097/creative-dubbing-lead-ai-assisted-dubbing-localization-enablement-accessibility-programs-leap
"Prime Air Ground Handler, Amazon Prime Air",amazon,"US, IL, Matteson",0.3609,2026-07-20,https://www.amazon.jobs/en/jobs/10479295/prime-air-ground-handler-amazon-prime-air
"Prime Air Ground Handler, Amazon Prime Air",amazon,"US, IL, Matteson",0.3609,2026-07-20,https://www.amazon.jobs/en/jobs/10479296/prime-air-ground-handler-amazon-prime-air
Area Manager,amazon,"US, PA, Bethlehem",0.3601,2026-07-20,https://www.amazon.jobs/en/jobs/10479369/area-manager
"Senior Director, Enterprise Software Engineering and AI Platforms",nvidia,"US, CA, Santa Clara",0.359,2026-07-20,https://nvidia.wd5.myworkdayjobs.com/NVIDIAExternalCareerSite/job/US-CA-Santa-Clara/Senior-Director--Enterprise-Software-Engineering-and-AI-Platforms_JR2021430
"Prime Air Ground Handler, Amazon Prime Air",amazon,"US, FL, Tallahassee",0.3554,2026-07-20,https://www.amazon.jobs/en/jobs/10479286/prime-air-ground-handler-amazon-prime-air
"Prime Air Ground Handler, Amazon Prime Air",amazon,"US, FL, Tallahassee",0.3554,2026-07-20,https://www.amazon.jobs/en/jobs/10479287/prime-air-ground-handler-amazon-prime-air
Capital Markets - Infrastructure Financing,anthropic,"San Francisco, CA",0.352,2026-07-20,https://job-boards.greenhouse.io/anthropic/jobs/5116167008
Analista Senior de Estrategia de Precios - Fintech,mercadolibre,"Buenos Aires,Argentina",0.3413,2026-07-20,https://mercadolibre.eightfold.ai/careers/job/41921182
"Sr Engineering Program Manager, AIML Foundation Models",apple,,0.3408,2026-07-20,https://jobs.apple.com/en-us/details/200672974-0836/sr-engineering-program-manager-aiml-foundation-models?team=MLAI
Capital Markets - Infrastructure Financing ,anthropic,"San Francisco, CA",0.338,2026-07-20,https://job-boards.greenhouse.io/anthropic/jobs/5364336008
Research Engineer - MSL FAIR Foundations,meta,Artificial Intelligence,0.3364,2026-07-20,https://www.metacareers.com/profile/job_details/1526484645064212
Full-Stack Software Engineer - Device Telemetry,apple,,0.3306,2026-07-20,https://jobs.apple.com/en-us/details/200657383-3543/full-stack-software-engineer-device-telemetry?team=SFTWR
Supplier Base Engineer – Liquid Cooling Contamination Control,nvidia,"US, CA, Santa Clara",0.3233,2026-07-20,https://nvidia.wd5.myworkdayjobs.com/NVIDIAExternalCareerSite/job/US-CA-Santa-Clara/Supplier-Base-Engineer---Liquid-Cooling-Contamination-Control_JR2021258
Senior HPC and LSF Operations Engineer,nvidia,"US, CA, Santa Clara; US, MA, Westford; US, TX, Austin; US, NC, Durham",0.3224,2026-07-20,https://nvidia.wd5.myworkdayjobs.com/NVIDIAExternalCareerSite/job/US-CA-Santa-Clara/Senior-HPC-and-LSF-Operations-Engineer_JR2014127
Senior Robotics Software Engineer,apple,,0.3203,2026-07-20,https://jobs.apple.com/en-us/details/200630185-0836/senior-robotics-software-engineer?team=MLAI
Analista Senior de Adquisición Online - Mercado Pago,mercadolibre,"Distrito Federal,Mexico",0.3154,2026-07-20,https://mercadolibre.eightfold.ai/careers/job/43271942
US-Technical Specialist,apple,,0.3133,2026-07-20,https://jobs.apple.com/en-us/details/200673094-3136/us-technical-specialist?team=APPST
US-Technical Specialist,apple,,0.3088,2026-07-20,https://jobs.apple.com/en-us/details/200673081-2669/us-technical-specialist?team=APPST
"Engineering Program Manager, iCloud Mail, Apple Services Engineering",apple,,0.3083,2026-07-20,https://jobs.apple.com/en-us/details/200664688-3543/engineering-program-manager-icloud-mail-apple-services-engineering?team=SFTWR
"Software Development Engineer, Wireless Technologies & Ecosystems",apple,,0.3046,2026-07-20,https://jobs.apple.com/en-us/details/200658689-0836/software-development-engineer-wireless-technologies-ecosystems?team=SFTWR
Network Engineer - Optical Deployment,meta,"London, UK",0.3009,2026-07-20,https://www.metacareers.com/profile/job_details/1538803054712332
"Senior Machine Learning Engineer, Safety",reddit,Remote - United States,0.296,2026-07-20,https://job-boards.greenhouse.io/reddit/jobs/7729096
Senior Credit and Collections Manager,netflix,"New York,New York,United States of America",0.2954,2026-07-20,https://explore.jobs.netflix.net/careers/job/790317205654
"Commercial Sourcing Manager, Strategic Silicon",meta,"Menlo Park, CA",0.2923,2026-07-20,https://www.metacareers.com/profile/job_details/1507023990603981
Analista Semi Sênior de Operações -  Desvios - Mercado Pago,mercadolibre,"Sudeste,Brazil",0.2921,2026-07-20,https://mercadolibre.eightfold.ai/careers/job/41905961
Analista Pleno de Dados para Operações- Afirmativa para Pessoas com Deficiência,mercadolibre,"Sudeste,Brazil",0.2912,2026-07-20,https://mercadolibre.eightfold.ai/careers/job/43271833
"Associate, Games FP&A",netflix,"Los Angeles,California,United States of America",0.2887,2026-07-20,https://explore.jobs.netflix.net/careers/job/790317257980
Creative Intelligence Software Engineer - Camera and Photos,apple,Various Locations within San Francisco Bay Area,0.2808,2026-07-20,https://jobs.apple.com/en-us/details/200672908-3401/creative-intelligence-software-engineer-camera-and-photos?team=SFTWR
Analista Pleno de Operações - Mercado Pago,mercadolibre,"Sudeste,Brazil",0.2799,2026-07-20,https://mercadolibre.eightfold.ai/careers/job/42561079
"Principal Product Manager, Habit Formation",spotify,"New York, NY",0.2744,2026-07-20,https://jobs.lever.co/spotify/a88002db-cb15-49f4-a0e7-efc5c79c347b
Analista Comercial Senior Categoría Belleza - Marketplace,mercadolibre,"Santiago,Chile",0.2741,2026-07-20,https://mercadolibre.eightfold.ai/careers/job/43159365
Pessoa Executiva de Vendas Externas Mercado Pago - Mato Grosso,mercadolibre,"Norte,Brazil",0.2734,2026-07-20,https://mercadolibre.eightfold.ai/careers/job/43269983
Pessoa Executiva de Vendas Externas Mercado Pago - São Paulo (SP),mercadolibre,"Sudeste,Brazil",0.2713,2026-07-20,https://mercadolibre.eightfold.ai/careers/job/43270150
Pessoa Executiva de Vendas Externas Mercado Pago - São Paulo (SP),mercadolibre,"Sudeste,Brazil",0.2713,2026-07-20,https://mercadolibre.eightfold.ai/careers/job/43270356
"Software Engineer, Authorization",apple,,0.2674,2026-07-20,https://jobs.apple.com/en-us/details/200673149-3337/software-engineer-authorization?team=SFTWR
Analista Sênior de Planejamento - Marketplace,mercadolibre,"Sudeste,Brazil",0.2642,2026-07-20,https://mercadolibre.eightfold.ai/careers/job/43158740
 Simulation Engineer | Noise & Vibration,apple,Various Locations within Denver Metro Area,0.2615,2026-07-20,https://jobs.apple.com/en-us/details/200673079/%EF%A3%BF-simulation-engineer-noise-vibration?team=HRDWR
Systems Signal Integrity Engineer - Apple Data center,apple,,0.26,2026-07-20,https://jobs.apple.com/en-us/details/200655566-0157/systems-signal-integrity-engineer-apple-data-center?team=HRDWR
Controls Subject Matter Expert,meta,"Rayville, LA",0.2551,2026-07-20,https://www.metacareers.com/profile/job_details/1734334641198579
Pessoa Executiva de Vendas Externas Mercado Pago - São Paulo,mercadolibre,"Sudeste,Brazil",0.2507,2026-07-20,https://mercadolibre.eightfold.ai/careers/job/43271407
"Engineering Program Manager, Health Sensing Architecture & Algorithms",apple,,0.2491,2026-07-20,https://jobs.apple.com/en-us/details/200672997-0836/engineering-program-manager-health-sensing-architecture-algorithms?team=HRDWR
"Senior, Business Risk & AI Automation",reddit,"Remote - British Columbia, Canada",0.2476,2026-07-20,https://job-boards.greenhouse.io/reddit/jobs/8074860
Analista de Operaciones financieras,mercadolibre,"Buenos Aires,Argentina",0.2469,2026-07-20,https://mercadolibre.eightfold.ai/careers/job/43271834
Executive Assistant Business Partner II,uber,"New York, New York, United States",0.2464,2026-07-20,https://www.uber.com/global/en/careers/list/300987/
Supplier Quality Engineer,nvidia,"US, CA, Santa Clara",0.2462,2026-07-20,https://nvidia.wd5.myworkdayjobs.com/NVIDIAExternalCareerSite/job/US-CA-Santa-Clara/Supplier-Quality-Engineer_JR2021428
Technical Program Manager - VPG,apple,,0.2455,2026-07-20,https://jobs.apple.com/en-us/details/200671340-0836/technical-program-manager-vpg?team=OPMFG
"Wi-Fi/Bluetooth Software System Performance Engineer, Wireless Technologies & Ecosystems",apple,,0.2452,2026-07-20,https://jobs.apple.com/en-us/details/200673117-3543/wi-fi-bluetooth-software-system-performance-engineer-wireless-technologies-ecosystems?team=SFTWR
Executive Assistant Business Partner II,uber,"New York, New York, United States",0.2444,2026-07-20,https://www.uber.com/global/en/careers/list/301211/
"Senior, Business Risk & AI Automation",reddit,"Remote - Ontario, Canada",0.2422,2026-07-20,https://job-boards.greenhouse.io/reddit/jobs/8074846
"Manager, Earner Marketplace",uber,"New York, New York, United States; San Francisco, San Francisco, United States",0.242,2026-07-20,https://www.uber.com/global/en/careers/list/301499/
"Product Management, Director - AI Platforms and Infra",meta,"Menlo Park, CA",0.2397,2026-07-20,https://www.metacareers.com/profile/job_details/1524369366038218
Cellular PHY Systems Engineer,apple,,0.2382,2026-07-20,https://jobs.apple.com/en-us/details/200673128-3543/cellular-phy-systems-engineer?team=HRDWR
"Product Analyst, Global Product Quality",meta,"Menlo Park, CA",0.2377,2026-07-20,https://www.metacareers.com/profile/job_details/993555207004397
US-Technical Specialist,apple,,0.2365,2026-07-20,https://jobs.apple.com/en-us/details/200673144-2213/us-technical-specialist?team=APPST
"SME - Mechanical, Manufacturing Design Engineer",meta,"Shanghai, China +2 locations",0.2354,2026-07-20,https://www.metacareers.com/profile/job_details/1383219950350958
Pessoa Executiva de Vendas Externas Mercado Pago - Bahia,mercadolibre,"Sudeste,Brazil",0.2291,2026-07-20,https://mercadolibre.eightfold.ai/careers/job/43270366
Líder de Equipe Logística - Mercado Envios,mercadolibre,"Sudeste,Brazil",0.229,2026-07-20,https://mercadolibre.eightfold.ai/careers/job/42071682
Pessoa Executiva de Vendas Externas Mercado Pago - Santa Catarina,mercadolibre,"Sul,Brazil",0.2287,2026-07-20,https://mercadolibre.eightfold.ai/careers/job/43269046
Customer Lifecycle Strategy Lead - Services,apple,,0.226,2026-07-20,https://jobs.apple.com/en-us/details/200673158-0670/customer-lifecycle-strategy-lead-services?team=MKTG
"Software Engineer, Infrastructure",meta,"Zurich, Switzerland +2 locations",0.2201,2026-07-20,https://www.metacareers.com/profile/job_details/1277398403727586
Supply Chain Business Analyst,apple,Various Locations within San Francisco Bay Area,0.2195,2026-07-20,https://jobs.apple.com/en-us/details/200607146-3401/supply-chain-business-analyst?team=OPMFG
Audio Software Test Engineer - Airpods,apple,,0.219,2026-07-20,https://jobs.apple.com/en-us/details/200673102-0836/audio-software-test-engineer-airpods?team=SFTWR
"Sr. Product Manager, App Marketplaces Child Safety",apple,,0.2189,2026-07-20,https://jobs.apple.com/en-us/details/200672624-0836/sr-product-manager-app-marketplaces-child-safety?team=MKTG
"Senior Economist, Competition Law",apple,,0.2179,2026-07-20,https://jobs.apple.com/en-us/details/200662643-0836/senior-economist-competition-law?team=CORSV
"Integrated Marketing Manager Generalist, Facebook",meta,"Los Angeles, CA +3 locations",0.2135,2026-07-20,https://www.metacareers.com/profile/job_details/880517521414442
Líder de Equipe | Franco Rocha,mercadolibre,"Sudeste,Brazil",0.2112,2026-07-20,https://mercadolibre.eightfold.ai/careers/job/43275535
Analista de Ruteo - Mercado Envíos,mercadolibre,"Bogotá,Colombia",0.2081,2026-07-20,https://mercadolibre.eightfold.ai/careers/job/43195048
US-Senior Manager,apple,,0.205,2026-07-20,https://jobs.apple.com/en-us/details/200661131-3048/us-senior-manager?team=APPST
Supervisor de Manutenção - Mercado Envios.,mercadolibre,"Sudeste,Brazil",0.2029,2026-07-20,https://mercadolibre.eightfold.ai/careers/job/43188237
"Senior Leader, Product Management for Pricing Systems",apple,,0.1991,2026-07-20,https://jobs.apple.com/en-us/details/200668060-0836/senior-leader-product-management-for-pricing-systems?team=SFTWR
"Overnight Staff Pharmacist, Amazon Pharmacy",amazon,"US, OH, Middleburg Heights",0.1818,2026-07-20,https://www.amazon.jobs/en/jobs/10478471/overnight-staff-pharmacist-amazon-pharmacy
Gerente de Planeación Operativa - Mercado Envíos,mercadolibre,"Distrito Federal,Mexico",0.1709,2026-07-20,https://mercadolibre.eightfold.ai/careers/job/41555754
Input Device Product Design Engineer,apple,,0.1558,2026-07-20,https://jobs.apple.com/en-us/details/200606735-0157/input-device-product-design-engineer?team=HRDWR
US-Pro,apple,,0.1412,2026-07-20,https://jobs.apple.com/en-us/details/200673077-3214/us-pro?team=APPST
Wireless Charging Firmware Engineer,apple,,0.1384,2026-07-20,https://jobs.apple.com/en-us/details/200673111-0836/wireless-charging-firmware-engineer?team=SFTWR
Analog/Mixed-Signal IP Engineering Program Manager,apple,,0.1281,2026-07-20,https://jobs.apple.com/en-us/details/200658634-0157/analog-mixed-signal-ip-engineering-program-manager?team=HRDWR
"Software Engineer, AirPlay 3rd Party",apple,,0.1087,2026-07-20,https://jobs.apple.com/en-us/details/200668233-3543/software-engineer-airplay-3rd-party?team=SFTWR
