title,company,location,semantic_similarity,first_seen_date,url
"Senior Strategy & Operations Manager, Marketplace (Retail)",uber,"San Francisco, California, United States; New York, New York, United States",0.4458,2026-06-17,https://www.uber.com/global/en/careers/list/153008/
"Sr Software Engineer - Machine Learning, Marketplace/Maps/Membership/AV",uber,"New York, New York, United States; Seattle, Washington, United States; San Francisco, California, United States; Sunnyvale, California, United States",0.4445,2026-06-17,https://www.uber.com/global/en/careers/list/153476/
"Sr. Partner Sales Manager, ISV",amazon,"US, FL, Miami",0.4432,2026-06-17,https://www.amazon.jobs/en/jobs/10451954/sr-partner-sales-manager-isv
Sr Software Engineer (Backend) - GenAI,uber,"Sunnyvale, California, United States",0.4427,2026-06-17,https://www.uber.com/global/en/careers/list/156944/
Senior Staff Machine Learning Engineer - Trusted Identity,uber,"Sunnyvale, California, United States; San Francisco, California, United States; Seattle, Washington, United States; New York, New York, United States",0.4414,2026-06-17,https://www.uber.com/global/en/careers/list/149797/
"Data Engineer, Scaling Analytics",openai,San Francisco,0.4402,2026-06-17,https://jobs.ashbyhq.com/openai/c59e2e83-59a6-45bc-82cd-665c6a8a5761
"Site Leader, R2L",amazon,"US, NY, New York",0.44,2026-06-17,https://www.amazon.jobs/en/jobs/10451513/site-leader-r2l
"Product Data Scientist, Payments",uber,"San Francisco, California, United States; Sunnyvale, California, United States",0.4395,2026-06-17,https://www.uber.com/global/en/careers/list/153784/
Senior Software Engineer - Maps & Localization - AV Labs,uber,"Sunnyvale, California, United States",0.4393,2026-06-17,https://www.uber.com/global/en/careers/list/157310/
"Senior Software Engineer, Uber AI Solutions",uber,"San Francisco, California, United States; Sunnyvale, California, United States",0.4387,2026-06-17,https://www.uber.com/global/en/careers/list/152677/
"Sr Applications Developer, Oracle Recruiting",uber,"Seattle, Washington, United States; San Francisco, California, United States",0.4383,2026-06-17,https://www.uber.com/global/en/careers/list/160163/
"Data Center Controls Tech, Controls Deployment Service",amazon,"US, IN, New Carlisle",0.4349,2026-06-17,https://www.amazon.jobs/en/jobs/10451966/data-center-controls-tech-controls-deployment-service
"Data Science II, InsurTech",uber,"San Francisco, California, United States; Sunnyvale, California, United States",0.4342,2026-06-17,https://www.uber.com/global/en/careers/list/153482/
"Sr Software Engineer - AV Data Quality, AV Labs",uber,"Sunnyvale, California, United States",0.4298,2026-06-17,https://www.uber.com/global/en/careers/list/156593/
"Account Director, Large Enterprise",openai,"Stockholm, Sweden",0.4279,2026-06-17,https://jobs.ashbyhq.com/openai/6aa5b751-d949-434e-8fc7-1991d8112071
"ML Compute Efficiency Automation Engineer, Infrastructure & Planning",apple,,0.4276,2026-06-17,https://jobs.apple.com/en-us/details/200669000-0836/ml-compute-efficiency-automation-engineer-infrastructure-planning?team=MLAI
"Manager II, Science - Delivery",uber,"New York, New York, United States; San Francisco, California, United States",0.4272,2026-06-17,https://www.uber.com/global/en/careers/list/150271/
"Senior UX Designer, Prime Video",amazon,"US, CA, Sunnyvale",0.4259,2026-06-17,https://www.amazon.jobs/en/jobs/10451498/senior-ux-designer-prime-video
Communication Program Manager,microsoft,"United States, Multiple Locations, Multiple Locations; United States, Washington, Redmond",0.4256,2026-06-17,https://apply.careers.microsoft.com/careers/job/1970393556867044
"Development Lab Test Engineer, Amazon Leo OISL",amazon,"US, CA, Northridge",0.4228,2026-06-17,https://www.amazon.jobs/en/jobs/10452146/development-lab-test-engineer-amazon-leo-oisl
"Account Director, Digital Natives - Nordics",openai,"Stockholm, Sweden",0.4226,2026-06-17,https://jobs.ashbyhq.com/openai/4e51e1ac-3fe0-46b5-b036-6143826ecfa5
"Applied Scientist II, Safety",uber,"San Francisco, California, United States",0.4198,2026-06-17,https://www.uber.com/global/en/careers/list/153481/
Sr. Executive Recruiter,uber,"San Francisco, California, United States",0.4194,2026-06-17,https://www.uber.com/global/en/careers/list/155532/
"Program Manager, Site Technology",uber,"New York, New York, United States",0.4192,2026-06-17,https://www.uber.com/global/en/careers/list/147866/
"Sr Software Engineer, Grocery & Retail",uber,"New York, New York, United States",0.4188,2026-06-17,https://www.uber.com/global/en/careers/list/156730/
Business System Analyst : ServiceNow People Operations,uber,"San Francisco, California, United States; Sunnyvale, California, United States",0.4169,2026-06-17,https://www.uber.com/global/en/careers/list/154737/
"Sr. Associate, GCO, WFS-GCO, ACCS",amazon,"US, AZ, Tempe",0.4169,2026-06-17,https://www.amazon.jobs/en/jobs/10451653/sr-associate-gco-wfs-gco-accs
Strategic Account Executive,microsoft,"United States, Multiple Locations, Multiple Locations",0.4168,2026-06-17,https://apply.careers.microsoft.com/careers/job/1970393556862658
Staff Software Engineer - Risk and Payment Team (Backend),uber,"Sunnyvale, California, United States",0.4166,2026-06-17,https://www.uber.com/global/en/careers/list/156408/
"Senior Product Manager, Earner Intelligence",uber,"San Francisco, California, United States; Sunnyvale, California, United States",0.4161,2026-06-17,https://www.uber.com/global/en/careers/list/154204/
"Network Support Specialist, eero CS",amazon,"US, ID, Boise",0.4127,2026-06-17,https://www.amazon.jobs/en/jobs/10451737/network-support-specialist-eero-cs
Software Engineer II - AI Platform,uber,"Seattle, Washington, United States; San Francisco, California, United States; Sunnyvale, California, United States",0.4104,2026-06-17,https://www.uber.com/global/en/careers/list/155273/
AI Knowledge Architect,uber,"Seattle, Washington, United States; San Francisco, California, United States; Sunnyvale, California, United States",0.4088,2026-06-17,https://www.uber.com/global/en/careers/list/156604/
Staff Machine Learning Engineer,uber,"New York, New York, United States; San Francisco, California, United States; Sunnyvale, California, United States",0.4077,2026-06-17,https://www.uber.com/global/en/careers/list/153370/
"Senior Scientist, Delivery (Multiple Teams)",uber,"New York, New York, United States; San Francisco, California, United States; Sunnyvale, California, United States",0.4063,2026-06-17,https://www.uber.com/global/en/careers/list/155598/
"Sr. Scientist, UberEats Applied AI (Machine Learning)",uber,"San Francisco, California, United States; Sunnyvale, California, United States",0.4062,2026-06-17,https://www.uber.com/global/en/careers/list/154640/
"Manager, Strategy & Planning, Uber Advertising",uber,"New York, New York, United States; San Francisco, California, United States; Chicago, Illinois, United States",0.4033,2026-06-17,https://www.uber.com/global/en/careers/list/156115/
iOS Senior Software Engineer,uber,"Sunnyvale, California, United States",0.4011,2026-06-17,https://www.uber.com/global/en/careers/list/156312/
"Equipment and Inventory Planner, Data Center Construction",meta,"Menlo Park, CA; San Francisco, CA",0.4007,2026-06-17,https://www.metacareers.com/jobs/1004845372555628/
"Full Stack Software Engineer, Agent Enablement",openai,San Francisco,0.3999,2026-06-17,https://jobs.ashbyhq.com/openai/2d7f1028-ce9b-49c7-acc8-782714ca1cf4
"Senior Software Engineer, Agentic AI",nvidia,"US, CA, Santa Clara; US, TX, Austin; US, NC, Remote; US, TX, Remote; US, NY, Remote; US, NC, Durham",0.3989,2026-06-17,https://nvidia.wd5.myworkdayjobs.com/NVIDIAExternalCareerSite/job/US-CA-Santa-Clara/Senior-Software-Engineer--Agentic-AI_JR2017340
Software Engineer - Fulfillment Shopping & Ordering,uber,"San Francisco, California, United States; Sunnyvale, California, United States",0.3988,2026-06-17,https://www.uber.com/global/en/careers/list/156891/
"Staff ML Engineer, Generative AI",uber,"Sunnyvale, California, United States",0.3984,2026-06-17,https://www.uber.com/global/en/careers/list/152899/
Software Engineer II,uber,"Sunnyvale, California, United States",0.3983,2026-06-17,https://www.uber.com/global/en/careers/list/154195/
Research Engineer - Automated Lab Development,meta,"Redmond, WA",0.3975,2026-06-17,https://www.metacareers.com/jobs/1650570196176691/
"Enterprise Account Executive, Industries Generalist",anthropic,"Munich, Germany",0.3933,2026-06-17,https://job-boards.greenhouse.io/anthropic/jobs/5223738008
Area Maintenance Manager,amazon,"US, TN, Mt. Juliet",0.3921,2026-06-17,https://www.amazon.jobs/en/jobs/10451482/area-maintenance-manager
Principal Engineer - AI Tools,uber,"Sunnyvale, California, United States; San Francisco, California, United States; Seattle, Washington, United States",0.391,2026-06-17,https://www.uber.com/global/en/careers/list/147251/
AI & Data Security Engineer,apple,,0.3902,2026-06-17,https://jobs.apple.com/en-us/details/200668245-0157/ai-data-security-engineer?team=SLDEV
"Scientist II, Delivery (Multiple Teams)",uber,"New York, New York, United States; San Francisco, California, United States",0.3874,2026-06-17,https://www.uber.com/global/en/careers/list/155633/
"Prime Air Sr. Maintenance Technician, Amazon Prime Air",amazon,"US, CA, Beaumont",0.3871,2026-06-17,https://www.amazon.jobs/en/jobs/10452150/prime-air-sr-maintenance-technician-amazon-prime-air
Staff Software Engineer (Backend) - Gen AI,uber,"San Francisco, California, United States; Sunnyvale, California, United States",0.3869,2026-06-17,https://www.uber.com/global/en/careers/list/155659/
Executive Sourcer,uber,"New York, New York, United States; San Francisco, California, United States",0.3862,2026-06-17,https://www.uber.com/global/en/careers/list/155596/
"Conversion 2026 PhD Software Engineer II, United States",uber,"Seattle, Washington, United States; San Francisco, California, United States",0.3856,2026-06-17,https://www.uber.com/global/en/careers/list/155186/
"Quality Assurance Engineer, WW Manufacturing Quality & Standards",amazon,"US, TX, Irving",0.3829,2026-06-17,https://www.amazon.jobs/en/jobs/10452114/quality-assurance-engineer-ww-manufacturing-quality-standards
Senior Strategy and Operations Manager,uber,"New York, New York, United States; San Francisco, California, United States; Chicago, Illinois, United States; Sunnyvale, California, United States",0.3826,2026-06-17,https://www.uber.com/global/en/careers/list/156925/
"Manager II, Science - Marketplace/Membership",uber,"San Francisco, California, United States",0.3769,2026-06-17,https://www.uber.com/global/en/careers/list/155221/
Software Engineer,uber,"San Francisco, California, United States",0.3758,2026-06-17,https://www.uber.com/global/en/careers/list/112482/
Sr. Machine Learning Engineer - Finance,apple,,0.3711,2026-06-17,https://jobs.apple.com/en-us/details/200647728-0157/sr-machine-learning-engineer-finance?team=CORSV
Software Engineer II,uber,"Sunnyvale, California, United States",0.3699,2026-06-17,https://www.uber.com/global/en/careers/list/155128/
"Software Development Manager, Embedded SW, Amazon Leo",amazon,"US, WA, Redmond",0.3678,2026-06-17,https://www.amazon.jobs/en/jobs/10452122/software-development-manager-embedded-sw-amazon-leo
"Senior Product Manager, Core Consumer Experience",uber,"New York, New York, United States; San Francisco, California, United States; Sunnyvale, California, United States",0.3673,2026-06-17,https://www.uber.com/global/en/careers/list/154381/
"Applied Scientist I, Sponsored Products and Brands Agent",amazon_science,"US, NY, New York",0.3669,2026-06-17,https://www.amazon.jobs/jobs/10451121/applied-scientist-i-sponsored-products-and-brands-agent?cmpid=bsp-amazon-science
"AI Deployment Engineer, Startups",openai,"Stockholm, Sweden",0.3648,2026-06-17,https://jobs.ashbyhq.com/openai/b76848b3-d545-40cc-b8b4-585501f09760
"Area Manager, SSD",amazon,"US, IL, Bolingbrook",0.3648,2026-06-17,https://www.amazon.jobs/en/jobs/10451299/area-manager-ssd
Event Production Specialist,uber,"New York, New York, United States",0.3641,2026-06-17,https://www.uber.com/global/en/careers/list/155208/
"Staff Software Engineer, Backend",uber,"Sunnyvale, California, United States",0.3632,2026-06-17,https://www.uber.com/global/en/careers/list/156943/
Event Production Specialist,uber,"San Francisco, California, United States",0.3625,2026-06-17,https://www.uber.com/global/en/careers/list/155210/
Sr Staff Software Engineer - Kubernetes,uber,"Sunnyvale, California, United States",0.3604,2026-06-17,https://www.uber.com/global/en/careers/list/151222/
Staff Software Engineer,uber,"Seattle, Washington, United States; Sunnyvale, California, United States",0.3595,2026-06-17,https://www.uber.com/global/en/careers/list/153377/
Senior Applications Engineer - CRM,uber,"New York, New York, United States; San Francisco, California, United States; Sunnyvale, California, United States",0.3566,2026-06-17,https://www.uber.com/global/en/careers/list/154625/
"Flight Monitor, Amazon - Prime Air",amazon,"US, CA, Tracy",0.3559,2026-06-17,https://www.amazon.jobs/en/jobs/10451857/flight-monitor-amazon-prime-air
Senior Technical Program Manager (Supercomputing Operations),microsoft,"United States, Multiple Locations, Multiple Locations",0.3559,2026-06-17,https://apply.careers.microsoft.com/careers/job/1970393556855691
Scientist II - Reservations,uber,"Seattle, Washington, United States",0.3557,2026-06-17,https://www.uber.com/global/en/careers/list/154550/
"Manager, Sales Operations - Global Delivery Partners",uber,"New York, New York, United States; Seattle, Washington, United States; San Francisco, California, United States; Chicago, Illinois, United States",0.3548,2026-06-17,https://www.uber.com/global/en/careers/list/155709/
"Power Test Engineer, Satellite Power Hardware-In-The-Loop, Amazon Leo",amazon,"US, WA, Redmond",0.353,2026-06-17,https://www.amazon.jobs/en/jobs/10451840/power-test-engineer-satellite-power-hardware-in-the-loop-amazon-leo
"Jr. Localization Executive, Global Localization ",amazon,"US, CA, Culver City",0.3518,2026-06-17,https://www.amazon.jobs/en/jobs/10451503/jr-localization-executive-global-localization
Senior Engineering Manager - Payments,uber,"Sunnyvale, California, United States",0.3516,2026-06-17,https://www.uber.com/global/en/careers/list/152946/
Senior Software Engineer,uber,"Seattle, Washington, United States; San Francisco, California, United States; Sunnyvale, California, United States",0.3511,2026-06-17,https://www.uber.com/global/en/careers/list/155442/
"Program Manager, Technology Capital Builds",openai,"London, UK",0.351,2026-06-17,https://jobs.ashbyhq.com/openai/6351bb6b-992d-4c4e-983d-612d91ede046
"Applied Scientist, Marketing Measurement",uber,"New York, New York, United States; San Francisco, California, United States",0.3508,2026-06-17,https://www.uber.com/global/en/careers/list/153133/
"Network Engineer, Foundation Services Automation",meta,"Denver, CO +3 locations",0.3502,2026-06-17,https://www.metacareers.com/profile/job_details/867921566370722
Executive Tech Support,uber,"New York, New York, United States",0.3499,2026-06-17,https://www.uber.com/global/en/careers/list/149949/
"Prime Air Maintenance Technician, Amazon Prime Air",amazon,"US, LA, Baton Rouge",0.3495,2026-06-17,https://www.amazon.jobs/en/jobs/10451979/prime-air-maintenance-technician-amazon-prime-air
Software Technical Leader - Web Platform & Agentic Experiences - IT,mercadolibre,"Bogotá,Colombia",0.3472,2026-06-17,https://mercadolibre.eightfold.ai/careers/job/41911354
Regional Operations Manager,uber,"New York, New York, United States",0.3468,2026-06-17,https://www.uber.com/global/en/careers/list/146462/
Machine Learning Engineer II,uber,"New York, New York, United States; San Francisco, California, United States; Sunnyvale, California, United States",0.3463,2026-06-17,https://www.uber.com/global/en/careers/list/156021/
Senior Staff Software Engineer - Financial Products (Backend),uber,"Sunnyvale, California, United States",0.345,2026-06-17,https://www.uber.com/global/en/careers/list/150193/
Senior Product Manager - Autonomous Experience,uber,"New York, New York, United States; San Francisco, California, United States",0.3442,2026-06-17,https://www.uber.com/global/en/careers/list/156077/
Data Engineer - Battery Data Platform & AI,apple,,0.3423,2026-06-17,https://jobs.apple.com/en-us/details/200668472-0836/data-engineer-battery-data-platform-ai?team=HRDWR
UX Technical Leader  - Platform Experience,mercadolibre,"Buenos Aires,Argentina",0.3407,2026-06-17,https://mercadolibre.eightfold.ai/careers/job/41955750
Senior Computer Vision / Machine Learning Engineer - 3D Vision & Perception,apple,,0.3379,2026-06-17,https://jobs.apple.com/en-us/details/200668959-3956/senior-computer-vision-machine-learning-engineer-3d-vision-perception?team=MLAI
"Software Performance Engineer, Vision Products Group",apple,,0.3356,2026-06-17,https://jobs.apple.com/en-us/details/200668719-3956/software-performance-engineer-vision-products-group?team=SFTWR
"Manager, Technical Program Management - Content & Business Products",netflix,"Los Gatos,California,United States of America; Los Angeles,California,United States of America",0.3352,2026-06-17,https://explore.jobs.netflix.net/careers/job/790316469294
"DSP and Wireless Systems Engineer, Digital RF Systems",amazon,"US, CA, San Diego",0.3348,2026-06-17,https://www.amazon.jobs/en/jobs/10451692/dsp-and-wireless-systems-engineer-digital-rf-systems
"Senior Structural Design Analysis Engineer, Structural Design Integrity",amazon_science,"US, CA, Sunnyvale",0.3345,2026-06-17,https://www.amazon.jobs/jobs/10450600/senior-structural-design-analysis-engineer-structural-design-integrity?cmpid=bsp-amazon-science
"Software Application Support Engineer, Retail Engineering",apple,,0.3342,2026-06-17,https://jobs.apple.com/en-us/details/200624020-3956/software-application-support-engineer-retail-engineering?team=SFTWR
"Manager, Portfolio Delivery & Operations - G&A Solutions Engineering",apple,,0.3332,2026-06-17,https://jobs.apple.com/en-us/details/200667839-3956/manager-portfolio-delivery-operations-g-a-solutions-engineering?team=SFTWR
"Sr Software Engineer, Backend (AV and AI)",uber,"Sunnyvale, California, United States",0.3329,2026-06-17,https://www.uber.com/global/en/careers/list/156945/
Sr Sales Strategy & Planning Associate - Global Delivery Partners,uber,"New York, New York, United States; Seattle, Washington, United States; San Francisco, California, United States; Chicago, Illinois, United States",0.3328,2026-06-17,https://www.uber.com/global/en/careers/list/155711/
"Senior Research Manager, Multimodal Reasoning - SIML",apple,,0.3326,2026-06-17,https://jobs.apple.com/en-us/details/200657558-0836/senior-research-manager-multimodal-reasoning-siml?team=MLAI
"Senior Analyst, Finance Transformation",uber,"New York, New York, United States; San Francisco, California, United States",0.3304,2026-06-17,https://www.uber.com/global/en/careers/list/156280/
Software Engineer II - Azure Resource Graph,microsoft,"United States, Multiple Locations, Multiple Locations",0.3297,2026-06-17,https://apply.careers.microsoft.com/careers/job/1970393556847405
Senior Machine Learning Engineer - Ads,uber,"San Francisco, California, United States; New York, New York, United States",0.3291,2026-06-17,https://www.uber.com/global/en/careers/list/152623/
Forward Deployed Engineer - Madrid,openai,"Madrid, Spain",0.3283,2026-06-17,https://jobs.ashbyhq.com/openai/2218158b-f103-4d85-b4f9-e0f2983d6849
"Staff Machine Learning Engineer, Notifications Relevance",reddit,Remote - United States,0.3281,2026-06-17,https://job-boards.greenhouse.io/reddit/jobs/7992035
"Machine Learning Applied Researcher - Speech, Vision and Audio",apple,,0.3279,2026-06-17,https://jobs.apple.com/en-us/details/200668104-1242/machine-learning-applied-researcher-speech-vision-and-audio?team=HRDWR
"Machine Learning Applied Researcher - Speech, Vision and Audio",apple,,0.3279,2026-06-17,https://jobs.apple.com/en-us/details/200668423-1242/machine-learning-applied-researcher-speech-vision-and-audio?team=HRDWR
"Lead, Advertising Measurement (Australia)",reddit,"Sydney, Australia",0.3271,2026-06-17,https://job-boards.greenhouse.io/reddit/jobs/8013849
"Manager II, Engineering - Uber",uber,"San Francisco, California, United States; Sunnyvale, California, United States",0.3271,2026-06-17,https://www.uber.com/global/en/careers/list/156186/
Senior Software Engineer,uber,"San Francisco, California, United States; Sunnyvale, California, United States",0.3257,2026-06-17,https://www.uber.com/global/en/careers/list/156681/
"Android Engineer, Growth",openai,San Francisco,0.3233,2026-06-17,https://jobs.ashbyhq.com/openai/57bbaedc-30c1-4f1d-b194-e32a6adf874c
"Engineering Manager II, Marketplace Matching",uber,"San Francisco, California, United States",0.3232,2026-06-17,https://www.uber.com/global/en/careers/list/156252/
"Coordinator, Training - Netflix Animation Studios",netflix,"Sydney,Australia",0.3216,2026-06-17,https://explore.jobs.netflix.net/careers/job/790316472998
"Program Manager II, Tech - Enterprise Applications",uber,"San Francisco, California, United States; Sunnyvale, California, United States",0.3214,2026-06-17,https://www.uber.com/global/en/careers/list/155212/
"Senior Product Manager, AI platform (Michelangelo)",uber,"Seattle, Washington, United States; San Francisco, California, United States; Sunnyvale, California, United States",0.3197,2026-06-17,https://www.uber.com/global/en/careers/list/155916/
"Manager, Business Enablement - Finance & Accounting",uber,"Dallas, Texas, United States; New York, New York, United States; San Francisco, California, United States",0.3194,2026-06-17,https://www.uber.com/global/en/careers/list/154523/
"Prime Air Flight Monitor, Amazon Prime Air",amazon,"US, LA, Baton Rouge",0.3149,2026-06-17,https://www.amazon.jobs/en/jobs/10451567/prime-air-flight-monitor-amazon-prime-air
"Staff Software Engineer, Financial Products",uber,"Sunnyvale, California, United States",0.3144,2026-06-17,https://www.uber.com/global/en/careers/list/155466/
Senior Applied Scientist,uber,"New York, New York, United States; San Francisco, California, United States",0.3126,2026-06-17,https://www.uber.com/global/en/careers/list/154193/
"Business Operations Manager, Applied AI Engineering",meta,"Menlo Park, CA +2 locations",0.3119,2026-06-17,https://www.metacareers.com/profile/job_details/1036791622252778
"2026 Mobility Strategy & Planning Fall Intern, Vanderbilt",uber,"New York, New York, United States",0.3117,2026-06-17,https://www.uber.com/global/en/careers/list/154332/
"Security Engineer, Leo Security",amazon,"US, WA, Redmond",0.3115,2026-06-17,https://www.amazon.jobs/en/jobs/10451585/security-engineer-leo-security
Director of Product Operations,apple,,0.3113,2026-06-17,https://jobs.apple.com/en-us/details/200668919-0836/director-of-product-operations?team=SFTWR
"Network Engineer, Foundation & Support",meta,"Denver, CO +2 locations",0.3102,2026-06-17,https://www.metacareers.com/profile/job_details/1931634864176064
Administrative Business Partner,openai,San Francisco,0.3091,2026-06-17,https://jobs.ashbyhq.com/openai/9dfe4c27-84c0-4150-9ebe-8d4f12a95404
Senior CoreOS Engineer - AppleCare Enterprise Services,apple,Various Locations within Austin Metro Area,0.3088,2026-06-17,https://jobs.apple.com/en-us/details/200659687-0240/senior-coreos-engineer-applecare-enterprise-services?team=SFTWR
"Marketing Technology Manager II, Delivery Paid Channels",uber,"San Francisco, California, United States",0.3009,2026-06-17,https://www.uber.com/global/en/careers/list/153541/
Security Engineer (AI & Agentic Systems),uber,"New York, New York, United States; Seattle, Washington, United States; San Francisco, California, United States; Sunnyvale, California, United States",0.2971,2026-06-17,https://www.uber.com/global/en/careers/list/154044/
"Principal Research Scientist, Siri Innovation Studio",apple,,0.2957,2026-06-17,https://jobs.apple.com/en-us/details/200667331-3337/principal-research-scientist-siri-innovation-studio?team=MLAI
Production Engineer,meta,"London, UK",0.2953,2026-06-17,https://www.metacareers.com/profile/job_details/2128857390817250
"Darwin Runtime Engineer, Core OS",apple,,0.2924,2026-06-17,https://jobs.apple.com/en-us/details/200668853-0836/darwin-runtime-engineer-core-os?team=SFTWR
"Security Engineer, Detection & Response",anthropic,"San Francisco, CA",0.2921,2026-06-17,https://job-boards.greenhouse.io/anthropic/jobs/4982193008
"Technical Program Manager - Games Social, Trust and Safety",netflix,USA - Remote,0.292,2026-06-17,https://explore.jobs.netflix.net/careers/job/790316473015
2026 Account Management Intern - US,uber,"Chicago, Illinois, United States; Washington, District of Columbia, United States",0.2918,2026-06-17,https://www.uber.com/global/en/careers/list/157087/
"Engagement Lead, Global Membership",uber,"New York, New York, United States; San Francisco, California, United States",0.2915,2026-06-17,https://www.uber.com/global/en/careers/list/156506/
"Manager, Auto Insurance Forms",uber,"San Francisco, California, United States; Chicago, Illinois, United States; New York, New York, United States",0.2915,2026-06-17,https://www.uber.com/global/en/careers/list/152341/
"Sr Software Engineer - Backend, Marketplace/Maps/Membership/AV",uber,"Sunnyvale, California, United States; San Francisco, California, United States; Seattle, Washington, United States; New York, New York, United States",0.29,2026-06-17,https://www.uber.com/global/en/careers/list/153471/
"Senior Account Executive, Hero Accounts",uber,"Miami, Florida, United States",0.2898,2026-06-17,https://www.uber.com/global/en/careers/list/153493/
"Research Engineer/Research Scientist, Audio",anthropic,"San Francisco, CA",0.2894,2026-06-17,https://job-boards.greenhouse.io/anthropic/jobs/5074815008
