title,company,location,semantic_similarity,first_seen_date,url
"Applied Scientist, GenAI Catalog Intelligence, PRISM",amazon,"US, CA, Sunnyvale",0.6261,2026-07-21,https://www.amazon.jobs/en/jobs/10480445/applied-scientist-genai-catalog-intelligence-prism
"Sr.  Applied Scientist, Amazon Customer Service",amazon,"US, WA, Seattle",0.6007,2026-07-21,https://www.amazon.jobs/en/jobs/10480530/sr-applied-scientist-amazon-customer-service
Principal Account-Aligned FDE Data Science,microsoft,"United States, Multiple Locations, Multiple Locations",0.5928,2026-07-21,https://apply.careers.microsoft.com/careers/job/1970393556940405
Principal Partner Enablement Program Manager,microsoft,"United States, Multiple Locations, Multiple Locations",0.5521,2026-07-21,https://apply.careers.microsoft.com/careers/job/1970393556939423
"Principal Games Industry Business Development Specialist, North America, Media & Entertainment, Games, Advertising and Sports Business Unit",amazon,"US, CA, Santa Monica",0.5456,2026-07-21,https://www.amazon.jobs/en/jobs/10480640/principal-games-industry-business-development-specialist-north-america-media-entertainment-games-advertising-and-sports-business-unit
"Software Development Engineer, AWS Marketplace & Partner Services",amazon,"US, WA, Seattle",0.5353,2026-07-21,https://www.amazon.jobs/en/jobs/10479999/software-development-engineer-aws-marketplace-partner-services
"Construction Manager , AMER SE",amazon,"US, VA, Chantilly",0.5347,2026-07-21,https://www.amazon.jobs/en/jobs/10479460/construction-manager-amer-se
"Data Center Technician , DCC Communities ",amazon,"US, GA, Covington",0.5336,2026-07-21,https://www.amazon.jobs/en/jobs/10479548/data-center-technician-dcc-communities
"Marketing Technology Program Manager, Global Channel Partner Sales",microsoft,"United States, Washington, Redmond; United States, Multiple Locations, Multiple Locations",0.5307,2026-07-21,https://apply.careers.microsoft.com/careers/job/1970393556923404
"Data Scientist II, AMZL, Central Learning Solutions Science",amazon_science,"US, WA, Bellevue",0.5282,2026-07-21,https://www.amazon.jobs/jobs/10479689/data-scientist-ii-amzl-central-learning-solutions-science?cmpid=bsp-amazon-science
"SAP MM & Logistics Architect, AWS SAP Team",amazon,"US, WA, Seattle",0.5252,2026-07-21,https://www.amazon.jobs/en/jobs/10480042/sap-mm-logistics-architect-aws-sap-team
"ID Storm Tech, ID Storm",amazon,"US, VA, Herndon",0.5206,2026-07-21,https://www.amazon.jobs/en/jobs/10479639/id-storm-tech-id-storm
"Sr. Account Manager-RRT, Startups",amazon,"US, CA, San Francisco",0.5196,2026-07-21,https://www.amazon.jobs/en/jobs/10479993/sr-account-manager-rrt-startups
"Sr. Account Manager-RRT, Startups",amazon,"US, NY, New York",0.5191,2026-07-21,https://www.amazon.jobs/en/jobs/10479991/sr-account-manager-rrt-startups
Principal Execution Program Manager,microsoft,"United States, Multiple Locations, Multiple Locations; United States, Illinois, Chicago; United States, Indiana, Indianapolis",0.5178,2026-07-21,https://apply.careers.microsoft.com/careers/job/1970393556933153
"Account Manager-RRT, Startups",amazon,"US, CA, San Francisco",0.5177,2026-07-21,https://www.amazon.jobs/en/jobs/10479994/account-manager-rrt-startups
"Sr. Delivery Practice Manager - Application Modernization, AWS Professional Services",amazon,"US, MN, Minneapolis",0.5175,2026-07-21,https://www.amazon.jobs/en/jobs/10480660/sr-delivery-practice-manager-application-modernization-aws-professional-services
"Account Manager-RRT, Startups",amazon,"US, NY, New York",0.5167,2026-07-21,https://www.amazon.jobs/en/jobs/10479992/account-manager-rrt-startups
"Applied Scientist , Amazon Customer Service",amazon,"US, WA, Seattle",0.514,2026-07-21,https://www.amazon.jobs/en/jobs/10480526/applied-scientist-amazon-customer-service
"Data Center Technician, DCC Communities ",amazon,"US, GA, Covington",0.5074,2026-07-21,https://www.amazon.jobs/en/jobs/10479557/data-center-technician-dcc-communities
Data Center Technician ,amazon,"US, GA, Covington",0.5064,2026-07-21,https://www.amazon.jobs/en/jobs/10479531/data-center-technician
"Senior Engagement Manager, Worldwide Public Sector Professional Services, FedFin",amazon,"US, VA, Arlington",0.5062,2026-07-21,https://www.amazon.jobs/en/jobs/10480182/senior-engagement-manager-worldwide-public-sector-professional-services-fedfin
"Manager, Strategic Sourcing , Silicon Operations",amazon,"US, CA, Sunnyvale",0.5038,2026-07-21,https://www.amazon.jobs/en/jobs/10479701/manager-strategic-sourcing-silicon-operations
"Engineering Manager, AI Developer Technology",nvidia,"US, CA, Santa Clara; US, MA, Westford; US, TX, Austin; US, OR, Hillsboro; US, NC, Durham",0.4969,2026-07-21,https://nvidia.wd5.myworkdayjobs.com/NVIDIAExternalCareerSite/job/US-CA-Santa-Clara/Engineering-Manager--AI-Developer-Technology_JR1995883
"Sr. System Development Engineer, AWS EC2 Manufacturing Infrastructure Services",amazon,"US, CA, Cupertino",0.4955,2026-07-21,https://www.amazon.jobs/en/jobs/10480694/sr-system-development-engineer-aws-ec2-manufacturing-infrastructure-services
"Sr. Data Scientist, OTS - Data ANCHOR Team",amazon_science,"US, TX, Austin",0.4935,2026-07-21,https://www.amazon.jobs/jobs/10478504/sr-data-scientist-ots--data-anchor-team?cmpid=bsp-amazon-science
"Data Center Controls Engineer, Data Center Capacity Delivery",amazon,"US, PA, Berwick",0.4896,2026-07-21,https://www.amazon.jobs/en/jobs/10480126/data-center-controls-engineer-data-center-capacity-delivery
"Automation Engineering Manager, NASC RME",amazon,"US, AZ, Phoenix",0.488,2026-07-21,https://www.amazon.jobs/en/jobs/10480518/automation-engineering-manager-nasc-rme
"Director, Global SMB Strategy & Growth- Cloud & AI Platforms",microsoft,"United States, Washington, Redmond; United States, Multiple Locations, Multiple Locations",0.4859,2026-07-21,https://apply.careers.microsoft.com/careers/job/1970393556914897
Cloud Solution Architect - AI Apps,microsoft,"United States, Multiple Locations, Multiple Locations; United States, Washington, Redmond; United States, Georgia, Atlanta; United States, Texas, Dallas",0.4805,2026-07-21,https://apply.careers.microsoft.com/careers/job/1970393556928861
"Senior Applied Scientist, Selling Partner Selection Success",amazon_science,"US, WA, Seattle",0.4795,2026-07-21,https://www.amazon.jobs/jobs/10479599/senior-applied-scientist-selling-partner-selection-success?cmpid=bsp-amazon-science
"NW Deployment Build Lead I, DC Global Network Delivery",amazon,"US, PA, Berwick",0.4794,2026-07-21,https://www.amazon.jobs/en/jobs/10480459/nw-deployment-build-lead-i-dc-global-network-delivery
"Power and Performance Validation Engineer, Annapurna Labs",amazon,"US, TX, Austin",0.4791,2026-07-21,https://www.amazon.jobs/en/jobs/10479590/power-and-performance-validation-engineer-annapurna-labs
Project Engineer,amazon,"US, VA, Stafford",0.4771,2026-07-21,https://www.amazon.jobs/en/jobs/10479866/project-engineer
"Global Account Manager, Global Financial Services ",amazon,"US, NY, New York",0.4684,2026-07-21,https://www.amazon.jobs/en/jobs/10480650/global-account-manager-global-financial-services
"Senior Account Manager, Hyperscale and AI Natives",nvidia,"US, CA, Santa Clara; US, CA, Remote",0.4675,2026-07-21,https://nvidia.wd5.myworkdayjobs.com/NVIDIAExternalCareerSite/job/US-CA-Santa-Clara/Senior-Account-Manager--Hyperscale-and-AI-Natives_JR2021513
"Infra Delivery Install Technician, ID Storm",amazon,"US, VA, Herndon",0.467,2026-07-21,https://www.amazon.jobs/en/jobs/10479644/infra-delivery-install-technician-id-storm
"Research Program Manager, Human Data Campaigns",openai,San Francisco,0.4656,2026-07-21,https://jobs.ashbyhq.com/openai/5edd5a13-2fc9-427c-ad88-2b67c97a0afe
Localization Program Manager,amazon,"US, CA, San Francisco",0.4624,2026-07-21,https://www.amazon.jobs/en/jobs/10480523/localization-program-manager
Principal Partner Engineer — Ecosystem,canva,"Texas, KY, United States",0.4575,2026-07-21,https://jobs.smartrecruiters.com/Canva/6000000001247048-principal-partner-engineer-ecosystem
"Senior Manager, Customer Program Management– Datacenter Engineering and Operations",nvidia,"US, CA, Remote; US, TX, Remote; US, WA, Remote",0.4527,2026-07-21,https://nvidia.wd5.myworkdayjobs.com/NVIDIAExternalCareerSite/job/US-CA-Remote/Senior-Manager--Customer-Program-Management--Datacenter-Engineering-and-Operations_JR2021754
Digital AI Workforce Specialist,microsoft,"United States, Multiple Locations, Multiple Locations; United States, Georgia, Atlanta; United States, Texas, Dallas; United States, North Dakota, Fargo; United States, Washington, Seattle; United States, California, San Diego; United States, Arizona, Phoenix; United States, Colorado, Denver; United States, Illinois, Chicago; United States, Texas, Austin; United States, Florida, Fort Lauderdale",0.4526,2026-07-21,https://apply.careers.microsoft.com/careers/job/1970393556938181
Backend Engineer - Advertising,spotify,"New York, NY",0.4522,2026-07-21,https://jobs.lever.co/spotify/1689082c-9265-431f-9e55-ef7666e41283
"Applied Scientist II, Sponsored Products Global Optimization",amazon_science,"US, NY, New York",0.452,2026-07-21,https://www.amazon.jobs/jobs/10479345/applied-scientist-ii-sponsored-products-global-optimization?cmpid=bsp-amazon-science
"Federal Account Director, Intelligence Community",openai,"Washington, DC",0.4499,2026-07-21,https://jobs.ashbyhq.com/openai/fd5522f1-8e39-4d60-8b8a-34fae61104cb
"Performance Engineer, Deep Learning and HPC",nvidia,"US, CA, Santa Clara",0.4483,2026-07-21,https://nvidia.wd5.myworkdayjobs.com/NVIDIAExternalCareerSite/job/US-CA-Santa-Clara/Performance-Engineer--Deep-Learning-and-HPC_JR2012264
Senior Developer Technology Engineer - AI,nvidia,"US, CA, Santa Clara; US, MA, Westford; US, TX, Austin; US, OR, Hillsboro; US, NC, Durham; US, CA, Remote",0.4465,2026-07-21,https://nvidia.wd5.myworkdayjobs.com/NVIDIAExternalCareerSite/job/US-CA-Santa-Clara/Senior-Developer-Technology-Engineer---AI_JR1996103
"Staff/Sr. ML Infrastructure Engineer, Foundation Model Compute Infra",apple,,0.4457,2026-07-21,https://jobs.apple.com/en-us/details/200673231-0836/staff-sr-ml-infrastructure-engineer-foundation-model-compute-infra?team=MLAI
Sr. Operations Manager,amazon,"US, IN, Fort Wayne",0.4445,2026-07-21,https://www.amazon.jobs/en/jobs/10479454/sr-operations-manager
Director of Product Design,microsoft,"United States, Multiple Locations, Multiple Locations; United States, Washington, Redmond; United States, California, San Francisco; United States, California, Mountain View",0.4436,2026-07-21,https://apply.careers.microsoft.com/careers/job/1970393556927734
Senior System Software Engineer -  Halos Core and Robotics Platform,nvidia,"US, CA, Santa Clara",0.4427,2026-07-21,https://nvidia.wd5.myworkdayjobs.com/NVIDIAExternalCareerSite/job/US-CA-Santa-Clara/Senior-System-Software-Engineer----Halos-Core-and-Robotics-Platform_JR2021341
Principal Partner Engineer — Ecosystem,canva,"San Francisco, , United States",0.4412,2026-07-21,https://jobs.smartrecruiters.com/Canva/6000000001247040-principal-partner-engineer-ecosystem
"Senior Frontend Engineer, NVIDIA Marketplace",nvidia,"US, CA, Santa Clara",0.4412,2026-07-21,https://nvidia.wd5.myworkdayjobs.com/NVIDIAExternalCareerSite/job/US-CA-Santa-Clara/Senior-Frontend-Engineer--NVIDIA-Marketplace_JR2021196
Customer Learning Program Lead,openai,San Francisco,0.4403,2026-07-21,https://jobs.ashbyhq.com/openai/644bf871-a584-49e2-8545-240313d9c8b9
"Senior Manager, DGX Cloud Technical Program Management",nvidia,"US, CA, Santa Clara; US, WA, Seattle",0.44,2026-07-21,https://nvidia.wd5.myworkdayjobs.com/NVIDIAExternalCareerSite/job/US-CA-Santa-Clara/Senior-Manager--DGX-Cloud-Technical-Program-Management_JR2017452-1
Support Escalation Management,microsoft,"United States, Multiple Locations, Multiple Locations",0.4358,2026-07-21,https://apply.careers.microsoft.com/careers/job/1970393556940456
Site Operations Technician,openai,San Francisco; Seattle,0.4348,2026-07-21,https://jobs.ashbyhq.com/openai/43c9fed6-4eb2-4db6-afc5-cd804279779b
"System Development Engineer, Tech Supply Chain",amazon,"US, TX, Austin",0.4345,2026-07-21,https://www.amazon.jobs/en/jobs/10480414/system-development-engineer-tech-supply-chain
"Staff Software Engineer, Growth ",anthropic,"New York City, NY; San Francisco, CA; Seattle, WA",0.434,2026-07-21,https://job-boards.greenhouse.io/anthropic/jobs/5363469008
Senior Software Engineer,microsoft,"United States, Multiple Locations, Multiple Locations; United States, Washington, Redmond",0.4292,2026-07-21,https://apply.careers.microsoft.com/careers/job/1970393556930463
"Finance Manager, NA Fresh Finance",amazon,"US, WA, Seattle",0.4273,2026-07-21,https://www.amazon.jobs/en/jobs/10479958/finance-manager-na-fresh-finance
"Senior Manager, Product - Perception Data",nvidia,"US, CA, Santa Clara",0.4263,2026-07-21,https://nvidia.wd5.myworkdayjobs.com/NVIDIAExternalCareerSite/job/US-CA-Santa-Clara/Senior-Manager--Product---Perception-Data_JR2021066
"Data Scientist, Security Issue Management",amazon_science,"US, WA, Seattle",0.4254,2026-07-21,https://www.amazon.jobs/jobs/10478998/data-scientist-security-issue-management?cmpid=bsp-amazon-science
"Product Marketing Manager, XBOX Media Solutions",microsoft,"United States, Multiple Locations, Multiple Locations",0.4254,2026-07-21,https://apply.careers.microsoft.com/careers/job/1970393556937429
Mechatronic Apprentice I,amazon,"US, LA, Shreveport",0.4238,2026-07-21,https://www.amazon.jobs/en/jobs/10480178/mechatronic-apprentice-i
"Director, Global SMB Strategy & Growth",microsoft,"United States, Washington, Redmond; United States, Multiple Locations, Multiple Locations",0.4233,2026-07-21,https://apply.careers.microsoft.com/careers/job/1970393556917785
Cloud Sales Enablement Manager,nvidia,"US, CA, Santa Clara; US, CA, Remote",0.4196,2026-07-21,https://nvidia.wd5.myworkdayjobs.com/NVIDIAExternalCareerSite/job/US-CA-Santa-Clara/Cloud-Sales-Enablement-Manager_JR2020098
Field GTM Marketing Manager,microsoft,"United States, Multiple Locations, Multiple Locations",0.4154,2026-07-21,https://apply.careers.microsoft.com/careers/job/1970393556925548
"AI Deployment Engineer, Agent Enablement ",openai,San Francisco,0.4127,2026-07-21,https://jobs.ashbyhq.com/openai/c1a28411-266b-487b-8ef3-03efb254fc36
"Technical Program Manager, AWS Manufacturing",amazon,"US, WA, Bellevue",0.4123,2026-07-21,https://www.amazon.jobs/en/jobs/10479940/technical-program-manager-aws-manufacturing
Senior Compiler Optimization Engineer - MLIR,nvidia,"US, WA, Redmond; US, CA, Santa Clara",0.412,2026-07-21,https://nvidia.wd5.myworkdayjobs.com/NVIDIAExternalCareerSite/job/US-WA-Redmond/Senior-Compiler-Optimization-Engineer---MLIR_JR2021622
Senior System Software Engineer -  Halos Core and Robotics Platform,nvidia,"US, CA, Santa Clara",0.4095,2026-07-21,https://nvidia.wd5.myworkdayjobs.com/NVIDIAExternalCareerSite/job/US-CA-Santa-Clara/Senior-System-Software-Engineer----Halos-Core-and-Robotics-Platform_JR2021237
Senior System Software Engineer – Dynamo Tools,nvidia,"US, CA, Santa Clara; US, TX, Remote; US, NY, Remote; US, CA, Remote; US, MA, Remote",0.4094,2026-07-21,https://nvidia.wd5.myworkdayjobs.com/NVIDIAExternalCareerSite/job/US-CA-Santa-Clara/Senior-System-Software-Engineer---Dynamo-Tools_JR2021520
"Art Director, PV Sports Marketing",amazon,"US, CA, Culver City",0.4072,2026-07-21,https://www.amazon.jobs/en/jobs/10480484/art-director-pv-sports-marketing
Finance Program Manager - M&A,netflix,"Los Gatos,California,United States of America; Los Angeles,California,United States of America",0.4066,2026-07-21,https://explore.jobs.netflix.net/careers/job/790316790147
Senior Systems Software Engineer - Fleet Debuggability,nvidia,"US, CA, Santa Clara",0.4052,2026-07-21,https://nvidia.wd5.myworkdayjobs.com/NVIDIAExternalCareerSite/job/US-CA-Santa-Clara/Senior-Systems-Software-Engineer---Fleet-Debuggability_JR2021461
"Software Engineer (Agentic AI), AI & Data Platforms",apple,,0.4021,2026-07-21,https://jobs.apple.com/en-us/details/200673365-0157/software-engineer-agentic-ai-ai-data-platforms?team=CORSV
Senior Staff Engineer - Enterprise Messaging and Exchange,nvidia,"US, CA, Santa Clara",0.4,2026-07-21,https://nvidia.wd5.myworkdayjobs.com/NVIDIAExternalCareerSite/job/US-CA-Santa-Clara/Senior-Staff-Engineer---Enterprise-Messaging-and-Exchange_JR2021443
"Member of Technical Staff - Robotics Mechanical Engineer, Frontier AI & Robotics ",amazon,"US, CA, San Francisco",0.3993,2026-07-21,https://www.amazon.jobs/en/jobs/10480012/member-of-technical-staff-robotics-mechanical-engineer-frontier-ai-robotics
Business Development Manager,amazon,"US, CA, San Francisco",0.3887,2026-07-21,https://www.amazon.jobs/en/jobs/10480504/business-development-manager
"Senior AI and Machine Learning Engineer, Maps Services Evaluation",apple,,0.3884,2026-07-21,https://jobs.apple.com/en-us/details/200673066-0836/senior-ai-and-machine-learning-engineer-maps-services-evaluation?team=SFTWR
"EACs Portfolio Specialist, Energy Portfolio Operations",amazon,"US, WA, Seattle",0.3853,2026-07-21,https://www.amazon.jobs/en/jobs/10480244/eacs-portfolio-specialist-energy-portfolio-operations
"Senior Applied Scientist, Catalog System Services Science",amazon_science,"US, WA, Seattle",0.3848,2026-07-21,https://www.amazon.jobs/jobs/10479008/senior-applied-scientist-catalog-system-services-science?cmpid=bsp-amazon-science
"Director, Global SMB Strategy & Growth- Security",microsoft,"United States, Washington, Redmond; United States, Multiple Locations, Multiple Locations",0.3843,2026-07-21,https://apply.careers.microsoft.com/careers/job/1970393556914898
"Senior Software Development Manager, DynamoDB",amazon,"US, WA, Seattle",0.3788,2026-07-21,https://www.amazon.jobs/en/jobs/10480585/senior-software-development-manager-dynamodb
Senior Data Science Manager,apple,,0.377,2026-07-21,https://jobs.apple.com/en-us/details/200671821-0836/senior-data-science-manager?team=CORSV
"Compiler Engineer, Infrastructure  - New College Grad 2026",nvidia,"US, CA, Santa Clara; US, TX, Austin; US, TX, Remote; US, WA, Remote; US, CA, Remote; US, WA, Redmond",0.375,2026-07-21,https://nvidia.wd5.myworkdayjobs.com/NVIDIAExternalCareerSite/job/US-CA-Santa-Clara/Compiler-Engineer--Infrastructure----New-College-Grad-2026_JR2021228
"Software Engineer, Recommendation Systems",meta,"Sunnyvale, CA +2 locations",0.3705,2026-07-21,https://www.metacareers.com/profile/job_details/1455995826559478
"AI Deployment Engineer, Global Affairs",openai,"New York City; Washington, DC; San Francisco",0.3701,2026-07-21,https://jobs.ashbyhq.com/openai/8859d8fa-48d8-4e1a-a53f-39e7a58e4522
"Senior Solutions Architect, Networking",nvidia,"US, CA, Santa Clara; US, CA, Remote",0.3692,2026-07-21,https://nvidia.wd5.myworkdayjobs.com/NVIDIAExternalCareerSite/job/US-CA-Santa-Clara/Senior-Solutions-Architect--Networking_JR2021466
Líder Técnico Machine Learning - Search Engine - Marketplace,mercadolibre,Mexico,0.3674,2026-07-21,https://mercadolibre.eightfold.ai/careers/job/43194610
"Communications Manager, Amazon Leo",amazon,"US, VA, Arlington",0.3645,2026-07-21,https://www.amazon.jobs/en/jobs/10480210/communications-manager-amazon-leo
"Associate Principal, Strategic Finance & Analytics",airbnb,United States,0.3641,2026-07-21,https://careers.airbnb.com/positions/8072136/
"Senior Software Development Manager, Amazon S3 Request Processing",amazon,"US, VA, Arlington",0.3549,2026-07-21,https://www.amazon.jobs/en/jobs/10480506/senior-software-development-manager-amazon-s3-request-processing
Senior Software Engineer – Streaming,nvidia,"US, CA, Santa Clara; US, TX, Remote; US, CA, Remote",0.354,2026-07-21,https://nvidia.wd5.myworkdayjobs.com/NVIDIAExternalCareerSite/job/US-CA-Santa-Clara/Senior-Software-Engineer---Streaming_JR2021692
Business Manager,microsoft,"United States, Multiple Locations, Multiple Locations",0.3538,2026-07-21,https://apply.careers.microsoft.com/careers/job/1970393556941232
"DevOps Engineer, G&A Solutions Engineering (GSE)",apple,,0.3498,2026-07-21,https://jobs.apple.com/en-us/details/200650112-0157/devops-engineer-g-a-solutions-engineering-gse?team=SFTWR
"Software Engineer, Ads Integrity",openai,San Francisco,0.3473,2026-07-21,https://jobs.ashbyhq.com/openai/596e543a-0ab9-471e-a1ff-40fd55c74fce
"Manager, Forward Deployed Engineer - Tokyo",openai,"Tokyo, Japan",0.3452,2026-07-21,https://jobs.ashbyhq.com/openai/bef38cc8-b13c-4ca8-8e1c-7d97139efdea
"Director, NVIDIA Compute Sales",nvidia,"US, CA, Santa Clara",0.3444,2026-07-21,https://nvidia.wd5.myworkdayjobs.com/NVIDIAExternalCareerSite/job/US-CA-Santa-Clara/Director--NVIDIA-Compute-Sales_JR2021360
"AIML - Sr Data Scientist, Evaluation",apple,,0.3436,2026-07-21,https://jobs.apple.com/en-us/details/200659433-0836/aiml-sr-data-scientist-evaluation?team=MLAI
"Senior Software Engineer, Partner Onboarding - Apple Services Engineering",apple,,0.343,2026-07-21,https://jobs.apple.com/en-us/details/200673172-0836/senior-software-engineer-partner-onboarding-apple-services-engineering?team=SFTWR
Experience Shipping Sr Analyst,mercadolibre,"Buenos Aires,Argentina",0.3419,2026-07-21,https://mercadolibre.eightfold.ai/careers/job/43288680
"Strategic Program Manager, Office of the CRO",openai,San Francisco,0.3413,2026-07-21,https://jobs.ashbyhq.com/openai/d2164371-83b0-4a39-86b1-f6c497bad175
"Sr. Account Executive - RMG, US LCS, Real Money Gaming",amazon,"US, MA, Boston",0.3404,2026-07-21,https://www.amazon.jobs/en/jobs/10479911/sr-account-executive-rmg-us-lcs-real-money-gaming
Backend Software Engineer - Ads Signals Foundation - IT,mercadolibre,"Buenos Aires,Argentina",0.3402,2026-07-21,https://mercadolibre.eightfold.ai/careers/job/42507267
"Admin Assistant, Ads Engineering",netflix,"Los Gatos,California,United States of America",0.3365,2026-07-21,https://explore.jobs.netflix.net/careers/job/790317278327
"Optical Engineer , Amazon Leo ",amazon,"US, WA, Redmond",0.3365,2026-07-21,https://www.amazon.jobs/en/jobs/10480586/optical-engineer-amazon-leo
"Communications Manager, Monetization",openai,San Francisco,0.3361,2026-07-21,https://jobs.ashbyhq.com/openai/b29816ed-6ffc-4ab4-a98c-7f0e051762e5
"Senior Manager, Systems Software Engineering - GeForce NOW Cloud",nvidia,"US, CA, Santa Clara",0.3309,2026-07-21,https://nvidia.wd5.myworkdayjobs.com/NVIDIAExternalCareerSite/job/US-CA-Santa-Clara/Senior-Manager--Systems-Software-Engineering---GeForce-NOW-Cloud_JR2014496
Senior Deep Learning and Computer Vision Engineer - Autonomous Vehicles,nvidia,"US, CA, Santa Clara; US, WA, Redmond; US, Remote",0.3289,2026-07-21,https://nvidia.wd5.myworkdayjobs.com/NVIDIAExternalCareerSite/job/US-CA-Santa-Clara/Senior-Deep-Learning-and-Computer-Vision-Engineer---Autonomous-Vehicles_JR2021240
Senior Software Engineer - GeForce NOW Video Streaming,nvidia,"US, CA, Santa Clara",0.3235,2026-07-21,https://nvidia.wd5.myworkdayjobs.com/NVIDIAExternalCareerSite/job/US-CA-Santa-Clara/Senior-Software-Engineer---GeForce-NOW-Video-Streaming_JR2021603
"Education Strategy & Compete Leader, Microsoft Elevate",microsoft,"United States, Multiple Locations, Multiple Locations; United States, Washington, Redmond",0.3218,2026-07-21,https://apply.careers.microsoft.com/careers/job/1970393556933349
"AMR Growth Manager, Apple Ads",apple,,0.3196,2026-07-21,https://jobs.apple.com/en-us/details/200673153-3577/amr-growth-manager-apple-ads?team=SLDEV
North America OEM Partner Business Manager,nvidia,"US, TX, Dallas; US, IL, Remote",0.3173,2026-07-21,https://nvidia.wd5.myworkdayjobs.com/NVIDIAExternalCareerSite/job/US-TX-Dallas/North-America-OEM-Partner-Business-Manager_JR2021086
Forward Deployed Engineer - Zurich,openai,"Zurich, Switzerland",0.3162,2026-07-21,https://jobs.ashbyhq.com/openai/067788c8-505b-4296-bc05-d5699cb87a1f
"Administrative Assistant, Policy Communications & External Affairs",netflix,"Los Angeles,California,United States of America; Washington DC,District of Columbia,United States of America",0.3145,2026-07-21,https://explore.jobs.netflix.net/careers/job/790317259017
"Customer Success Manager, Consumables Private Brands",amazon,"US, WA, Seattle",0.3109,2026-07-21,https://www.amazon.jobs/en/jobs/10480528/customer-success-manager-consumables-private-brands
System Assurance Manager,meta,"Austin, TX +1 locations",0.3041,2026-07-21,https://www.metacareers.com/profile/job_details/1350031423882911
"Associate Counsel, Innovation and Thought Leadership",airbnb,United States,0.3015,2026-07-21,https://careers.airbnb.com/positions/8074833/
"Senior Associate, LATAM Ads (Commercial Planning & Insights)",netflix,"Sao Paulo,Brazil",0.2997,2026-07-21,https://explore.jobs.netflix.net/careers/job/790317206251
Surface Finishing - Subject Matter Expert (SME) - Anodizing,apple,,0.2967,2026-07-21,https://jobs.apple.com/en-us/details/200672669-0836/surface-finishing-subject-matter-expert-sme-anodizing?team=OPMFG
"Sr. Applied Scientist, Fauna Robotics",amazon_science,"US, CA, Sunnyvale",0.2964,2026-07-21,https://www.amazon.jobs/jobs/10478767/sr-applied-scientist-fauna-robotics?cmpid=bsp-amazon-science
"Clinical Customer Care Staff Pharmacist , Amazon Pharmacy",amazon,"US, NH, New Hampshire",0.2959,2026-07-21,https://www.amazon.jobs/en/jobs/10480023/clinical-customer-care-staff-pharmacist-amazon-pharmacy
"Clinical Customer Care Staff Pharmacist , Amazon Pharmacy",amazon,"US, NH, New Hampshire",0.295,2026-07-21,https://www.amazon.jobs/en/jobs/10479974/clinical-customer-care-staff-pharmacist-amazon-pharmacy
"Clinical Customer Care Staff Pharmacist , Amazon Pharmacy",amazon,"US, NH, New Hampshire",0.295,2026-07-21,https://www.amazon.jobs/en/jobs/10480016/clinical-customer-care-staff-pharmacist-amazon-pharmacy
"Applied Scientist, Prime Video",amazon_science,"US, WA, Seattle",0.2946,2026-07-21,https://www.amazon.jobs/jobs/10478814/applied-scientist-prime-video-?cmpid=bsp-amazon-science
