title,company,location,semantic_similarity,first_seen_date,url
"Clinical Customer Care Staff Pharmacist , Amazon Pharmacy",amazon,"US, NH, New Hampshire",0.2922,2026-07-21,https://www.amazon.jobs/en/jobs/10480022/clinical-customer-care-staff-pharmacist-amazon-pharmacy
Engineering Operations Program Manager,apple,,0.2917,2026-07-21,https://jobs.apple.com/en-us/details/200672259-0157/engineering-operations-program-manager?team=SFTWR
Software Expert SRE,mercadolibre,"Buenos Aires,Argentina",0.2884,2026-07-21,https://mercadolibre.eightfold.ai/careers/job/43200561
"Software QA Engineer, Watch Software",apple,,0.2879,2026-07-21,https://jobs.apple.com/en-us/details/200624075-0836/software-qa-engineer-watch-software?team=SFTWR
Senior Software Engineer Backend - IT Tarjeta de Crédito,mercadolibre,"Santa Fé,Argentina",0.2866,2026-07-21,https://mercadolibre.eightfold.ai/careers/job/42605284
"Manager, Central Quality Automation - Apple Services Engineering",apple,,0.2842,2026-07-21,https://jobs.apple.com/en-us/details/200653167-0836/manager-central-quality-automation-apple-services-engineering?team=SFTWR
"Network Engineer, Deployment & Support",meta,"Menlo Park, CA +1 locations",0.2822,2026-07-21,https://www.metacareers.com/profile/job_details/1180254430960731
"Finance Analyst, Hardware Engineering",apple,,0.2793,2026-07-21,https://jobs.apple.com/en-us/details/200664468-0836/finance-analyst-hardware-engineering?team=CORSV
"Clinical Customer Care Staff Pharmacist , Amazon Pharmacy",amazon,"US, NH, New Hampshire",0.2787,2026-07-21,https://www.amazon.jobs/en/jobs/10480683/clinical-customer-care-staff-pharmacist-amazon-pharmacy
"Engineering Program Manager, AppleCare Hardware Testing & Operations",apple,,0.277,2026-07-21,https://jobs.apple.com/en-us/details/200670380-3956/engineering-program-manager-applecare-hardware-testing-operations?team=OPMFG
Lider de equipo senior de inventarios y calidad data analisis- Mercado envíos,mercadolibre,"Monterrey,Mexico",0.2743,2026-07-21,https://mercadolibre.eightfold.ai/careers/job/43135623
"Solutions Architect, AppleCare Technologies",apple,,0.2711,2026-07-21,https://jobs.apple.com/en-us/details/200672891-0157/solutions-architect-applecare-technologies?team=CUST
AI Security Engineer - Red Team,apple,,0.2711,2026-07-21,https://jobs.apple.com/en-us/details/200672350-3337/ai-security-engineer-red-team?team=SFTWR
AI Security Engineer - Red Team,apple,,0.2711,2026-07-21,https://jobs.apple.com/en-us/details/200672351-3337/ai-security-engineer-red-team?team=SFTWR
Analista Senior de Créditos al Consumo - Fintech,mercadolibre,"Buenos Aires,Argentina",0.2664,2026-07-21,https://mercadolibre.eightfold.ai/careers/job/43289192
AIML Data Operations - Account & Program Manager,apple,,0.2663,2026-07-21,https://jobs.apple.com/en-us/details/200672960-2459/aiml-data-operations-account-program-manager?team=SFTWR
System Software Engineer - GeForce NOW Low Latency Streaming,nvidia,"US, CA, Santa Clara",0.2634,2026-07-21,https://nvidia.wd5.myworkdayjobs.com/NVIDIAExternalCareerSite/job/US-CA-Santa-Clara/System-Software-Engineer---GeForce-NOW-Low-Latency-Streaming_JR2021605
"Manager, Scaled Abuse Countermeasures and Research",discord,San Francisco Bay Area ,0.2595,2026-07-21,https://job-boards.greenhouse.io/discord/jobs/8643403002
Signals Intelligence Specialist,meta,"Sydney, Australia",0.2543,2026-07-21,https://www.metacareers.com/profile/job_details/1716228459591115
"Staff Pharmacist - Phoenix, AZ, Amazon Pharmacy",amazon,"US, AZ, Arizona",0.2532,2026-07-21,https://www.amazon.jobs/en/jobs/10479481/staff-pharmacist-phoenix-az-amazon-pharmacy
"ASIC Engineer, Emulation",meta,"Bangalore, India",0.2519,2026-07-21,https://www.metacareers.com/profile/job_details/1462360065656187
Sr. Sales Operations Associate,uber,"New York, New York, United States; Chicago, Cook, United States",0.2493,2026-07-21,https://www.uber.com/global/en/careers/list/301723/
Swift Compiler Engineer,apple,,0.2485,2026-07-21,https://jobs.apple.com/en-us/details/200673075-0836/swift-compiler-engineer?team=SFTWR
"Software Engineer, Algorithms (SDE)",apple,,0.2485,2026-07-21,https://jobs.apple.com/en-us/details/200672992-0836/software-engineer-algorithms-sde?team=HRDWR
Sales Training Specialist,uber,"Santiago, Chile",0.2475,2026-07-21,https://www.uber.com/global/en/careers/list/160029/
"Engineering Program Manager, SWE Factory Bring Up",apple,,0.2474,2026-07-21,https://jobs.apple.com/en-us/details/200673237-0836/engineering-program-manager-swe-factory-bring-up?team=SFTWR
"Sr. Strategic Operations Manager, Marketplace Strategy & Performance",uber,"New York, New York, United States; Chicago, Cook, United States; San Francisco, San Francisco, United States",0.2465,2026-07-21,https://www.uber.com/global/en/careers/list/302085/
"Certified Pharmacy Technician, Amazon Pharmacy",amazon,"US, OH, Middleburg Heights",0.2461,2026-07-21,https://www.amazon.jobs/en/jobs/10480616/certified-pharmacy-technician-amazon-pharmacy
Analista Pleno de Inteligência Logística - Mercado Envios,mercadolibre,"Sudeste,Brazil",0.2449,2026-07-21,https://mercadolibre.eightfold.ai/careers/job/43161321
"Certified Pharmacy Technician, Amazon Pharmacy",amazon,"US, OH, Middleburg Heights",0.2418,2026-07-21,https://www.amazon.jobs/en/jobs/10480642/certified-pharmacy-technician-amazon-pharmacy
Silicon Validation Engineer,apple,,0.2385,2026-07-21,https://jobs.apple.com/en-us/details/200673405-6205/silicon-validation-engineer?team=HRDWR
"Manager, Technical Accounting & Policy",meta,"Austin, TX +2 locations",0.2373,2026-07-21,https://www.metacareers.com/profile/job_details/1037708715339904
"Certified Pharmacy Technician, Amazon Pharmacy",amazon,"US, OH, Lockbourne",0.236,2026-07-21,https://www.amazon.jobs/en/jobs/10479519/certified-pharmacy-technician-amazon-pharmacy
"Strategic Program Manager, Local Partnerships",meta,"Los Angeles, CA +6 locations",0.2357,2026-07-21,https://www.metacareers.com/profile/job_details/992603500274178
Senior Security Engineer - Red Team,apple,,0.2286,2026-07-21,https://jobs.apple.com/en-us/details/200673234-3337/senior-security-engineer-red-team?team=SFTWR
Gerente de Inteligencia de Mercados,mercadolibre,"Distrito Federal,Mexico",0.2258,2026-07-21,https://mercadolibre.eightfold.ai/careers/job/42031855
"Senior Product Manager, Games — App Store, Games App & Game Center",apple,,0.2233,2026-07-21,https://jobs.apple.com/en-us/details/200672008-0836/senior-product-manager-games-app-store-games-app-game-center?team=MKTG
Project Leader - Pricing Ecosystem,mercadolibre,"Bogotá,Colombia",0.2154,2026-07-21,https://mercadolibre.eightfold.ai/careers/job/42117112
"Overnight Staff Pharmacist - San Antonio, TX, Amazon Pharmacy",amazon,"US, TX, San Antonio",0.2113,2026-07-21,https://www.amazon.jobs/en/jobs/10479846/overnight-staff-pharmacist-san-antonio-tx-amazon-pharmacy
Display Module Engineer,apple,Various Locations within San Francisco Bay Area,0.2091,2026-07-21,https://jobs.apple.com/en-us/details/200673202-3401/display-module-engineer?team=HRDWR
Experto/a en Performance de Cross Border Trade,mercadolibre,"Distrito Federal,Mexico",0.208,2026-07-21,https://mercadolibre.eightfold.ai/careers/job/43138722
"Technical Creative Director, Generative Imagery Systems",apple,,0.2077,2026-07-21,https://jobs.apple.com/en-us/details/200669786-0670/technical-creative-director-generative-imagery-systems?team=DESGN
"Finance Operations Transformation Program, Senior Manager",apple,,0.2072,2026-07-21,https://jobs.apple.com/en-us/details/200672982-0157/finance-operations-transformation-program-senior-manager?team=CORSV
Analista Senior de Comercio Exterior,mercadolibre,"Distrito Federal,Mexico",0.2068,2026-07-21,https://mercadolibre.eightfold.ai/careers/job/43275996
Analista Pleno de Transportes - Mercado Envios - Afirmativa para Pessoas com Deficiência,mercadolibre,"Sudeste,Brazil; Barueri, SP, Brasil; São Paulo, SP, BR; Guarulhos, SP, BR; São Bernardo do Campo, SP, Brasil; Cajamar, SP, Brasil; Mauá, SP, Brasil; Cotia, SP, BR; Franco da Rocha, SP, Brasil; Suzano - SP, Brasil; Araçariguama, SP, Brasil; Campinas, SP, BR; Caçapava, SP, Brasil; Ribeirão Preto, SP, Brasil",0.2036,2026-07-21,https://mercadolibre.eightfold.ai/careers/job/43118015
"Staff Pharmacist - Phoenix, AZ, Amazon Pharmacy",amazon,"US, AZ, Arizona",0.2034,2026-07-21,https://www.amazon.jobs/en/jobs/10479489/staff-pharmacist-phoenix-az-amazon-pharmacy
"Staff Pharmacist - Phoenix, AZ, Amazon Pharmacy",amazon,"US, AZ, Arizona",0.2034,2026-07-21,https://www.amazon.jobs/en/jobs/10479487/staff-pharmacist-phoenix-az-amazon-pharmacy
"Staff Pharmacist - Phoenix, AZ, Amazon Pharmacy",amazon,"US, AZ, Arizona",0.2034,2026-07-21,https://www.amazon.jobs/en/jobs/10479492/staff-pharmacist-phoenix-az-amazon-pharmacy
Localization Program Manager,meta,"Bellevue, WA +2 locations",0.2014,2026-07-21,https://www.metacareers.com/profile/job_details/1489547799856535
Image Scientist - Camera Simulation,apple,Various Locations within San Francisco Bay Area,0.2011,2026-07-21,https://jobs.apple.com/en-us/details/200673391-3401/image-scientist-camera-simulation?team=HRDWR
Supervisão de Custos Operacionais - Mercado Envios,mercadolibre,"Sudeste,Brazil",0.2004,2026-07-21,https://mercadolibre.eightfold.ai/careers/job/41987674
US-Manager,apple,,0.1992,2026-07-21,https://jobs.apple.com/en-us/details/200670324-3065/us-manager?team=APPST
Sr Accountant,uber,"San Francisco, San Francisco, United States",0.1909,2026-07-21,https://www.uber.com/global/en/careers/list/301437/
Especialista de Operaciones de Comercio Exterior,mercadolibre,"Distrito Federal,Mexico",0.1898,2026-07-21,https://mercadolibre.eightfold.ai/careers/job/43275994
Supervisão de Atração de Talentos e Eventos para Mercado Envios,mercadolibre,"Sudeste,Brazil",0.1897,2026-07-21,https://mercadolibre.eightfold.ai/careers/job/43288343
Líder de Equipe Logística - Mercado Envios (Guarulhos),mercadolibre,"Sudeste,Brazil",0.1872,2026-07-21,https://mercadolibre.eightfold.ai/careers/job/43272066
Especialista en Licitaciones y Compras de Construcción,mercadolibre,"Distrito Federal,Mexico",0.1852,2026-07-21,https://mercadolibre.eightfold.ai/careers/job/43276104
"Security Operations Manager, Paris",openai,"Paris, France",0.1838,2026-07-21,https://jobs.ashbyhq.com/openai/d333c117-9b74-488d-a985-7b78d1a19947
Supervisión de operaciones - Mercado envíos,mercadolibre,"Distrito Federal,Mexico",0.1837,2026-07-21,https://mercadolibre.eightfold.ai/careers/job/43118536
"Motion Graphics Designer, Creative X",meta,"Los Angeles, CA +3 locations",0.1786,2026-07-21,https://www.metacareers.com/profile/job_details/1653963672365207
Líder de Equipe Logística - Mercado Envios,mercadolibre,"Sudeste,Brazil",0.1776,2026-07-21,https://mercadolibre.eightfold.ai/careers/job/43277063
"UX Writer, Systems",apple,,0.1755,2026-07-21,https://jobs.apple.com/en-us/details/200672377-0836/ux-writer-systems?team=DESGN
Analista Pleno de Planejamento Logístico - Mercado Envios,mercadolibre,"Sudeste,Brazil",0.1738,2026-07-21,https://mercadolibre.eightfold.ai/careers/job/43273437
"Senior Full-Stack Software Engineer, Game Records",discord,San Francisco Bay Area,0.1716,2026-07-21,https://job-boards.greenhouse.io/discord/jobs/8597656002
Sr Accountant,uber,"San Francisco, San Francisco, United States",0.1712,2026-07-21,https://www.uber.com/global/en/careers/list/301279/
Robotic Controls Researcher,meta,"Redmond, WA",0.1711,2026-07-21,https://www.metacareers.com/profile/job_details/1213981970859251
Especialista de online payments - Sellers Longtail & SMBs,mercadolibre,"Sudeste,Brazil",0.1669,2026-07-21,https://mercadolibre.eightfold.ai/careers/job/39808380
Especialista de Payroll y Administración,mercadolibre,"Región Metropolitana de Santiago,Chile",0.1653,2026-07-21,https://mercadolibre.eightfold.ai/careers/job/43293772
"Commercial Lead, Growth Markets & New Verticals, Apple Music",apple,,0.1638,2026-07-21,https://jobs.apple.com/en-us/details/200673404-0670/commercial-lead-growth-markets-new-verticals-apple-music?team=SLDEV
Gerente de Logística - Mercado Envios,mercadolibre,"Sul,Brazil",0.158,2026-07-21,https://mercadolibre.eightfold.ai/careers/job/42093104
Assistente de Execução de Operações para Mercado Envios,mercadolibre,"Sudeste,Brazil",0.1566,2026-07-21,https://mercadolibre.eightfold.ai/careers/job/43277243
Agency Partner,meta,"Mumbai, India",0.1549,2026-07-21,https://www.metacareers.com/profile/job_details/1334478348668120
US-Lead,apple,,0.1539,2026-07-21,https://jobs.apple.com/en-us/details/200673179-2227/us-lead?team=APPST
Líder de Equipe Sênior - Mercado Envios,mercadolibre,"Sudeste,Brazil",0.1529,2026-07-21,https://mercadolibre.eightfold.ai/careers/job/43276985
Assistente de Execução de Operações para Mercado Envios - Araucária,mercadolibre,"Sudeste,Brazil",0.1512,2026-07-21,https://mercadolibre.eightfold.ai/careers/job/43277244
Analista Ssr Control Tower - Guarulhos/SP,mercadolibre,"Sudeste,Brazil",0.1444,2026-07-21,https://mercadolibre.eightfold.ai/careers/job/43276175
Analista Sênior de Projetos - Mercado Envios,mercadolibre,"Sudeste,Brazil; São Paulo, SP, BR; Guarulhos, SP, BR; Barueri, SP, BR; Osasco, SP, BR; Santana de Parnaíba, SP, BR; Cajamar, SP, BR; Jundiaí, SP, BR; Campinas, SP, BR",0.1427,2026-07-21,https://mercadolibre.eightfold.ai/careers/job/43272907
Analista de Transportes - Mercado Envios,mercadolibre,"Sudeste,Brazil",0.1418,2026-07-21,https://mercadolibre.eightfold.ai/careers/job/41860214
Líder de Equipe - Taboão da Serra/SP,mercadolibre,"Sudeste,Brazil",0.1383,2026-07-21,https://mercadolibre.eightfold.ai/careers/job/43295446
Analista Senior de Transporte y Distribución Heavy & Bulky - Mercado Envíos,mercadolibre,"Distrito Federal,Mexico",0.1337,2026-07-21,https://mercadolibre.eightfold.ai/careers/job/43169415
"Director, Product Staff",meta,"Menlo Park, CA +3 locations",0.1317,2026-07-21,https://www.metacareers.com/profile/job_details/1261188649305470
Analista Sênior de Treinamento - Mercado Envios,mercadolibre,"Sudeste,Brazil; São Paulo, SP, BR; Osasco, SP, BR; Barueri, SP, BR; Perus; Sumaré, SP, BR; Carapicuíba - SP, Brasil; Cajamar",0.1314,2026-07-21,https://mercadolibre.eightfold.ai/careers/job/43274965
Analista Pleno de Planejamento de Manutenção - Mercado Envios,mercadolibre,"Sudeste,Brazil",0.1259,2026-07-21,https://mercadolibre.eightfold.ai/careers/job/41883278
Supervisão de Manutenção e Facilities - Mercado Envios,mercadolibre,"Sudeste,Brazil",0.1009,2026-07-21,https://mercadolibre.eightfold.ai/careers/job/41884216
"Video Editor, Creative X",meta,"Los Angeles, CA +3 locations",0.0933,2026-07-21,https://www.metacareers.com/profile/job_details/4551543098463265
Analista Senior de Transporte y Distribución Heavy & Bulky - Mercado Envíos,mercadolibre,"Puebla,Mexico",0.0821,2026-07-21,https://mercadolibre.eightfold.ai/careers/job/43169750
"Facilities Project Lead, North America",meta,"New York, NY",0.0597,2026-07-21,https://www.metacareers.com/profile/job_details/904787351994698
"Facilities Projects Lead, North America",meta,"Menlo Park, CA",0.0503,2026-07-21,https://www.metacareers.com/profile/job_details/1354320176886933
"Marketing Manager, Amazon Pickup Program , PARP Traffic ",amazon,"US, NY, New York",0.5897,2026-07-20,https://www.amazon.jobs/en/jobs/10479240/marketing-manager-amazon-pickup-program-parp-traffic
"Data Center Technician , DCC Communities ",amazon,"US, IN, New Carlisle",0.5823,2026-07-20,https://www.amazon.jobs/en/jobs/10478697/data-center-technician-dcc-communities
"Sr. Storage Sales Specialist, Telco, Media, Entertainment, Games, Sports",amazon,"US, NY, New York",0.579,2026-07-20,https://www.amazon.jobs/en/jobs/10479257/sr-storage-sales-specialist-telco-media-entertainment-games-sports
"Data Scientist, Security Issue Management",amazon,"US, WA, Seattle",0.5687,2026-07-20,https://www.amazon.jobs/en/jobs/10478998/data-scientist-security-issue-management
"Startup Growth PDM, Global Startup Team",amazon,"US, NY, New York",0.5606,2026-07-20,https://www.amazon.jobs/en/jobs/10478726/startup-growth-pdm-global-startup-team
"Sr. Manager, Hardware Development",amazon,"US, MA, N.reading",0.544,2026-07-20,https://www.amazon.jobs/en/jobs/10479095/sr-manager-hardware-development
"Delivery Consultant - AppDev AWS Professional Services, WWPS ProServe",amazon,"US, VA, Arlington",0.5269,2026-07-20,https://www.amazon.jobs/en/jobs/10478671/delivery-consultant-appdev-aws-professional-services-wwps-proserve
"Sr Solutions Architect, Amazon Web Services, AWS Federal Financials",amazon,"US, VA, Arlington",0.5257,2026-07-20,https://www.amazon.jobs/en/jobs/10479214/sr-solutions-architect-amazon-web-services-aws-federal-financials
Infra Delivery Install Technician,amazon,"US, TX, Mansfield",0.5217,2026-07-20,https://www.amazon.jobs/en/jobs/10479252/infra-delivery-install-technician
"Research Lead, AWS Economic Development",amazon,"US, VA, Arlington",0.5173,2026-07-20,https://www.amazon.jobs/en/jobs/10478999/research-lead-aws-economic-development
Principal Account-Aligned FDE TPM,microsoft,"United States, Multiple Locations, Multiple Locations",0.5171,2026-07-20,https://apply.careers.microsoft.com/careers/job/1970393556940399
"Associate Solutions Architect, National Security Solutions Architecture Team",amazon,"US, VA, Herndon",0.5155,2026-07-20,https://www.amazon.jobs/en/jobs/10478571/associate-solutions-architect-national-security-solutions-architecture-team
"Engineering Operations Technician , DCEO",amazon,"US, GA, Atlanta",0.5148,2026-07-20,https://www.amazon.jobs/en/jobs/10478827/engineering-operations-technician-dceo
"Software Development Engineer, Network Product Development",amazon,"US, CA, Cupertino",0.5145,2026-07-20,https://www.amazon.jobs/en/jobs/10479116/software-development-engineer-network-product-development
"Sr Mgr, Vendor Management, Global Outsourcing",amazon,"US, WA, Seattle",0.4881,2026-07-20,https://www.amazon.jobs/en/jobs/10479114/sr-mgr-vendor-management-global-outsourcing
Senior Technical Product Marketing Manager - AI Infrastructure,nvidia,"US, CA, Santa Clara; US, TX, Remote; US, OR, Remote; US, CA, Remote; US, MA, Remote",0.4824,2026-07-20,https://nvidia.wd5.myworkdayjobs.com/NVIDIAExternalCareerSite/job/US-CA-Santa-Clara/Senior-Technical-Product-Marketing-Manager---AI-Infrastructure_JR2021528
"Senior Financial Analyst, WW Promotions & Events",amazon,"US, WA, Seattle",0.4757,2026-07-20,https://www.amazon.jobs/en/jobs/10479407/senior-financial-analyst-ww-promotions-events
"Finance Manager, Device Accessories Finance",amazon,"US, CA, Sunnyvale",0.4586,2026-07-20,https://www.amazon.jobs/en/jobs/10478984/finance-manager-device-accessories-finance
Mgr III DC InfraEng –AMZ001593,amazon,"US, WA, Seattle",0.4569,2026-07-20,https://www.amazon.jobs/en/jobs/10479356/mgr-iii-dc-infraeng-amz001593
"Senior Software Engineer, Test Infrastructure Development",nvidia,"US, CA, Santa Clara",0.4555,2026-07-20,https://nvidia.wd5.myworkdayjobs.com/NVIDIAExternalCareerSite/job/US-CA-Santa-Clara/Senior-Software-Engineer--Test-Infrastructure-Development_JR2021374-1
"Deep Learning Software Engineer, TensorRT Performance - New College Grad 2026",nvidia,"US, CA, Santa Clara; US, CA, Remote",0.4481,2026-07-20,https://nvidia.wd5.myworkdayjobs.com/NVIDIAExternalCareerSite/job/US-CA-Santa-Clara/Deep-Learning-Software-Engineer--TensorRT-Performance---New-College-Grad-2026_JR2015071
Senior Failure Analysis Engineer,nvidia,"US, CA, Santa Clara",0.4476,2026-07-20,https://nvidia.wd5.myworkdayjobs.com/NVIDIAExternalCareerSite/job/US-CA-Santa-Clara/Senior-Failure-Analysis-Engineer_JR2018980
"Sr. System Integration and Test Engineer, Amazon Leo",amazon,"US, CA, San Diego",0.4473,2026-07-20,https://www.amazon.jobs/en/jobs/10479001/sr-system-integration-and-test-engineer-amazon-leo
"Sr. Avionics Test Engineer, Avionics - Amazon Leo",amazon,"US, WA, Redmond",0.4446,2026-07-20,https://www.amazon.jobs/en/jobs/10479368/sr-avionics-test-engineer-avionics-amazon-leo
Senior Product Marketing Manager,nvidia,"US, CA, Santa Clara; US, AZ, Remote; US, WA, Remote",0.4418,2026-07-20,https://nvidia.wd5.myworkdayjobs.com/NVIDIAExternalCareerSite/job/US-CA-Santa-Clara/Senior-Product-Marketing-Manager_JR2020940
"Hardware Technical Program Manager, Infrastructure Partner Operations",openai,San Francisco,0.4413,2026-07-20,https://jobs.ashbyhq.com/openai/0fae998b-5295-4567-b4b5-b20cf0346da3
Group Product Manager - Backend Experience (Core Infrastructure),spotify,"New York, NY",0.4347,2026-07-20,https://jobs.lever.co/spotify/e99f0469-bee8-464f-96b7-70909a4ac073
Embedded Software Engineer - RISCV,nvidia,"US, CA, Santa Clara",0.43,2026-07-20,https://nvidia.wd5.myworkdayjobs.com/NVIDIAExternalCareerSite/job/US-CA-Santa-Clara/Embedded-Software-Engineer---RISCV_JR2021486
Chief of Staff,microsoft,"United States, Multiple Locations, Multiple Locations",0.4273,2026-07-20,https://apply.careers.microsoft.com/careers/job/1970393556926907
"Principal, PV Ads Partnerships, Prime Video Advertising",amazon,"US, CA, Culver City",0.4266,2026-07-20,https://www.amazon.jobs/en/jobs/10478530/principal-pv-ads-partnerships-prime-video-advertising
"Creative Mixing Lead – AI-Assisted Dubbing, Localization Enablement & Accessibility Programs (LEAP)",amazon,"US, CA, Culver City",0.4155,2026-07-20,https://www.amazon.jobs/en/jobs/10479084/creative-mixing-lead-ai-assisted-dubbing-localization-enablement-accessibility-programs-leap
"Sr. PMT, NTN Handsets, Amazon Leo",amazon,"US, WA, Redmond",0.4147,2026-07-20,https://www.amazon.jobs/en/jobs/10478714/sr-pmt-ntn-handsets-amazon-leo
"Principal Conn. Systems Engr., Connectivity Systems",amazon,"US, CA, Sunnyvale",0.408,2026-07-20,https://www.amazon.jobs/en/jobs/10478304/principal-conn-systems-engr-connectivity-systems
Senior Systems Software Engineer - GPU Diagnostics,nvidia,"US, CA, Santa Clara",0.4059,2026-07-20,https://nvidia.wd5.myworkdayjobs.com/NVIDIAExternalCareerSite/job/US-CA-Santa-Clara/Senior-Systems-Software-Engineer---GPU-Diagnostics_JR2012287
Senior Technical Program Manager - Azure Storage Platforms,microsoft,"United States, Multiple Locations, Multiple Locations",0.403,2026-07-20,https://apply.careers.microsoft.com/careers/job/1970393556926904
"Area Manager - Logan Township, NJ",amazon,"US, NY, Rochester",0.4008,2026-07-20,https://www.amazon.jobs/en/jobs/10479000/area-manager-logan-township-nj
"System Integration & Test Engineer, Amazon Leo for Government (ALG), SEIT | MFG",amazon,"US, CA, Northridge",0.4,2026-07-20,https://www.amazon.jobs/en/jobs/10479172/system-integration-test-engineer-amazon-leo-for-government-alg-seit-mfg
"Machine Learning Research Engineer, App Store Search",apple,,0.3968,2026-07-20,https://jobs.apple.com/en-us/details/200671370-3337/machine-learning-research-engineer-app-store-search?team=SFTWR
"Solutions Architect — Power and Utilities, AI Grid, Power Systems",nvidia,"US, TX, Remote; US, CA, Remote",0.3966,2026-07-20,https://nvidia.wd5.myworkdayjobs.com/NVIDIAExternalCareerSite/job/US-TX-Remote/Solutions-Architect---Power-and-Utilities--AI-Grid--Power-Systems_JR2021479
"Senior Solutions Architect, Agentic AI",nvidia,"US, CA, Santa Clara; US, Remote",0.3948,2026-07-20,https://nvidia.wd5.myworkdayjobs.com/NVIDIAExternalCareerSite/job/US-CA-Santa-Clara/Senior-Solutions-Architect--Agentic-AI_JR2021656
HPC Performance Engineer,nvidia,"US, OR, Remote; US, TX, Remote; US, CA, Remote; US, MA, Remote",0.3945,2026-07-20,https://nvidia.wd5.myworkdayjobs.com/NVIDIAExternalCareerSite/job/US-OR-Remote/HPC-Performance-Engineer_JR2021671
"Program Manager, GTM Systems ",anthropic,"San Francisco, CA",0.3926,2026-07-20,https://job-boards.greenhouse.io/anthropic/jobs/5363352008
"Contract Manager, Business Affairs",amazon,"US, CA, Culver City",0.3923,2026-07-20,https://www.amazon.jobs/en/jobs/10478533/contract-manager-business-affairs
Senior Project Delivery Manager - NVIS,nvidia,"US, TX, Remote; US, NC, Remote; US, NY, Remote; US, VA, Remote; US, CA, Remote; US, CA, Santa Clara",0.3917,2026-07-20,https://nvidia.wd5.myworkdayjobs.com/NVIDIAExternalCareerSite/job/US-TX-Remote/Senior-Project-Delivery-Manager---NVIS_JR2018267-1
"Senior Perception Engineer, Obstacle Foundation Models - Autonomous Vehicles",nvidia,"US, CA, Santa Clara",0.3885,2026-07-20,https://nvidia.wd5.myworkdayjobs.com/NVIDIAExternalCareerSite/job/US-CA-Santa-Clara/Senior-Perception-Engineer--Obstacle-Foundation-Models---Autonomous-Vehicles_JR2021078
"Sr. Full Lifecycle Recruiter, AWS",amazon,"US, WA, Seattle",0.3866,2026-07-20,https://www.amazon.jobs/en/jobs/10479399/sr-full-lifecycle-recruiter-aws
"Principal Product Manager, Agentic Workflows -  Autonomous Vehicles",nvidia,"US, CA, Santa Clara",0.3748,2026-07-20,https://nvidia.wd5.myworkdayjobs.com/NVIDIAExternalCareerSite/job/US-CA-Santa-Clara/Principal-Product-Manager--Agentic-Workflows----Autonomous-Vehicles_JR2021669
Software Senior Engineer Backend,mercadolibre,"Medellín,Colombia",0.3711,2026-07-20,https://mercadolibre.eightfold.ai/careers/job/43270645
Senior Systems Software Engineer - Autonomous Vehicles,nvidia,"US, CA, Santa Clara",0.371,2026-07-20,https://nvidia.wd5.myworkdayjobs.com/NVIDIAExternalCareerSite/job/US-CA-Santa-Clara/Senior-Systems-Software-Engineer---Autonomous-Vehicles_JR2021504
"Senior Systems Software Engineer, Compute Stack Acceleration",nvidia,"US, CA, Santa Clara; US, NC, Remote; US, TX, Remote; US, CA, Remote",0.3705,2026-07-20,https://nvidia.wd5.myworkdayjobs.com/NVIDIAExternalCareerSite/job/US-CA-Santa-Clara/Senior-Systems-Software-Engineer--Compute-Stack-Acceleration_JR2021549
Senior Staff Client Platform Engineer,nvidia,"US, CA, Santa Clara; US, Remote",0.3699,2026-07-20,https://nvidia.wd5.myworkdayjobs.com/NVIDIAExternalCareerSite/job/US-CA-Santa-Clara/Senior-Staff-Client-Platform-Engineer_JR2021034
