title,company,location,semantic_similarity,first_seen_date,url
"Senior Solutions Architect, WWPS Global Defense Partners",amazon,"US, VA, Virtual Location - Virginia",0.5879,2026-06-18,https://www.amazon.jobs/en/jobs/10452685/senior-solutions-architect-wwps-global-defense-partners
"Solutions Architect, WWPS Global Defense Partners",amazon,"US, CT, Virtual Location - Connecticut",0.5862,2026-06-18,https://www.amazon.jobs/en/jobs/10452684/solutions-architect-wwps-global-defense-partners
"Sr. Region Planner, DC Planning - AMER",amazon,"US, VA, Herndon",0.5705,2026-06-18,https://www.amazon.jobs/en/jobs/10452980/sr-region-planner-dc-planning-amer
"Sr. Principal Tech Lead, AWS Transform",amazon,"US, CA, Santa Clara",0.5518,2026-06-18,https://www.amazon.jobs/en/jobs/10452405/sr-principal-tech-lead-aws-transform
"Senior Research Scientist, Ad Measurements Science ",amazon,"US, NY, New York",0.5514,2026-06-18,https://www.amazon.jobs/en/jobs/10452390/senior-research-scientist-ad-measurements-science
"Solutions Architect, WWPS Global Defense Partners",amazon,"US, VA, Arlington",0.5478,2026-06-18,https://www.amazon.jobs/en/jobs/10452682/solutions-architect-wwps-global-defense-partners
"Sr. Account Manager, Startups",amazon,"US, NY, New York",0.5421,2026-06-18,https://www.amazon.jobs/en/jobs/10452715/sr-account-manager-startups
"Applied Scientist III- Recruiting AI Agents, Recruiting Agents & Candidate Voice",amazon_science,"US, WA, Seattle",0.5217,2026-06-18,https://www.amazon.jobs/jobs/10451701/applied-scientist-iii-recruiting-ai-agents-recruiting-agents--candidate-voice?cmpid=bsp-amazon-science
Principal Product Management Manager,microsoft,"United States, Multiple Locations, Multiple Locations",0.5169,2026-06-18,https://apply.careers.microsoft.com/careers/job/1970393556855306
Project Engineer,amazon,"US, VA, Manassas",0.5159,2026-06-18,https://www.amazon.jobs/en/jobs/10452595/project-engineer
"Manager, Member Innovation - Data Engineering",netflix,USA - Remote,0.5086,2026-06-18,https://explore.jobs.netflix.net/careers/job/790316459390
"Program Manager, Worldwide Grocery Stores",amazon,"US, TX, Austin",0.5038,2026-06-18,https://www.amazon.jobs/en/jobs/10452640/program-manager-worldwide-grocery-stores
"Hardware Development Eng, AWS PCIe & Signal Integrity Team",amazon,"US, WA, Seattle",0.4749,2026-06-18,https://www.amazon.jobs/en/jobs/10453001/hardware-development-eng-aws-pcie-signal-integrity-team
"Applied Scientist, Sponsored Products and Brands",amazon_science,"US, NY, New York",0.4703,2026-06-18,https://www.amazon.jobs/jobs/10452383/applied-scientist-sponsored-products-and-brands?cmpid=bsp-amazon-science
"Account Director, Mid-Market",openai,Singapore,0.4612,2026-06-18,https://jobs.ashbyhq.com/openai/8a3fdf98-ad82-4082-ace0-9edb89bc8f6d
"Account Director, Mid-Market",openai,"Sydney, Australia",0.458,2026-06-18,https://jobs.ashbyhq.com/openai/71f97dd6-63bc-4f86-8c34-dcb71577069a
Executive Business Administrator,microsoft,"United States, Multiple Locations, Multiple Locations",0.4577,2026-06-18,https://apply.careers.microsoft.com/careers/job/1970393556874920
Engineering Operations Technician (Night Shift),amazon,"US, MD, Frederick",0.4519,2026-06-18,https://www.amazon.jobs/en/jobs/10452593/engineering-operations-technician-night-shift
"Senior Research Scientist, Ad Measurements Science",amazon_science,"US, NY, New York",0.4515,2026-06-18,https://www.amazon.jobs/jobs/10452390/senior-research-scientist-ad-measurements-science-?cmpid=bsp-amazon-science
Engineering Operations Technician (Night Shift),amazon,"US, MD, Frederick",0.4511,2026-06-18,https://www.amazon.jobs/en/jobs/10452594/engineering-operations-technician-night-shift
"Economist, Ads Econ",amazon,"US, NY, New York",0.4491,2026-06-18,https://www.amazon.jobs/en/jobs/10452988/economist-ads-econ
"Applied Scientist, Core Search",amazon_science,"US, WA, Seattle",0.4452,2026-06-18,https://www.amazon.jobs/jobs/10452322/applied-scientist-core-search?cmpid=bsp-amazon-science
Area Manager II ,amazon,"US, VA, Richmond",0.4338,2026-06-18,https://www.amazon.jobs/en/jobs/10452885/area-manager-ii
"Sr Applied Scientist, Amazon Fulfillment Tech - Science",amazon_science,"US, WA, Bellevue",0.4313,2026-06-18,https://www.amazon.jobs/jobs/10451614/sr-applied-scientist-amazon-fulfillment-tech--science?cmpid=bsp-amazon-science
"Senior Applied Scientist, Industrial Robotics Group",amazon_science,"US, WA, Seattle",0.4294,2026-06-18,https://www.amazon.jobs/jobs/10452124/senior-applied-scientist-industrial-robotics-group?cmpid=bsp-amazon-science
"Sr Manager, Applied Science, Creative Intelligence",amazon_science,"US, NY, New York",0.4135,2026-06-18,https://www.amazon.jobs/jobs/10452306/sr-manager-applied-science-creative-intelligence-?cmpid=bsp-amazon-science
AV Events Engineer,netflix,"Los Angeles,California,United States of America",0.4073,2026-06-18,https://explore.jobs.netflix.net/careers/job/790316459079
"Associate Account Executive , Enterprise",amazon,"US, VA, Arlington",0.4052,2026-06-18,https://www.amazon.jobs/en/jobs/10452770/associate-account-executive-enterprise
"Applied Scientist, Navigation",amazon_science,"US, CA, San Francisco",0.4044,2026-06-18,https://www.amazon.jobs/jobs/10451675/applied-scientist-navigation?cmpid=bsp-amazon-science
"ProServe Account Executive, NatSec ProServe",amazon,"US, CO, Denver",0.4028,2026-06-18,https://www.amazon.jobs/en/jobs/10452696/proserve-account-executive-natsec-proserve
"Supply Chain Manager, WWGS - Supply Chain Planning & Execution",amazon,"US, NY, New York",0.4018,2026-06-18,https://www.amazon.jobs/en/jobs/10452847/supply-chain-manager-wwgs-supply-chain-planning-execution
"Director, Applied Science, Alexa for Shopping (Rufus)",amazon_science,"US, WA, Seattle",0.3993,2026-06-18,https://www.amazon.jobs/jobs/10451677/director-applied-science-alexa-for-shopping-rufus?cmpid=bsp-amazon-science
"Associate, FP&A",netflix,"Los Angeles,California,United States of America",0.3874,2026-06-18,https://explore.jobs.netflix.net/careers/job/790316488985
"Associate Manager, Marketing Science",spotify,"New York, NY",0.3797,2026-06-18,https://jobs.lever.co/spotify/6b818cbd-6bf1-4868-805d-4a07e8c7c1f6
Data Scientist,apple,,0.3756,2026-06-18,https://jobs.apple.com/en-us/details/200669127-0670/data-scientist?team=MLAI
"Social Media Manager I, Integrated Marketing, US&C",uber,"New York, New York, United States",0.3748,2026-06-18,https://www.uber.com/global/en/careers/list/160015/
"Strategic Partnerships Lead, Education",openai,San Francisco,0.3677,2026-06-18,https://jobs.ashbyhq.com/openai/05bea751-62ab-43d9-a5bb-77f385920af0
"Sr. Experience Designer, Interactive Experiences",apple,,0.355,2026-06-18,https://jobs.apple.com/en-us/details/200668114-3956/sr-experience-designer-interactive-experiences?team=MKTG
"Coding Compliance Auditor, Revenue Cycle Management, Amazon One Medical",amazon,"US, Virtual",0.352,2026-06-18,https://www.amazon.jobs/en/jobs/10452620/coding-compliance-auditor-revenue-cycle-management-amazon-one-medical
"Senior Manager, Netflix Technology Experience (APAC)",netflix,"Manila,Philippines",0.3494,2026-06-18,https://explore.jobs.netflix.net/careers/job/790316474839
Forward Deployed Engineer - Stockholm,openai,"Stockholm, Sweden",0.337,2026-06-18,https://jobs.ashbyhq.com/openai/580f9e7e-20cc-429c-877a-0b5f5233abdd
Forward Deployed Engineer - UAE,openai,"Abu Dhabi, UAE",0.3341,2026-06-18,https://jobs.ashbyhq.com/openai/e9d435e1-1b9e-4715-84ce-75f372e5559c
"Administrative Assistant, Product Marketing & Games",netflix,"Los Angeles,California,United States of America",0.3231,2026-06-18,https://explore.jobs.netflix.net/careers/job/790316431327
"Safety and Compliance Officer, Prime Air",amazon,"US, CA, Tracy",0.3192,2026-06-18,https://www.amazon.jobs/en/jobs/10452870/safety-and-compliance-officer-prime-air
"Safety and Compliance Officer, Prime Air",amazon,"US, CA, Beaumont",0.3063,2026-06-18,https://www.amazon.jobs/en/jobs/10452889/safety-and-compliance-officer-prime-air
Onsite Medical Representative,amazon,"US, SC, Spartanburg",0.2989,2026-06-18,https://www.amazon.jobs/en/jobs/10452933/onsite-medical-representative
"GPU Compiler Engineer, Graphics, Game and ML",apple,,0.2932,2026-06-18,https://jobs.apple.com/en-us/details/200668655-0836/gpu-compiler-engineer-graphics-game-and-ml?team=SFTWR
"Manager, Marketing Production - Sub Saharan Africa",netflix,"Amsterdam,Netherlands",0.291,2026-06-18,https://explore.jobs.netflix.net/careers/job/790316479694
"Manager, Manufacturing Design Engineer (MDE) - Mac",apple,,0.283,2026-06-18,https://jobs.apple.com/en-us/details/200668875-0836/manager-manufacturing-design-engineer-mde-mac?team=OPMFG
Manufacturing Design Engineer (MDE) - iPhone,apple,,0.2801,2026-06-18,https://jobs.apple.com/en-us/details/200667073-0836/manufacturing-design-engineer-mde-iphone?team=OPMFG
Staff Security Strategist GRC,uber,"San Francisco, California, United States; Sunnyvale, California, United States",0.2762,2026-06-18,https://www.uber.com/global/en/careers/list/160071/
"Principal Product Manager, Agentic Surfaces",spotify,"New York, NY",0.275,2026-06-18,https://jobs.lever.co/spotify/a025cf69-f8c6-4873-9a8b-7ca6b1fbe9fd
"Product Counsel, Delivery",uber,"New York, New York, United States; San Francisco, California, United States; Chicago, Illinois, United States; Washington, District of Columbia, United States",0.2686,2026-06-18,https://www.uber.com/global/en/careers/list/159754/
Especialista de Modelos de Tarjeta de Crédito - Fintech,mercadolibre,"Buenos Aires,Argentina",0.2647,2026-06-18,https://mercadolibre.eightfold.ai/careers/job/41440396
"Software Engineer, Identity & Access Controls",anthropic,"San Francisco, CA",0.2643,2026-06-18,https://job-boards.greenhouse.io/anthropic/jobs/5270442008
Software Engineer Backend - CRM Pricing Shipping,mercadolibre,"Córdoba,Argentina",0.2595,2026-06-18,https://mercadolibre.eightfold.ai/careers/job/42473757
Data Center Development Manager,meta,Singapore,0.2551,2026-06-18,https://www.metacareers.com/profile/job_details/2124888874749534
"Senior Designer, Interactive, Design & Delivery",apple,,0.2541,2026-06-18,https://jobs.apple.com/en-us/details/200668117-0157/senior-designer-interactive-design-delivery?team=MKTG
"Business Marketing Manager, EMEA",meta,"London, UK",0.2539,2026-06-18,https://www.metacareers.com/profile/job_details/980238191442936
Manufacturing Design Engineer - Thermal Modules,apple,,0.2536,2026-06-18,https://jobs.apple.com/en-us/details/200668223-3956/manufacturing-design-engineer-thermal-modules?team=OPMFG
"Creative Strategist, KarmaLab",reddit,"London, United Kingdom",0.2515,2026-06-18,https://job-boards.greenhouse.io/reddit/jobs/8015790
Wifi/Bluetooth Software Engineer - Wireless Technologies & Ecosystems,apple,,0.2475,2026-06-18,https://jobs.apple.com/en-us/details/200668873-3543/wifi-bluetooth-software-engineer-wireless-technologies-ecosystems?team=SFTWR
Especialista de Excelencia de Categorías - Marketplace,mercadolibre,"Buenos Aires,Argentina",0.2406,2026-06-18,https://mercadolibre.eightfold.ai/careers/job/41435732
"Program Manager, Procurement Center of Excellence",openai,San Francisco,0.2392,2026-06-18,https://jobs.ashbyhq.com/openai/313a7e10-a2b5-4351-b878-5eee99f75b91
Software Project Leader,mercadolibre,"Bogotá,Colombia",0.2273,2026-06-18,https://mercadolibre.eightfold.ai/careers/job/42505949
System Product Design Engineer - iPhone,apple,,0.2263,2026-06-18,https://jobs.apple.com/en-us/details/200669161-0836/system-product-design-engineer-iphone?team=HRDWR
Hardware Design Engineer,apple,,0.2178,2026-06-18,https://jobs.apple.com/en-us/details/200668993-3956/hardware-design-engineer?team=HRDWR
Hardware Design Engineer,apple,,0.2178,2026-06-18,https://jobs.apple.com/en-us/details/200668994-3956/hardware-design-engineer?team=HRDWR
Strategic Sourcing Manager,meta,"Shanghai, China",0.2147,2026-06-18,https://www.metacareers.com/profile/job_details/1327473678803497
Home Product Design Engineer,apple,,0.2139,2026-06-18,https://jobs.apple.com/en-us/details/200669053-3956/home-product-design-engineer?team=HRDWR
Home Hardware Systems Engineer,apple,,0.2138,2026-06-18,https://jobs.apple.com/en-us/details/200669049-3956/home-hardware-systems-engineer?team=HRDWR
Studio Production Manager,apple,,0.2041,2026-06-18,https://jobs.apple.com/en-us/details/200669104-0670/studio-production-manager?team=MKTG
US-Manager,apple,,0.198,2026-06-18,https://jobs.apple.com/en-us/details/200668127-2480/us-manager?team=APPST
"Coordinator,  Local Language Originals Publicity",netflix,"Los Angeles,California,United States of America",0.197,2026-06-18,https://explore.jobs.netflix.net/careers/job/790316489318
"Manager, Manufacturing Design Engineering - Brittles",apple,,0.1911,2026-06-18,https://jobs.apple.com/en-us/details/200668599-0836/manager-manufacturing-design-engineering-brittles?team=OPMFG
"Partner Enablement Manager, Government and Regulatory Affairs",meta,"Tokyo, Japan",0.1873,2026-06-18,https://www.metacareers.com/profile/job_details/1978958482755065
"Project Manager, Content and Integrity Operations",meta,"Washington, DC",0.1794,2026-06-18,https://www.metacareers.com/profile/job_details/1000809259151989
Senior UX/UI Designer - Shipping Posventa,mercadolibre,"Buenos Aires,Argentina",0.1783,2026-06-18,https://mercadolibre.eightfold.ai/careers/job/42196035
Especialista de Capacidade Logística - Mercado Envios,mercadolibre,"Sul,Brazil",0.1773,2026-06-18,https://mercadolibre.eightfold.ai/careers/job/42502153
"Client Solutions Manager, CPG, Fashion and Auto",meta,"São Paulo, Brazil",0.1761,2026-06-18,https://www.metacareers.com/profile/job_details/1242782144460414
Product Manager - Pessoa com Deficiência - Mercado Pago,mercadolibre,"Sudeste,Brazil",0.1624,2026-06-18,https://mercadolibre.eightfold.ai/careers/job/42449407
Analista de Transportes - Mercado Envios,mercadolibre,"Sul,Brazil",0.1624,2026-06-18,https://mercadolibre.eightfold.ai/careers/job/42502092
Supervisão de Operação Logística - Mercado Envios,mercadolibre,"Sudeste,Brazil",0.1624,2026-06-18,https://mercadolibre.eightfold.ai/careers/job/42289143
Supervisão de Segurança do Trabalho para Mercado Envios,mercadolibre,"Sudeste,Brazil",0.1526,2026-06-18,https://mercadolibre.eightfold.ai/careers/job/42500813
Supervisão de Segurança do Trabalho para Mercado Envios,mercadolibre,"Sudeste,Brazil",0.1526,2026-06-18,https://mercadolibre.eightfold.ai/careers/job/42500812
Industrial Designer,meta,"Seattle, WA",0.1393,2026-06-18,https://www.metacareers.com/profile/job_details/1522951515968364
Public Policy Manager,meta,"London, UK",0.1354,2026-06-18,https://www.metacareers.com/profile/job_details/1018867850608836
Especialista de Rede Logística de Heavy & Bulky - Mercado Envios,mercadolibre,"Sudeste,Brazil",0.124,2026-06-18,https://mercadolibre.eightfold.ai/careers/job/41884461
Assistente de Roteirização - Pessoas com Deficiência - Mercado Envios,mercadolibre,"Sudeste,Brazil",0.106,2026-06-18,https://mercadolibre.eightfold.ai/careers/job/42307158
Analista Sênior de Controle de Perdas e Segurança Patrimonial- Mercado Envios,mercadolibre,"Sudeste,Brazil",0.0914,2026-06-18,https://mercadolibre.eightfold.ai/careers/job/42501963
Analista Sênior de Controle de Perdas e Segurança Patrimonial- Mercado Envios,mercadolibre,"Sudeste,Brazil",0.0914,2026-06-18,https://mercadolibre.eightfold.ai/careers/job/42502023
"Senior Data Engineer , Amazon Customer Service",amazon,"US, WA, Seattle",0.6968,2026-06-17,https://www.amazon.jobs/en/jobs/10452121/senior-data-engineer-amazon-customer-service
"Applied Scientist III- Recruiting AI Agents, Recruiting Agents & Candidate Voice",amazon,"US, WA, Seattle",0.6793,2026-06-17,https://www.amazon.jobs/en/jobs/10451701/applied-scientist-iii-recruiting-ai-agents-recruiting-agents-candidate-voice
"Applied Scientist, Amazon Customer Service",amazon_science,"US, WA, Seattle",0.5905,2026-06-17,https://www.amazon.jobs/jobs/10450781/applied-scientist-amazon-customer-service?cmpid=bsp-amazon-science
"Senior Applied Scientist, Industrial Robotics Group",amazon,"US, WA, Seattle",0.5865,2026-06-17,https://www.amazon.jobs/en/jobs/10452124/senior-applied-scientist-industrial-robotics-group
"Data Center Cluster Operations Leader, DCC Communities ",amazon,"US, IN, Wheatfield",0.5627,2026-06-17,https://www.amazon.jobs/en/jobs/10451456/data-center-cluster-operations-leader-dcc-communities
Professional Services III - AMZ10515301,amazon,"US, TX, Irving",0.5625,2026-06-17,https://www.amazon.jobs/en/jobs/10452156/professional-services-iii-amz10515301
"Principal PMT, Prime Video Personalization & Discovery",amazon,"US, WA, Seattle",0.5622,2026-06-17,https://www.amazon.jobs/en/jobs/10451505/principal-pmt-prime-video-personalization-discovery
"Applied Scientist I, Sponsored Products and Brands Agent",amazon,"US, NY, New York",0.5608,2026-06-17,https://www.amazon.jobs/en/jobs/10451121/applied-scientist-i-sponsored-products-and-brands-agent
"Applied Scientist, TSI - Science",amazon_science,"US, WA, Seattle",0.5537,2026-06-17,https://www.amazon.jobs/jobs/10450492/applied-scientist-tsi--science?cmpid=bsp-amazon-science
"Senior UX Researcher, Applied AI Solution",amazon,"US, VA, Herndon",0.547,2026-06-17,https://www.amazon.jobs/en/jobs/10452074/senior-ux-researcher-applied-ai-solution
"Program Manager, Amazon Selling Partner API",amazon,"US, TX, Irving",0.5435,2026-06-17,https://www.amazon.jobs/en/jobs/10451579/program-manager-amazon-selling-partner-api
"Senior Worldwide Partner Specialist Solutions Architect, Applied AI Partner Solutions Architecture",amazon,"US, WA, Seattle",0.5435,2026-06-17,https://www.amazon.jobs/en/jobs/10451625/senior-worldwide-partner-specialist-solutions-architect-applied-ai-partner-solutions-architecture
Staff Machine Learning Engineer - Applied AI,uber,"Sunnyvale, California, United States; San Francisco, California, United States; Seattle, Washington, United States",0.5339,2026-06-17,https://www.uber.com/global/en/careers/list/145860/
"Global Events Scale Manager, APN, AWS Partner Core Enablement Shared Services-Foundations",amazon,"US, WA, Seattle",0.5338,2026-06-17,https://www.amazon.jobs/en/jobs/10451589/global-events-scale-manager-apn-aws-partner-core-enablement-shared-services-foundations
"Software Development Engineer, Measurement, AdTech, and Data Science (MADS)",amazon,"US, WA, Seattle",0.5272,2026-06-17,https://www.amazon.jobs/en/jobs/10451105/software-development-engineer-measurement-adtech-and-data-science-mads
"Director, Sales Learning Program Manager",microsoft,"United States, Multiple Locations, Multiple Locations",0.5251,2026-06-17,https://apply.careers.microsoft.com/careers/job/1970393556875890
"Applied Scientist, Economist - Marketplace Fairness",uber,"New York, New York, United States; San Francisco, California, United States",0.5166,2026-06-17,https://www.uber.com/global/en/careers/list/150302/
"Data Scientist, Road Safety - Autonomous Vehicles",uber,"San Francisco, California, United States; Sunnyvale, California, United States",0.516,2026-06-17,https://www.uber.com/global/en/careers/list/153076/
"Sr. Global Category Manager, Amazon Web Services (AWS) Power and Cooling (PAC) Procurement and Supply Chain",amazon,"US, WA, Seattle",0.5148,2026-06-17,https://www.amazon.jobs/en/jobs/10451500/sr-global-category-manager-amazon-web-services-aws-power-and-cooling-pac-procurement-and-supply-chain
"BIE, NonSort, Supply Chain Execution",amazon,"US, TX, Austin",0.5144,2026-06-17,https://www.amazon.jobs/en/jobs/10451830/bie-nonsort-supply-chain-execution
"Senior Contracts Manager, Amazon Industrial Robotics",amazon,"US, TX, Austin",0.5141,2026-06-17,https://www.amazon.jobs/en/jobs/10451863/senior-contracts-manager-amazon-industrial-robotics
"Program Manager, Worldwide Grocery Stores, Strategy and Business Planning",amazon,"US, TX, Austin",0.5137,2026-06-17,https://www.amazon.jobs/en/jobs/10452031/program-manager-worldwide-grocery-stores-strategy-and-business-planning
"Sr. Electrical Engineer, Data Center Engineering ",amazon,"US, VA, Herndon",0.5119,2026-06-17,https://www.amazon.jobs/en/jobs/10451732/sr-electrical-engineer-data-center-engineering
Machine Learning Engineer II– Ranking & Recommendations,uber,"Sunnyvale, California, United States; San Francisco, California, United States; Seattle, Washington, United States; New York, New York, United States",0.5118,2026-06-17,https://www.uber.com/global/en/careers/list/153457/
"Electrical Engineer, Data Center Engineering ",amazon,"US, VA, Herndon",0.5094,2026-06-17,https://www.amazon.jobs/en/jobs/10452295/electrical-engineer-data-center-engineering
"Senior SDE, OpenSearch, AWS OpenSearch",amazon,"US, CA, Santa Clara",0.5079,2026-06-17,https://www.amazon.jobs/en/jobs/10451608/senior-sde-opensearch-aws-opensearch
"Principal, Senior, Distinguished Engineer — AWS Applied AI Solutions , AWS Applied AI Solutions",amazon,"US, WA, Seattle",0.5077,2026-06-17,https://www.amazon.jobs/en/jobs/10452091/principal-senior-distinguished-engineer-aws-applied-ai-solutions-aws-applied-ai-solutions
"Principal Product Manager Tech, Prime Video",amazon,"US, CA, Culver City",0.5022,2026-06-17,https://www.amazon.jobs/en/jobs/10451496/principal-product-manager-tech-prime-video
"Sr. Mechanical Engineer, Data Center Engineering ",amazon,"US, WA, Seattle",0.4998,2026-06-17,https://www.amazon.jobs/en/jobs/10451698/sr-mechanical-engineer-data-center-engineering
"Mechanical Engineer, Data Center Engineering ",amazon,"US, WA, Seattle",0.4991,2026-06-17,https://www.amazon.jobs/en/jobs/10452298/mechanical-engineer-data-center-engineering
"Software Development Engineer II,  Prime Video Ads",amazon,"US, NY, New York",0.4985,2026-06-17,https://www.amazon.jobs/en/jobs/10451511/software-development-engineer-ii-prime-video-ads
"Senior Product Manager Technical, External Services, AgentCore",amazon,"US, CA, Santa Clara",0.4903,2026-06-17,https://www.amazon.jobs/en/jobs/10452143/senior-product-manager-technical-external-services-agentcore
DCO Tech,amazon,"US, VA, Sterling",0.4895,2026-06-17,https://www.amazon.jobs/en/jobs/10451974/dco-tech
Principal Product Manager,microsoft,"United States, Multiple Locations, Multiple Locations",0.4881,2026-06-17,https://apply.careers.microsoft.com/careers/job/1970393556629440
Senior Machine Learning Engineer – Ranking & Recommendations (Generative AI),uber,"San Francisco, California, United States; Sunnyvale, California, United States",0.4863,2026-06-17,https://www.uber.com/global/en/careers/list/153458/
Sr. Scientist - Mobility Matching,uber,"San Francisco, California, United States",0.483,2026-06-17,https://www.uber.com/global/en/careers/list/155288/
"Sr. Mgr, WWPS Partner GTM Acceleration, WW Public Sector Partner Core",amazon,"US, VA, Arlington",0.4811,2026-06-17,https://www.amazon.jobs/en/jobs/10451885/sr-mgr-wwps-partner-gtm-acceleration-ww-public-sector-partner-core
"Startup Solutions Architect, Startups",amazon,"US, TX, Austin",0.4788,2026-06-17,https://www.amazon.jobs/en/jobs/10451899/startup-solutions-architect-startups
"Software Development Manager, Open Data Analytics Engines",amazon,"US, WA, Redmond",0.475,2026-06-17,https://www.amazon.jobs/en/jobs/10452081/software-development-manager-open-data-analytics-engines
Software Engineer II - Machine Learning,uber,"Sunnyvale, California, United States",0.4713,2026-06-17,https://www.uber.com/global/en/careers/list/152898/
Business Program Manager,microsoft,"United States, Multiple Locations, Multiple Locations; United States, Washington, Redmond; United States, New York, New York",0.4712,2026-06-17,https://apply.careers.microsoft.com/careers/job/1970393556856336
Infra Delivery Install Technician,amazon,"US, TX, Fort Worth",0.4704,2026-06-17,https://www.amazon.jobs/en/jobs/10451633/infra-delivery-install-technician
"Account Director,  Large Enterprise",openai,San Francisco; Remote - US; New York City; Seattle,0.4635,2026-06-17,https://jobs.ashbyhq.com/openai/4e972540-c28c-4d16-a169-498ba032373c
Senior Software Engineer,uber,"Sunnyvale, California, United States",0.4633,2026-06-17,https://www.uber.com/global/en/careers/list/156403/
"Data Center Technician, ADC InfraOps DCO",amazon,"US, TX, San Antonio",0.4624,2026-06-17,https://www.amazon.jobs/en/jobs/10451584/data-center-technician-adc-infraops-dco
Infra Delivery Install Technician,amazon,"US, TX, Mansfield",0.4605,2026-06-17,https://www.amazon.jobs/en/jobs/10451630/infra-delivery-install-technician
Continuous Improvement Leader - Industry Solutions Delivery,microsoft,"United States, Multiple Locations, Multiple Locations",0.4577,2026-06-17,https://apply.careers.microsoft.com/careers/job/1970393556874685
Staff Infrastructure Efficiency Analyst,uber,"San Francisco, California, United States",0.4556,2026-06-17,https://www.uber.com/global/en/careers/list/155003/
"Supply Chain Manager, Supply Chain Execution",amazon,"US, TX, Austin",0.4547,2026-06-17,https://www.amazon.jobs/en/jobs/10451755/supply-chain-manager-supply-chain-execution
Sr Staff Machine Learning Engineer - Ads,uber,"Sunnyvale, California, United States; San Francisco, California, United States",0.4528,2026-06-17,https://www.uber.com/global/en/careers/list/152666/
"Innovation and Design Engineer , Worldwide Design Engineering ",amazon,"US, TN, Nashville",0.4515,2026-06-17,https://www.amazon.jobs/en/jobs/10451998/innovation-and-design-engineer-worldwide-design-engineering
"Sr. Research Scientist, AWS Security",amazon_science,"US, VA, Herndon",0.4512,2026-06-17,https://www.amazon.jobs/jobs/10450623/sr-research-scientist-aws-security?cmpid=bsp-amazon-science
Senior Site Reliability Engineer,microsoft,"United States, Multiple Locations, Multiple Locations",0.4484,2026-06-17,https://apply.careers.microsoft.com/careers/job/1970393556619564
"Scientist II, Earner Experience",uber,"New York, New York, United States",0.4464,2026-06-17,https://www.uber.com/global/en/careers/list/151232/
