title,team,location,posted_date,url,source,job_category,description,job_id,first_seen_date,last_seen_date,job_family,city,state,updated_time,schedule_type,description_short,basic_qualifications,preferred_qualifications,semantic_similarity
"Senior Financial Analyst, WW Global Selling",finance.team-consumer,"US, WA, Seattle",2026-05-30,https://www.amazon.jobs/en/jobs/10435093/senior-financial-analyst-ww-global-selling,amazon,Finance & Accounting,"More than 300 million customers shop in Amazon’s store, and every day, customers browse, purchase, and review products sold by third-party sellers right alongside products sold by Amazon. Since 2000, Amazon has offered this digital shelf space to individuals and companies of all sizes, helping them reach hundreds of millions of customers, build their brands, and grow their business. Fast-forward to the present day, and these third-party seller products account for more than half of all units sold in our store. This is an exciting opportunity to create and innovate in Marketplace, one of the core pillars of Amazon.
Sellers are the life blood of our Marketplace business and new sellers make up a significant portion of both the active seller base and selection contribution. We rely on new Sellers to bring our customers more selection, lower pricing, and better experience. International Seller Services focuses on recruiting 3P sellers and helping them grow their business on Amazon, either through their own logistic networks or leveraging Amazon's global fulfillment and customer service network. We place great focus on building a healthy Seller business which determines the future and potential of Amazon's 3P business. WW Global Selling specifically focuses on Cross-Border Sellers, where a significant portion of sales come from China-based Sellers selling globally on Amazon Stores.
The International Seller Services (ISS) Finance team is seeking a Sr Financial Analyst to support the WW Global Selling PMO team. The PMO team focuses on driving strategic programs to centrally to improve seller experience and innovation new programs for our cross-border business. Such as, supporting supply chain improvements, cost-to-serve initiatives, and other programs to ensure seller success throughout their lifecycle at Amazon. 
As a member of this team, you will leverage analytical, technical, and communication skills to drive worldwide projects, engineer ad-hoc financial analyses, support business planning, and implement ideas for process improvement. The ideal candidate will have a growth mindset, be comfortable with healthy respectful debate, and be skilled at earning trust across both finance and business teams.
Key job responsibilities
- Use solid financial knowledge and business acumen to build financial models, interpret data, draw conclusions, and make recommendations that deliver results, drive improvements, and influence leaders throughout Amazon. These decisions can have global impact.
- Educate business partners on financial and non-financial trade-offs and provides guidance and financial analysis for new projects and initiatives. You make thoughtful judgement calls in ambiguous environments where data may be scarce or difficult to procure.
- Identifies opportunities to resolve defects proactively. Improves, scales, or simplifies finance tools across teams and organizations.",10435093,2026-05-30,2026-05-30,Finance/Planning,Seattle,WA,about 6 hours,full-time,"More than 300 million customers shop in Amazon’s store, and every day, customers browse, purchase, and review products sold by third-party sellers right alongside products sold by Amazon. Since 2000, Amazon","- 5+ years of tax, finance or a related analytical field experience
- Bachelor's degree in finance, accounting, business, economics, or a related analytical field (e.g., engineering, math, computer science)
- Knowledge of Microsoft Excel at an advanced level, including: pivot tables, macros, index/match, vlookup, VBA, data links, etc.","- 5+ years of participating in continuous improvement projects in your team to scale and improve controllership with measurable results experience
- MBA, or CPA
- Experience working with large-scale data mining and reporting tools (examples: SQL, MS Access, Essbase, Cognos) and other financial systems (examples: Oracle, SAP, Lawson, JD Edwards)
Amazon is an equal opportunity employer and does not discriminate on the basis of protected veteran status, disability, or other legally protected status.
Our inclusive culture empowers Amazonians to deliver the best results for our customers. If you have a disability and need a workplace accommodation or adjustment during the application and hiring process, including support for the interview or onboarding process, please visit https://amazon.jobs/content/en/how-we-hire/accommodations for more information. If the country/region you’re applying in isn’t listed, please contact your Recruiting Partner.
The base salary range for this position is listed below. Your Amazon package will include sign-on payments and restricted stock units (RSUs). Final compensation will be determined based on factors including experience, qualifications, and location. Amazon also offers comprehensive benefits including health insurance (medical, dental, vision, prescription, Basic Life & AD&D insurance and option for Supplemental life plans, EAP, Mental Health Support, Medical Advice Line, Flexible Spending Accounts, Adoption and Surrogacy Reimbursement coverage), 401(k) matching, paid time off, and parental leave. Learn more about our benefits at https://amazon.jobs/en/benefits.
USA, WA, Seattle - 82,700.00 - 117,100.00 USD annually",0.1945
"Applied Scientist III, Amazon - Ads Nova",advertising.team-amazon-ads,"US, NY, New York",2026-05-30,https://www.amazon.jobs/en/jobs/10435099/applied-scientist-iii-amazon-ads-nova,amazon,Machine Learning Science,"Are you passionate about solving big problems from ground-up? Do you enjoy building new state-of-the-art products at internet scale? Come lead the innovation in this startup team, vertical ad products. This is a green field problem without a known answer or a pattern to follow.
We have ambitious vision to simplify full funnel advertising solutions, at scale, with specialized agentic AI-powered models and diversify the demand to strategic verticals including finserv, autos, locals.. etc.
We are seeking an experienced Applied Scientist to drive innovation in our Ads Foundational Model. In this individual contributor role, you will apply advanced machine learning techniques to improve advertiser performance and customer experience.
Key job responsibilities
As an Applied Scientist on this team, you will:
1. Develop and drive the science strategy for Ads Foundational Model (Ads-FM), aligning it with the program's objectives and overall business goals.
2. Identify high-impact opportunities within Ads-FM program and lead the ideation, planning, and execution of science initiatives to address them.
3. Build and deploy machine learning models using computer vision, natural language processing, and deep learning to evaluate and enhance ad effectiveness.
4. Develop algorithms that extract meaningful signals from image, video, and audio content to predict and improve customer engagement
5. Leverage Amazon's extensive data repository to create predictive models that generate actionable recommendations for more compelling ad creative
6. Collaborate with business leaders and cross-functional teams to implement ML-powered solutions
7. Contribute to the ML roadmap for the Ads-FM program through innovation and research.",10435099,2026-05-29,2026-05-30,Applied Science,New York,NY,about 2 hours,full-time,"Are you passionate about solving big problems from ground-up? Do you enjoy building new state-of-the-art products at internet scale? Come lead the innovation in this startup team, vertical ad products.","- 3+ years of building machine learning models for business application experience
- PhD, or Master's degree and 6+ years of applied research experience
- Experience programming in Java, C++, Python or related language
- Experience with neural deep learning methods and machine learning","- Experience with modeling tools such as R, scikit-learn, Spark MLLib, MxNet, Tensorflow, numpy, scipy etc.
- Experience with large scale distributed systems such as Hadoop, Spark etc.
Amazon is an equal opportunity employer and does not discriminate on the basis of protected veteran status, disability, or other legally protected status.
Our inclusive culture empowers Amazonians to deliver the best results for our customers. If you have a disability and need a workplace accommodation or adjustment during the application and hiring process, including support for the interview or onboarding process, please visit https://amazon.jobs/content/en/how-we-hire/accommodations for more information. If the country/region you’re applying in isn’t listed, please contact your Recruiting Partner.
The base salary range for this position is listed below. Your Amazon package will include sign-on payments and restricted stock units (RSUs). Final compensation will be determined based on factors including experience, qualifications, and location. Amazon also offers comprehensive benefits including health insurance (medical, dental, vision, prescription, Basic Life & AD&D insurance and option for Supplemental life plans, EAP, Mental Health Support, Medical Advice Line, Flexible Spending Accounts, Adoption and Surrogacy Reimbursement coverage), 401(k) matching, paid time off, and parental leave. Learn more about our benefits at https://amazon.jobs/en/benefits.
USA, NY, New York - 183,800.00 - 248,700.00 USD annually",0.5415
"Business Intel Engineer - I, Amazon Robotics, Amazon Robotics, Global Operations - Artificial Intelligence (GO-AI) ",subsidiaries.team-amazon-robotics,"US, MA, Westboro",2026-05-29,https://www.amazon.jobs/en/jobs/10434946/business-intel-engineer-i-amazon-robotics-amazon-robotics-global-operations-artificial-intelligence-go-ai,amazon,Business Intelligence,"Amazon Robotics is at the forefront of applying state-of-the-art artificial intelligence to solve real-world challenges at unprecedented scale. Our fulfillment centers handle more individual items than any company in the world, combining computer vision, mobile robots, advanced end-of-arm tooling, and high-degree of freedom movement with state-of-the-art AI. We collaborate with customers across Amazon worldwide to conceive, develop, prototype, and deploy intelligent robotic systems that push the boundaries of industrial automation.
Within Amazon Robotics, the Global Operations - Artificial Intelligence (GO-AI) team enables Amazon to accelerate and scale the next generation of AI-powered robotic solutions. We're transforming how complex visual reasoning tasks are performed across Amazon's robotics operations, moving from traditional manual data annotation processes to state-of-the-art foundation model solutions.
As a Business Intelligence Engineer on GO-AI's Technology & Development Team, you'll work with cross-functional teams (Science, Software, Data, BIE) managing massive-scale, proprietary datasets to develop foundation models that achieve human-level performance on complex real-world tasks. Your work will directly impact millions of daily operations across Amazon's global fulfillment network.
This is a rare opportunity to work with a team building AI systems that operate at Amazon scale while solving novel technical challenges in computer vision, natural language processing, and human-AI collaboration. You'll collaborate with world-class scientists, engineers, and operations teams to deploy state-of-the-art research into production systems that deliver real-world impact at global scale.
Key job responsibilities
• Design, development and ongoing operations of scalable, performant data warehouse (Redshift) tables, data pipelines, reports and dashboards.
• Development of moderately to highly complex data processing jobs using appropriate technologies (e.g. SQL, Python, Spark, AWS Lambda, etc.)
• Development of dashboards and reports.
• Collaborating with stakeholders to understand business domains, requirements, and expectations. Additionally, working with owners of data source systems to gain insights into capabilities and limitations.
• Deliver minimally to moderately complex data analysis.
• Adopt best practices in reporting: data integrity, test design, validation, and documentation.
• Ensure excellence in verbal and written communication.
• Comfortable wearing multiple hats and go over and above to drive results.
A day in the life
Amazon offers a full range of benefits for you and eligible family members, including domestic partners and their children. Benefits can vary by location, the number of regularly scheduled hours you work, length of employment, and job status such as seasonal or temporary employment. The benefits that generally apply to regular, full-time employees include: 
1. Medical, Dental, and Vision Coverage 
2. Maternity and Parental Leave Options 
3. Paid Time Off (PTO) 
4. 401(k) Plan   
If you are not sure that every qualification on the list above describes you exactly, we'd still love to hear from you! At Amazon, we value people with unique backgrounds, experiences, and skillsets. If you’re passionate about this role and want to make an impact on a global scale, please apply!
About the team
The Amazon Robotics (AR) Technology Enablement Services (TES) Team enables AR’s people, purpose, and place to deliver the future. We remove barriers, drive organizational productivity, and foster growth. We serve AR leadership, product customers, and employees, and collaborate with teams throughout FTR.  Creating a safe, inclusive, and productive workplace experience.  Designing and iterating on learning, development, and engagement solutions to support needs of operators and employees.  Synthesizing and articulating AR’s long-term strategy, near-term goals, product roadmaps, and workforce strategy.  Developing and managing cross organizational mechanisms, reporting, programs, and Sustainability efforts.",10434946,2026-05-29,2026-05-30,Business Intel Engineer,Westboro,MA,about 10 hours,full-time,Amazon Robotics is at the forefront of applying state-of-the-art artificial intelligence to solve real-world challenges at unprecedented scale. Our fulfillment centers handle more individual items than,"- 2+ years of analyzing and interpreting data with Redshift, Oracle, NoSQL etc. experience
- Experience with data visualization using Tableau, Quicksight, or similar tools
- Experience with one or more industry analytics visualization tools (e.g. Excel, Tableau, QuickSight, MicroStrategy, PowerBI) and statistical methods (e.g. t-test, Chi-squared)
- Experience with scripting language (e.g., Python, Java, or R)","- Master's degree, or Advanced technical degree
- Knowledge of data modeling and data pipeline design
- Experience with statistical analysis, co-relation analysis
Amazon is an equal opportunity employer and does not discriminate on the basis of protected veteran status, disability, or other legally protected status.
Our inclusive culture empowers Amazonians to deliver the best results for our customers. If you have a disability and need a workplace accommodation or adjustment during the application and hiring process, including support for the interview or onboarding process, please visit https://amazon.jobs/content/en/how-we-hire/accommodations for more information. If the country/region you’re applying in isn’t listed, please contact your Recruiting Partner.
The base salary range for this position is listed below. Your Amazon package will include sign-on payments and restricted stock units (RSUs). Final compensation will be determined based on factors including experience, qualifications, and location. Amazon also offers comprehensive benefits including health insurance (medical, dental, vision, prescription, Basic Life & AD&D insurance and option for Supplemental life plans, EAP, Mental Health Support, Medical Advice Line, Flexible Spending Accounts, Adoption and Surrogacy Reimbursement coverage), 401(k) matching, paid time off, and parental leave. Learn more about our benefits at https://amazon.jobs/en/benefits.
USA, MA, Boston - 82,300.00 - 144,000.00 USD annually
USA, MA, North Reading - 82,300.00 - 144,000.00 USD annually
USA, MA, Westboro - 82,300.00 - 144,000.00 USD annually",0.3508
"Senior Product Manager, Relay Product and Tech - Relay Central",ats.team-middle-mile-tech,"US, WA, Bellevue",2026-05-29,https://www.amazon.jobs/en/jobs/10435057/senior-product-manager-relay-product-and-tech-relay-central,amazon,Project/Program/Product Management--Non-Tech,"Amazon Relay is seeking a Senior Product Manager to reimagine and drive the product strategy for how we offer carrier (trucking company) support. In this role, you will own the vision, roadmap, and go-to-market strategy for developing and enhancing the capabilities that ensure all carriers are able to keep their company’s operations with Amazon Relay running smoothly. The importance of this role and product can’t be understated – ineffective and inefficient support leads directly to late packages to customer’s doorsteps. Said another way, keeping the customer promise depends on nailing support. 
This is a high-visibility, high-impact role that requires a combination of product strategy and the ability to influence across engineering, operations, and legal stakeholders. The ideal candidate is a seasoned product leader who thrives in ambiguous, high-stakes environments and has a track record of building products at scale. 
Key job responsibilities
•	Define and own the multi-year product vision and roadmap for Carrier Support Center.
•	Identify and prioritize the highest-impact product investments to improve the current experience.
•	Develop and maintain a deep understanding of the customer and their evolving needs.
•	Define and report on metrics to measure support effectiveness – identifying areas for further improvement
About the team
The Relay Product and Tech Organization sits within the Technology Transportation Services (TTS) organization which builds software systems that work across our vendors, warehouses and carriers to optimize both time and cost of getting the packages delivered. Our services already handle thousands of requests per second, make business decisions impacting billions of dollars a year, integrate with a network of small and large carriers, owner operators and drivers worldwide, manage business rules for millions of unique products, and improve ordering and delivery experience for millions of online shoppers. Our mission is to build the most efficient and optimal transportation solution on the planet, using our science and technology muscle as our biggest advantage.",10435057,2026-05-30,2026-05-30,Product Management,Bellevue,WA,about 8 hours,full-time,"Amazon Relay is seeking a Senior Product Manager to reimagine and drive the product strategy for how we offer carrier (trucking company) support. In this role, you will own the vision, roadmap, and go-to-market","- 5+ years of product or program management, product marketing, business development or technology experience
- Bachelor's degree or equivalent
- Experience owning/driving roadmap strategy and definition
- Experience with end to end product delivery
- Experience with feature delivery and tradeoffs of a product
- Experience as a product manager or owner
- Experience owning technology products","- Experience in influencing senior leadership through data driven insights
- Experience working across functional teams and senior stakeholders
Amazon is an equal opportunity employer and does not discriminate on the basis of protected veteran status, disability, or other legally protected status.
Our inclusive culture empowers Amazonians to deliver the best results for our customers. If you have a disability and need a workplace accommodation or adjustment during the application and hiring process, including support for the interview or onboarding process, please visit https://amazon.jobs/content/en/how-we-hire/accommodations for more information. If the country/region you’re applying in isn’t listed, please contact your Recruiting Partner.
The base salary range for this position is listed below. Your Amazon package will include sign-on payments and restricted stock units (RSUs). Final compensation will be determined based on factors including experience, qualifications, and location. Amazon also offers comprehensive benefits including health insurance (medical, dental, vision, prescription, Basic Life & AD&D insurance and option for Supplemental life plans, EAP, Mental Health Support, Medical Advice Line, Flexible Spending Accounts, Adoption and Surrogacy Reimbursement coverage), 401(k) matching, paid time off, and parental leave. Learn more about our benefits at https://amazon.jobs/en/benefits.
USA, GA, Atlanta - 136,000.00 - 184,100.00 USD annually
USA, WA, Bellevue - 136,000.00 - 184,100.00 USD annually",0.3056
