title,team,location,posted_date,url,source,job_category,description,job_id,first_seen_date,last_seen_date,job_family,city,state,updated_time,schedule_type,description_short,basic_qualifications,preferred_qualifications,semantic_similarity
"Senior Manager, Product Management, Customer Success Intelligence, AWS Specialist and Partner Organization",aws.team-product-management-primary,"US, CA, Mountain View",2026-05-29,https://www.amazon.jobs/en/jobs/10434430/senior-manager-product-management-customer-success-intelligence-aws-specialist-and-partner-organization,amazon,Project/Program/Product Management--Technical,"AWS is seeking an experienced and strategic Senior Manager, Product Management, to lead the CS Intelligence team within the Customer Success Center of Excellence (CS COE), a critical function within the AWS Specialists & Partners (ASP) organization. This role will manage a team of Product Managers who own the customer success platform that scales customer success across AWS. 
As a product leader, you will be responsible for transforming the CS COE from a services team into a product team — building and operating an AI-native platform that powers all Customer Success motions (including Agentic Customer Success). This is a unique opportunity to build a new product capability at AWS, creating an end-to-end system for customer success that partners and customers can build on. 
You will lead a distributed team building specialized AI agents (engagement routing, health monitoring, partner qualification, outcome prediction), platform infrastructure, and post-launch tooling integrations. This leader must be comfortable operating in ambiguity, making high-judgment sequencing decisions across a complex roadmap, and delivering through influence across engineering teams, field organizations, product teams, and partner ecosystems. The ideal candidate brings deep experience building AI/ML-powered products from 0-to-1, combined with the ability to operate at the executive level with both internal stakeholders and external partners. 
Key job responsibilities
- Own the product vision, strategy, and roadmap for the Customer Success platform — the AI/ML intelligence layer powering customer success at scale across AWS 
- Lead, coach, and develop a high-performing team of Product Managers, fostering a culture of customer obsession, technical excellence, and continuous learning 
- Scale Customer Success agents from prototype to production, with measurable quality thresholds and continuous retraining based on outcome data 
- Partner with internal field roles to translate field observations into agent requirements, and with engineering teams to secure data inputs and integration surfaces 
- Establish rigorous success metrics for the platform: agent precision/recall, engagement routing accuracy, coverage expansion, and customer value realization 
- Recruit, hire, and onboard top product and technical talent to scale the team as the platform matures 
- Deliver through influence — working across multiple VPs and their orgs, product teams, and partner networks to drive requirements and adoption without direct authority 
- Champion AI-first ways of working across the CS COE and the broader AWS field delivering 3–5x Customer Success coverage through intelligent automation 
About the team
Diverse Experiences
AWS values diverse experiences. Even if you do not meet all of the preferred qualifications and skills listed in the job description, we encourage candidates to apply. If your career is just starting, hasn’t followed a traditional path, or includes alternative experiences, don’t let it stop you from applying. 
Why AWS?
Amazon Web Services (AWS) is the world’s most comprehensive and broadly adopted cloud platform. We pioneered cloud computing and never stopped innovating — that’s why customers from the most successful startups to Global 500 companies trust our robust suite of products and services to power their businesses.
Inclusive Team Culture
AWS values curiosity and connection. Our employee-led and company-sponsored affinity groups promote inclusion and empower our people to take pride in what makes us unique. Our inclusion events foster stronger, more collaborative teams. Our continual innovation is fueled by the bold ideas, fresh perspectives, and passionate voices our teams bring to everything we do.
Mentorship & Career Growth
We’re continuously raising our performance bar as we strive to become Earth’s Best Employer. That’s why you’ll find endless knowledge-sharing, mentorship and other career-advancing resources here to help you develop into a better-rounded professional. 
Work/Life Balance
We value work-life harmony. Achieving success at work should never come at the expense of sacrifices at home, which is why we strive for flexibility as part of our working culture. When we feel supported in the workplace and at home, there’s nothing we can’t achieve.",10434430,2026-05-29,2026-05-30,Product Management - Technical,Mountain View,CA,about 16 hours,full-time,"AWS is seeking an experienced and strategic Senior Manager, Product Management, to lead the CS Intelligence team within the Customer Success Center of Excellence (CS COE), a critical function within the","- 7+ years of people management, managing engineers experience
- Bachelor's degree in Computer Science, Engineering, or a related technical field
- 10+ years of product management or technical product management experience, with emphasis on AI/ML, data platforms, or intelligent systems
- Experience owning/driving roadmap strategy and definition for platform or infrastructure products - Experience with end-to-end product delivery including ML model development, agent/automation systems, or data platform products
- Experience with feature delivery and tradeoffs of a product — making high-judgment sequencing decisions across competing priorities
- Experience engaging and influencing senior executives across engineering, GTM, and operations organizations
- Experience recruiting and developing high-performing technical teams that deliver outsized results in ambiguous, fast-moving environments","- Knowledge of AWS or cloud technologies
- MBA or advanced degree in a technical field (CS, ML, Data Science)
- Experience building and scaling AI/ML-powered products from 0-to-1 — agent systems, recommendation engines, predictive platforms, or intelligent automation
- Experience with customer success, partner ecosystems, or post-sales product development
- Experience building products that serve both internal teams and external customers/partners simultaneously (platform-as-a-product)
- Track record of productizing manual/human processes through intelligent automation while maintaining quality
- Experience operating in a GTM or commercial organization (not purely engineering) — understanding partner economics, pricing, and commercial model innovation
Amazon is an equal opportunity employer and does not discriminate on the basis of protected veteran status, disability, or other legally protected status.
Los Angeles County applicants: Job duties for this position include: work safely and cooperatively with other employees, supervisors, and staff; adhere to standards of excellence despite stressful conditions; communicate effectively and respectfully with employees, supervisors, and staff to ensure exceptional customer service; and follow all federal, state, and local laws and Company policies. Criminal history may have a direct, adverse, and negative relationship with some of the material job duties of this position. These include the duties and responsibilities listed above, as well as the abilities to adhere to company policies, exercise sound judgment, effectively manage stress and work safely and respectfully with others, exhibit trustworthiness and professionalism, and safeguard business operations and the Company’s reputation. Pursuant to the Los Angeles County Fair Chance Ordinance, we will consider for employment qualified applicants with arrest and conviction records.
Our inclusive culture empowers Amazonians to deliver the best results for our customers. If you have a disability and need a workplace accommodation or adjustment during the application and hiring process, including support for the interview or onboarding process, please visit https://amazon.jobs/content/en/how-we-hire/accommodations for more information. If the country/region you’re applying in isn’t listed, please contact your Recruiting Partner.
The base salary range for this position is listed below. Your Amazon package will include sign-on payments and restricted stock units (RSUs). Final compensation will be determined based on factors including experience, qualifications, and location. Amazon also offers comprehensive benefits including health insurance (medical, dental, vision, prescription, Basic Life & AD&D insurance and option for Supplemental life plans, EAP, Mental Health Support, Medical Advice Line, Flexible Spending Accounts, Adoption and Surrogacy Reimbursement coverage), 401(k) matching, paid time off, and parental leave. Learn more about our benefits at https://amazon.jobs/en/benefits.
USA, CA, Mountain View - 227,600.00 - 307,900.00 USD annually
USA, NY, New York - 217,700.00 - 294,500.00 USD annually
USA, VA, Arlington - 197,900.00 - 267,800.00 USD annually
USA, WA, Seattle - 197,900.00 - 267,800.00 USD annually",0.4322
"Software Development Engineer II, Worldwide Prime Benefits, Prime Benefits",retail.team-us-amazon-prime,"US, WA, Seattle",2026-05-29,https://www.amazon.jobs/en/jobs/10434516/software-development-engineer-ii-worldwide-prime-benefits-prime-benefits,amazon,Software Development,"Are you passionate about transforming the shopping experience for millions of Prime members worldwide? Join Amazon's Benefits, Pricing & Constructs team where you'll build innovative technical solutions that directly impact customer satisfaction and engagement. You'll tackle complex architectural challenges that span multiple tech stacks, designing scalable systems that serve millions of Prime members globally.
In this role, you'll drive technical innovation in the benefits space by adopting novel approaches and technologies. You'll collaborate with cross-functional teams to create operationally sustainable solutions while mentoring fellow engineers and contributing to a culture of technical excellence. This is your opportunity to solve challenging problems that cut across diverse technologies while building high-impact products that enhance the Prime membership experience.
Key job responsibilities
Design and implement scalable technical solutions for key Prime benefit products that reach millions of members worldwide, ensuring operational sustainability and performance at scale
Lead technical problem-solving for complex architectural components, contributing to the full software development lifecycle including scoping, design, code, testing, deployment, and maintenance
Collaborate with senior engineers to develop architecture solutions and provide meaningful feedback through active participation in code reviews for team members at all levels
Drive technical innovations in the benefits space through adoption of novel approaches and technologies, balancing customer requirements with team operational needs
Mentor junior engineers on software development best practices while documenting team software construction, testing, and operational procedures for knowledge sharing
A day in the life
You'll start your day analyzing performance metrics for Prime benefit systems, then dive into leading technical design sessions with senior engineers to architect solutions for upcoming features. Mid-morning, you'll conduct code reviews, providing constructive feedback to teammates and ensuring operational excellence standards. Afternoons often involve hands-on development work, implementing scalable solutions that will serve millions of customers, followed by mentoring sessions with junior engineers where you share best practices and guide their technical growth.
About the team
The Worldwide Prime Benefits, Pricing & Constructs team drives Amazon's north star vision to create Earth's most engaging, satisfying, and loved membership program. Our mission focuses on four key areas: increasing potential value through innovative benefits, making Prime members aware of their program value, scaling new constructs to reach distinct customer segments, and growing long-term free cash flow through strategic partnerships and pricing decisions.
You'll join a collaborative team that values knowledge-sharing, mentorship, and technical innovation. Our inclusive environment celebrates different perspectives and experiences, fostering growth through continuous learning opportunities and challenging projects that directly impact millions of Prime members across the globe.",10434516,2026-05-29,2026-05-30,Software Development,Seattle,WA,about 10 hours,full-time,"Are you passionate about transforming the shopping experience for millions of Prime members worldwide? Join Amazon's Benefits, Pricing & Constructs team where you'll build innovative technical solutions","- 3+ years of non-internship professional software development experience
- 2+ years of non-internship design or architecture (design patterns, reliability and scaling) of new and existing systems experience
- 1+ years of software development engineer or related occupational experience
- 1+ years of designing and developing large-scale, multi-tiered, multi-threaded, embedded or distributed software applications, tools, systems, and services using: C#, C++, Java, or Perl experience
- 1+ years of Object Oriented Design experience
- Bachelor's degree or foreign equivalent in Computer Science, Engineering, Mathematics, or a related field
- Experience programming with at least one software programming language","- 3+ years of full software development life cycle, including coding standards, code reviews, source control management, build processes, testing, and operations experience
- Bachelor's degree in computer science or equivalent
Amazon is an equal opportunity employer and does not discriminate on the basis of protected veteran status, disability, or other legally protected status.
Our inclusive culture empowers Amazonians to deliver the best results for our customers. If you have a disability and need a workplace accommodation or adjustment during the application and hiring process, including support for the interview or onboarding process, please visit https://amazon.jobs/content/en/how-we-hire/accommodations for more information. If the country/region you’re applying in isn’t listed, please contact your Recruiting Partner.
The base salary range for this position is listed below. Your Amazon package will include sign-on payments and restricted stock units (RSUs). Final compensation will be determined based on factors including experience, qualifications, and location. Amazon also offers comprehensive benefits including health insurance (medical, dental, vision, prescription, Basic Life & AD&D insurance and option for Supplemental life plans, EAP, Mental Health Support, Medical Advice Line, Flexible Spending Accounts, Adoption and Surrogacy Reimbursement coverage), 401(k) matching, paid time off, and parental leave. Learn more about our benefits at https://amazon.jobs/en/benefits.
USA, WA, Seattle - 143,700.00 - 194,400.00 USD annually",0.4526
"System Eng, HW Validation, Customer Terminals Hardware Design ",alexa-and-amazon-devices.team-project-kuiper,"US, WA, Redmond",2026-05-29,https://www.amazon.jobs/en/jobs/10434734/system-eng-hw-validation-customer-terminals-hardware-design,amazon,Hardware Development,"Amazon Leo is an initiative to launch a constellation of Low Earth Orbit satellites that will provide low-latency, high-speed broadband connectivity to unserved and underserved communities around the world. Come work at Amazon!
Key job responsibilities
As a System Validation Hardware Engineer, you will be part of a team of experts working on the development of advanced Customer Terminal products. You will be responsible for managing the test and validation of PCBA-level hardware across various programs, reporting validation status and failures, and driving long-term test improvement initiatives.
You will own or contribute to the following:
- Develop, execute, and maintain PCBA-level test and validation plans across multiple product programs
- Perform board bring-up, functional testing, and debug of modules and subsystems
- Report and track validation status, test results, and failure analysis across programs
- Consolidate test data from multiple sources and programs, and develop clear presentations and reports to communicate validation status, trends, and risks to stakeholders
- Drive root cause analysis on hardware failures and collaborate with design teams on corrective actions
- Design and improve automated test systems, test fixtures, and factory test solutions
- Support flow-down requirement definitions and generate test plans/procedures aligned to product specifications
- Identify trends in test data and drive long-term test process and coverage improvement initiatives
- Collaborate with cross-functional teams (design, manufacturing, quality) to support the transition of designs to mass production
- Evaluate and validate high-speed digital and/or RF circuit performance at the board level
- Support signal and power integrity validation and correlation to simulation models
Export Control Requirement: Due to applicable export control laws and regulations, candidates must be a U.S. citizen or national, U.S. permanent resident (i.e., current Green Card holder), or lawfully admitted into the U.S. as a refugee or granted asylum.",10434734,2026-05-29,2026-05-30,Hardware Development,Redmond,WA,about 13 hours,full-time,"Amazon Leo is an initiative to launch a constellation of Low Earth Orbit satellites that will provide low-latency, high-speed broadband connectivity to unserved and underserved communities around the world.","- 2+ years of hardware design and validation of components, subsystems and systems experience
- Bachelor's degree in mechanical engineering, electrical engineering, material science, physics or equivalent","- Knowledge of engineering practices and patterns for the full software/hardware/networks development life cycle, including coding standards, code reviews, source control management, build processes, testing, certification, and livesite operations
- Experience with hardware/software integration and real-time systems
Amazon is an equal opportunity employer and does not discriminate on the basis of protected veteran status, disability, or other legally protected status.
Our inclusive culture empowers Amazonians to deliver the best results for our customers. If you have a disability and need a workplace accommodation or adjustment during the application and hiring process, including support for the interview or onboarding process, please visit https://amazon.jobs/content/en/how-we-hire/accommodations for more information. If the country/region you’re applying in isn’t listed, please contact your Recruiting Partner.
The base salary range for this position is listed below. Your Amazon package will include sign-on payments and restricted stock units (RSUs). Final compensation will be determined based on factors including experience, qualifications, and location. Amazon also offers comprehensive benefits including health insurance (medical, dental, vision, prescription, Basic Life & AD&D insurance and option for Supplemental life plans, EAP, Mental Health Support, Medical Advice Line, Flexible Spending Accounts, Adoption and Surrogacy Reimbursement coverage), 401(k) matching, paid time off, and parental leave. Learn more about our benefits at https://amazon.jobs/en/benefits.
USA, WA, Redmond - 96,600.00 - 160,000.00 USD annually",0.3642
"Corporate Counsel - Last Mile Automation, Stores & Operations Legal",legal.team-legal-counsel,"US, WA, Seattle",2026-05-29,https://www.amazon.jobs/en/jobs/10434979/corporate-counsel-last-mile-automation-stores-operations-legal,amazon,Legal,"Amazon is seeking an experienced attorney to join Amazon’s legal team as lead counsel for the development and operation of autonomous vehicles and robotics solutions for Amazon’s last mile delivery operations.  This role offers a unique opportunity to work at the intersection of technology and complex regulatory frameworks, supporting one of Amazon's most innovative initiatives in transforming last mile logistics.
You will provide strategic legal counsel on product development, regulatory compliance, and commercial transactions for autonomous delivery vehicles and robotics systems. Working closely with engineering, operations, and business teams, you will navigate novel legal issues in federal and state vehicle regulations, product safety, and AI regulation, as well as data privacy, intellectual property, and technology licensing.  This position requires someone who thrives in ambiguous environments and can provide proactive, practical, business-oriented legal guidance on emerging technologies.
Key job responsibilities
- Serve as primary legal counsel for autonomous vehicle and robotics initiatives supporting Amazon's last mile delivery operations
- Advise on federal and state regulatory compliance for autonomous vehicles, including NHTSA regulations, DOT requirements, and state-specific autonomous vehicle and personal robot laws
- Provide product counseling on autonomous vehicle systems, robotics technologies, and related hardware/software development
- Draft, review, and negotiate complex commercial agreements including technology licensing, development partnerships, and vendor contracts
- Partner with cross-functional teams including engineering, operations, product management, and public policy on strategic initiatives
- Develop scalable legal processes and frameworks to support rapid innovation and deployment across multiple jurisdictions
- Manage relationships with outside counsel on specialized regulatory matters and litigation
- Advise on AI, data privacy, cybersecurity, and intellectual property issues related to autonomous systems
- Support risk assessment and mitigation strategies for novel technology deployments
- Collaborate with public policy teams on regulatory engagement and advocacy efforts
A day in the life
You will work on some of the most challenging and novel legal issues in the autonomous vehicle and robotics space. Your day might include advising engineers on regulatory requirements for a new vehicle feature, negotiating a partnership agreement with an automotive technology provider, analyzing new state legislation on autonomous vehicles, or developing compliance frameworks for multi-state deployments. You will have direct impact on bringing innovative delivery solutions to customers while ensuring legal and regulatory compliance. This role offers significant autonomy, executive visibility, and the opportunity to shape legal strategy for emerging technologies.
About the team
This position is part of Amazon's Worldwide Operations Legal team, supporting last mile delivery. You will work closely with business leaders who are developing autonomous vehicles and robotics solutions that will transform how Amazon delivers to customers. The team values innovation, customer obsession, and practical problem-solving. You will collaborate with attorneys across multiple practice areas including product counsel, regulatory, commercial transactions, and litigation. This is a high-growth area with significant investment and executive attention.",10434979,2026-05-29,2026-05-30,Legal,Seattle,WA,about 10 hours,full-time,Amazon is seeking an experienced attorney to join Amazon’s legal team as lead counsel for the development and operation of autonomous vehicles and robotics solutions for Amazon’s last mile delivery operations.,"- 5+ years of post bar admission legal experience
- Juris Doctor and membership in one state bar or equivalent","- Experience in Product Safety & Compliance Law
- Experience working closely with and advising senior executives of an organization or equivalent
- Experience working independently and directly with all levels of legal and business partners or equivalent
- Experience in Transportation Law
- Experience in technology and commercial transactions or businesses
Amazon is an equal opportunity employer and does not discriminate on the basis of protected veteran status, disability, or other legally protected status.
Our inclusive culture empowers Amazonians to deliver the best results for our customers. If you have a disability and need a workplace accommodation or adjustment during the application and hiring process, including support for the interview or onboarding process, please visit https://amazon.jobs/content/en/how-we-hire/accommodations for more information. If the country/region you’re applying in isn’t listed, please contact your Recruiting Partner.
The base salary range for this position is listed below. Your Amazon package will include sign-on payments and restricted stock units (RSUs). Final compensation will be determined based on factors including experience, qualifications, and location. Amazon also offers comprehensive benefits including health insurance (medical, dental, vision, prescription, Basic Life & AD&D insurance and option for Supplemental life plans, EAP, Mental Health Support, Medical Advice Line, Flexible Spending Accounts, Adoption and Surrogacy Reimbursement coverage), 401(k) matching, paid time off, and parental leave. Learn more about our benefits at https://amazon.jobs/en/benefits.
USA, NY, New York - 169,300.00 - 229,000.00 USD annually
USA, VA, Arlington - 153,900.00 - 208,200.00 USD annually
USA, WA, SEATTLE - 153,900.00 - 208,200.00 USD annually",0.3336
