title,team,location,posted_date,url,source,job_category,description,job_id,first_seen_date,last_seen_date,job_family,city,state,updated_time,schedule_type,description_short,basic_qualifications,preferred_qualifications,semantic_similarity
"Supplier Quality Engineer, (Infrastructure Reliability & Quality Engineer)",aws.team-support-engineer-primary,"US, VA, Herndon",2026-05-29,https://www.amazon.jobs/en/jobs/10434851/supplier-quality-engineer-infrastructure-reliability-quality-engineer,amazon,"Systems, Quality, & Security Engineering","AWS Infrastructure Services owns the design, planning, delivery, and operation of all AWS global infrastructure. In other words, we’re the people who keep the cloud running. We support all AWS data centers and all of the servers, storage, networking, power, and cooling equipment that ensure our customers have continual access to the innovation they rely on. We work on the most challenging problems, with thousands of variables impacting the supply chain — and we’re looking for talented people who want to help.
You’ll join a diverse team of software, hardware, and network engineers, supply chain specialists, security experts, operations managers, and other vital roles. You’ll collaborate with people across AWS to help us deliver the highest standards for safety and security while providing seemingly infinite capacity at the lowest possible cost for our customers. And you’ll experience an inclusive culture that welcomes bold ideas and empowers you to own them to completion.
The AWS Field Engineering organization provides engineering support for our data centers throughout their lifecycle. A critical piece of this support is ensuring the highest level of initial quality and ongoing support from our vendors. As a Supplier Quality Engineer you will interface daily with AWS Engineering teams, Procurement teams, and vendors to manage infrastructure equipment quality. Our Supplier Quality Engineer is responsible for supplier qualifications, quality monitoring at supplier sites, supplier quality issue resolution and supplier development and quality improvement initiatives.
If you want to be a part of a team that has a daily impact on company success, this is a great opportunity for you.
In this role you will lead internal and external engagements with engineering, procurement, supply chain management, operations, finance, construction, and suppliers to deliver robust and resilient quality systems at our vendors and within AWS. You will identify supplier quality defects or waste in AWS processes, and drive new processes to eliminate the defects and prevent them from recurring without posing risk to availability.
 
Key job responsibilities
 •	Develop, implement and maintain the Supplier Quality roadmap for complex electrical and or mechanical infrastructure equipment to meet the technical and quality requirements.
 •	Manage complete equipment lifecycle quality, working closely with suppliers, engineering, procurement and other internal stakeholders.
 •	Responsible for improving equipment quality by identifying and closing gaps by performing thorough on-site audits to ensure suppliers' quality systems, products, and processes are meeting AWS Quality and product specification requirements.
 •	Drive Supplier Quality Improvement Programs track supplier performance along with goal settings for key performance indicators.
 •	Develop critical to quality parameters, perform critical-to-quality inspections and functional testing for complex equipment to ensure suppliers provide defect-free, high quality equipment to AWS and its customers.
 •	Review historical failures, equipment design changes and lessons learned to incorporate relevant inspections & tests and update equipment technical specifications.
 •	Lead complex electrical and mechanical infrastructure equipment as well as critical component(s) root cause analysis, working with suppliers, cross-functional teams such as reliability and design engineering teams.
 •	Responsible for evaluating and validating complex root cause analysis reports from a technical perspective using critical thinking and quality principles.
 •	Develop new product (equipment) and/or new supplier qualification plans in terms of quality. Drive the quality program from prototyping to mass production stage for complex electrical and mechanical equipment that are part of AWS Data Centers.
 •	Ability to perform data analysis on failures reported during the equipment life cycle and create technical reports to provide design and specification improvement inputs and to drive improvement(s) at supplier factories.
 •	Work on concurrent projects, sometimes in multiple geographical regions.
 •	Demonstrate a can-do attitude and thriving in a fast-paced work environment.
 •	Keys to success in this role include sound judgment and excellent written and verbal communication skills.
 •	This role requires 30-50% international and domestic travel.
About the team
Why AWS
Amazon Web Services (AWS) is the world’s most comprehensive and broadly adopted cloud platform. We pioneered cloud computing and never stopped innovating — that’s why customers from the most successful startups to Global 500 companies trust our robust suite of products and services to power their businesses.
Diverse Experiences
Amazon values diverse experiences. Even if you do not meet all of the preferred qualifications and skills listed in the job description, we encourage candidates to apply. If your career is just starting, hasn’t followed a traditional path, or includes alternative experiences, don’t let it stop you from applying.
Work/Life Balance
We value work-life harmony. Achieving success at work should never come at the expense of sacrifices at home, which is why we strive for flexibility as part of our working culture. When we feel supported in the workplace and at home, there’s nothing we can’t achieve in the cloud.
Inclusive Team Culture
Here at AWS, it’s in our nature to learn and be curious. Our employee-led affinity groups foster a culture of inclusion that empower us to be proud of our differences. Ongoing events and learning experiences, including our Conversations on Race and Ethnicity (CORE) and AmazeCon (gender diversity) conferences, inspire us to never stop embracing our uniqueness.
Mentorship and Career Growth
We’re continuously raising our performance bar as we strive to become Earth’s Best Employer. That’s why you’ll find endless knowledge-sharing, mentorship and other career-advancing resources here to help you develop into a better-rounded professional.",10434851,2026-05-29,2026-05-30,Data Center Infrastructure Eng,Herndon,VA,about 12 hours,full-time,"AWS Infrastructure Services owns the design, planning, delivery, and operation of all AWS global infrastructure. In other words, we’re the people who keep the cloud running. We support all AWS data centers","- Bachelor's degree in Electrical Engineering or a related field
- 5+ years of quality assurance engineering experience
- Experience in industrial or commercial engineering in mission critical facilities including but not limited to: data centers, power generation or oil and gas facilities
- 5+ years of supplier interaction, cross team collaboration","- Master's degree in Electrical or Mechanical Engineering, or Master's degree in engineering, management, or technology
Amazon is an equal opportunity employer and does not discriminate on the basis of protected veteran status, disability, or other legally protected status.
Our inclusive culture empowers Amazonians to deliver the best results for our customers. If you have a disability and need a workplace accommodation or adjustment during the application and hiring process, including support for the interview or onboarding process, please visit https://amazon.jobs/content/en/how-we-hire/accommodations for more information. If the country/region you’re applying in isn’t listed, please contact your Recruiting Partner.
The base salary range for this position is listed below. Your Amazon package will include sign-on payments and restricted stock units (RSUs). Final compensation will be determined based on factors including experience, qualifications, and location. Amazon also offers comprehensive benefits including health insurance (medical, dental, vision, prescription, Basic Life & AD&D insurance and option for Supplemental life plans, EAP, Mental Health Support, Medical Advice Line, Flexible Spending Accounts, Adoption and Surrogacy Reimbursement coverage), 401(k) matching, paid time off, and parental leave. Learn more about our benefits at https://amazon.jobs/en/benefits.
USA, VA, Herndon - 116,800.00 - 160,000.00 USD annually",0.3535
"Connectivity Cloud Hardware Engineer, Network Product Development ",aws.team-hardware-development-primary,"US, TX, Austin",2026-05-29,https://www.amazon.jobs/en/jobs/10434797/connectivity-cloud-hardware-engineer-network-product-development,amazon,Hardware Development,"AWS Infrastructure Services owns the design, planning, delivery, and operation of all AWS global infrastructure. In other words, we’re the people who keep the cloud running. We support all AWS data centers and all of the servers, storage, networking, power, and cooling equipment that ensure our customers have continual access to the innovation they rely on. We work on the most challenging problems, with thousands of variables impacting the supply chain — and we’re looking for talented people who want to help. 
You’ll join a diverse team of software, hardware, and network engineers, supply chain specialists, security experts, operations managers, and other vital roles. You’ll collaborate with people across AWS to help us deliver the highest standards for safety and security while providing seemingly infinite capacity at the lowest possible cost for our customers. And you’ll experience an inclusive culture that welcomes bold ideas and empowers you to own them to completion.
Key job responsibilities
•	Collaborate with vendors/manufacturers to develop and evaluate new Fiber Optic solutions and come up with implementation plans for incorporating them into the network
•	Design and specify structured cabling systems (fiber, copper, cable trays/duct banks) for network layers at hyperscale data centers
•	Develop standards, reference designs, and installation guidelines for physical network/cabling deployments and structured cabling systems
•	Focus on ambiguous problem areas in existing or new network architecture and systems development initiatives, propose and deliver projects that have a significant business and/or customer impact
•	Manage fiber vendors and contractors; perform quality control and commissioning of fiber bundles and structured cabling systems
•	Perform mitigation analysis and site inspections to validate as-built conditions, ensuring compliance with design and operational requirements
•	Monitor network/system/link quality and build mechanism to remediate large scale events and improve health of our links
•	Troubleshoot and resolve issues that are causal to fiber connectivity and fiver plant design
•	Maintain documentation, drawings, and asset records for physical fiber network components across global sites
A day in the life
On an everyday basis as an engineer or scientist on our team, you have the unique opportunity to understand the growing AWS network and our internal customers' requirement on interconnect solutions, and work backwards to devise fiber connectivity solutions by influencing the broad industry and/or to develop software tools with sister teams to maintain a highly available network that delights AWS customers. You design and implement processes and mechanisms that both help the team to deliver business impact to the organization in a systemic way, while also helping to raise the bar on our operational excellence.
You'll bridge design, construction, and operations, ensuring that every layer of physical networking from fiber trunks to copper patching meets high standards of performance, reliability, and scalability.
About the team
Within AWS Networking, the Network Product Development (NPD) organization is responsible for designing the network fiber connectivity designs and owning the implementation plans that power the global AWS network. Beyond product delivery, we actively manage the fiber infrastructure in a network that grows by 70% annually. This means tracking key business and operational metrics to ensure that we operate smoothly and minimize or eliminate customer impact due to device related issues for a transparent AWS customer experience.
Why AWS
Amazon Web Services (AWS) is the world’s most comprehensive and broadly adopted cloud platform. We pioneered cloud computing and never stopped innovating — that’s why customers from the most successful startups to Global 500 companies trust our robust suite of products and services to power their businesses.
Diverse Experiences
Amazon values diverse experiences. Even if you do not meet all of the preferred qualifications and skills listed in the job description, we encourage candidates to apply. If your career is just starting, hasn’t followed a traditional path, or includes alternative experiences, don’t let it stop you from applying.
Work/Life Balance
We value work-life harmony. Achieving success at work should never come at the expense of sacrifices at home, which is why we strive for flexibility as part of our working culture. When we feel supported in the workplace and at home, there’s nothing we can’t achieve in the cloud.
Inclusive Team Culture
Here at AWS, it’s in our nature to learn and be curious. Our employee-led affinity groups foster a culture of inclusion that empower us to be proud of our differences. Ongoing events and learning experiences, including our Conversations on Race and Ethnicity (CORE) and AmazeCon (gender diversity) conferences, inspire us to never stop embracing our uniqueness.
Mentorship and Career Growth
We’re continuously raising our performance bar as we strive to become Earth’s Best Employer. That’s why you’ll find endless knowledge-sharing, mentorship and other career-advancing resources here to help you develop into a better-rounded professional.",10434797,2026-05-29,2026-05-30,Cloud Hardware Development,Austin,TX,about 13 hours,full-time,"AWS Infrastructure Services owns the design, planning, delivery, and operation of all AWS global infrastructure. In other words, we’re the people who keep the cloud running. We support all AWS data centers","- Bachelor's degree in Electrical or Communications Engineering or a related field
- 1+ years of data center experience, or experience with cabling infrastructure best practices and methodologies
- Expertise in industry standards such as ANSI/TIA, BICSI and other relevant structured cabling guidelines
- 2+ years of experience developing test requirement and scripts for fiber validation and characterization
- Proven ability to coordinate with cross-functional teams and external vendors on large-scale projects
- Strong skills in reviewing and interpreting technical drawings, cable schedules, and documentation management","- Master's degree, or PhD and 3+ years of industry or academic research experience
- Certifications such as BICSI, RCDD, etc.
- Expertise in hardware and systems design and development
- Experience with pluggable optics (i.e SFP, SFP+, QSFP, QSFP-DD, OSFP)
- Experience working in hyper-scale cloud, AI or high-performance computing environments
- Experience working with ODM and CM suppliers of Optical Modules
Amazon is an equal opportunity employer and does not discriminate on the basis of protected veteran status, disability, or other legally protected status.
Los Angeles County applicants: Job duties for this position include: work safely and cooperatively with other employees, supervisors, and staff; adhere to standards of excellence despite stressful conditions; communicate effectively and respectfully with employees, supervisors, and staff to ensure exceptional customer service; and follow all federal, state, and local laws and Company policies. Criminal history may have a direct, adverse, and negative relationship with some of the material job duties of this position. These include the duties and responsibilities listed above, as well as the abilities to adhere to company policies, exercise sound judgment, effectively manage stress and work safely and respectfully with others, exhibit trustworthiness and professionalism, and safeguard business operations and the Company’s reputation. Pursuant to the Los Angeles County Fair Chance Ordinance, we will consider for employment qualified applicants with arrest and conviction records.
Our inclusive culture empowers Amazonians to deliver the best results for our customers. If you have a disability and need a workplace accommodation or adjustment during the application and hiring process, including support for the interview or onboarding process, please visit https://amazon.jobs/content/en/how-we-hire/accommodations for more information. If the country/region you’re applying in isn’t listed, please contact your Recruiting Partner.
The base salary range for this position is listed below. Your Amazon package will include sign-on payments and restricted stock units (RSUs). Final compensation will be determined based on factors including experience, qualifications, and location. Amazon also offers comprehensive benefits including health insurance (medical, dental, vision, prescription, Basic Life & AD&D insurance and option for Supplemental life plans, EAP, Mental Health Support, Medical Advice Line, Flexible Spending Accounts, Adoption and Surrogacy Reimbursement coverage), 401(k) matching, paid time off, and parental leave. Learn more about our benefits at https://amazon.jobs/en/benefits.
USA, CA, Cupertino - 157,300.00 - 212,800.00 USD annually
USA, TX, Austin - 136,000.00 - 184,000.00 USD annually
USA, VA, Herndon - 136,000.00 - 184,000.00 USD annually",0.4509
"Quality Assurance Engineer II, Prime Tech",retail.team-us-amazon-prime,"US, WA, Seattle",2026-05-29,https://www.amazon.jobs/en/jobs/10434991/quality-assurance-engineer-ii-prime-tech,amazon,"Systems, Quality, & Security Engineering","GET READY TO DO SOMETHING BIG!
Over 100 million paid members in 24 countries around the world enjoy the many benefits of Prime, including the best of shopping and entertainment from Amazon.
In the U.S. that includes unlimited access to award-winning movies and TV episodes with Prime Video; unlimited access to Prime Music, Prime Reading, Amazon Photos, Twitch Prime; early access to select Lightning Deals, one free pre-released book a month with Amazon First Reads, and more. Prime members can also get deep discounts on select popular products at Whole Foods Market plus an additional 10 percent off hundreds of sale items. Prime was built on the foundation of unlimited fast, free shipping and members receive Prime FREE One-Day Shipping and Prime FREE Same-Day Delivery in more than 8,000 cities and towns, two-hour delivery with Prime Now in more than 30 major cities and unlimited Free Two-Day Shipping on more than 100 million items. Our systems are invoked in every physical good purchase made worldwide through Amazon.
Key job responsibilities
Our QAEs test code at both the service and user level, using a variety of black box, gray box, and white box testing techniques. As a QA Engineer, you will innovate our test strategy across multiple dependencies, locales and device types and implement highly scalable automation to enable both UI (web and device level) and back end testing.
You will work to be able to understand software internals, debug complex problems including performance bottlenecks, and write automated tests in and/or using existing automated tools.
QA Engineers work with Software Development Engineers and Business Owners to understand business drivers and technical implementation of features.
QA Engineers also work with groups such as Product Management, User Interaction, and Customer Support to understand customer usage models and develop test plans and suites that approximate real-world environments and regression tests.
You must have experience in diagnosing project release problems and taking corrective action, such as escalating as needed, to resolve and achieve results. Our QAEs are also responsible for driving our software development process toward quality-centric methodologies and for reporting on test progress, metrics, and issues.
A day in the life
A QAE IIs role at Prime and Amazon involves, building and writing test strategy documents, creating test plans, driving test execution along with peers and stakeholders (SDM, QAM, QAE, SDE, TPM, PM etc.) writing test automation using top-notch inbuilt testing frameworks, debugging and reporting.
A QAE II on the team is also required to participate in hiring and mentorship of peers and junior employees.",10434991,2026-05-29,2026-05-30,Systems Quality,Seattle,WA,about 9 hours,full-time,"GET READY TO DO SOMETHING BIG!Over 100 million paid members in 24 countries around the world enjoy the many benefits of Prime, including the best of shopping and entertainment from Amazon.In the U.S. that","- 4+ years of quality assurance engineering experience
- Experience in manual testing
- Experience in automation testing
- Experience as QA lead on medium to large sized projects","- Experience with at least one automated test framework like Selenium or Appium
- Experience in gathering test requirements to create detailed test plans and defining quality metrics to measure product quality
Amazon is an equal opportunity employer and does not discriminate on the basis of protected veteran status, disability, or other legally protected status.
Our inclusive culture empowers Amazonians to deliver the best results for our customers. If you have a disability and need a workplace accommodation or adjustment during the application and hiring process, including support for the interview or onboarding process, please visit https://amazon.jobs/content/en/how-we-hire/accommodations for more information. If the country/region you’re applying in isn’t listed, please contact your Recruiting Partner.
The base salary range for this position is listed below. Your Amazon package will include sign-on payments and restricted stock units (RSUs). Final compensation will be determined based on factors including experience, qualifications, and location. Amazon also offers comprehensive benefits including health insurance (medical, dental, vision, prescription, Basic Life & AD&D insurance and option for Supplemental life plans, EAP, Mental Health Support, Medical Advice Line, Flexible Spending Accounts, Adoption and Surrogacy Reimbursement coverage), 401(k) matching, paid time off, and parental leave. Learn more about our benefits at https://amazon.jobs/en/benefits.
USA, WA, Seattle - 113,900.00 - 160,000.00 USD annually",0.2166
