title,team,location,city,state,posted_date,job_id,internal_job_id,requisition_id,position_id,source,first_seen_date,last_seen_date,semantic_similarity,management_level,job_profile,job_category,job_family,worker_type,worker_sub_type,schedule_type,time_type,company_name,cost_center,office,country,brand,industry,experience_level,remote,hybrid,url,description_short,description
"Manager, Business Development",AMER Sales,"Austin, , United States",Austin,,2026-04-06,6000000000976532,b7fb27b2-824a-44dc-9b3d-e7e000384ac2,R101493,e652e058-a42c-47f2-96a4-4caa85da671a,canva,2026-06-07,2026-06-16,0.4289,C1,Business Development,Sales,Sales & Success,Employee,,Full-time,Full-time,Canva,Go To Market,Sales & Success,United States,Canva,Computer Software,Not Applicable,False,False,https://jobs.smartrecruiters.com/Canva/6000000000976532-manager-business-development,,"Join the team redefining how the world experiences design.
Hello, g'day, mabuhay, kia ora, 你好, hallo, vítejte!
Thanks for stopping by. We know job hunting can be a little time consuming and you're probably keen to find out what's on offer, so we'll get straight to the point.
Where and how you can work
Our flagship office is in Sydney, Australia, but we've made our way from down under, to hubs in Austin and San Francisco, which are now home to our US operations. This is a hybrid role based in Austin, Texas. 
What you’d be doing in this role
As Canva scales change continues to be part of our DNA. But we like to think that's all part of the fun. So this will give you the flavour of the type of things you'll be working on when you start, but this will likely evolve.
At the moment, this role is focused on:Leading, mentoring, and developing a team of Business Development professionals, providing guidance, support, and mentorship to ensure their success.Developing and implementing strategies to expand Canva's presence in the North American region, aligning with the company's overall goals.Identifying and encouraging strategic partnerships and business opportunities that drive growth and revenue.Collaborating closely with cross-functional teams, including Sales, Marketing, Product, and Customer Success, to ensure alignment and successful execution of business development strategies.Analyzing market trends, competitive landscapes, and customer needs to provide insights and recommendations for business expansion and product development.Establishing and maintaining positive relationships with key customers, clients, and industry partners.You're probably a match ifYou have 5 years of experience in business development, with a consistent record of success in the North American region.You have prior experience in a managerial or leadership role, with the ability to lead and encourage a team to achieve goals.You possess excellent communication, negotiation, and presentation skills.You are a strategic problem solver and able to work in a fast-paced, global environment.You have experience in the technology, SaaS, or a related industry.
About the teamAs a Manager of the Business Development Team supporting North America, you will be responsible for leading and driving the business development initiatives in this region. Your primary focus will be to expand our partnerships, identify growth opportunities, and support revenue generation across multiple markets. This role will involve managing a team, collaborating with global customers, and strategically encouraging new business relationships.
 What's in it for you?Achieving our crazy big goals motivates us to work hard - and we do - but you'll experience lots of moments of magic, connectivity and fun woven throughout life at Canva, too. We also offer a range of benefits to set you up for every success in and outside of work.Here's a taste of what's on offer:Equity packages - we want our success to be yours tooHealth benefits plans to support you and your wellbeing401(k) retirement plan with company contributionInclusive parental leave policy that supports all parents & carersAn annual Vibe & Thrive allowance to support your wellbeing, social connection, office setup & moreFlexible leave options that empower you to be a force for good, take time to recharge and supports you personallyOther stuff to knowWe make hiring decisions based on your experience, skills, merit and business needs, in compliance with applicable local laws.We celebrate all types of skills and backgrounds at Canva so even if you don’t feel like your skills quite match what’s listed above - we still want to hear from you!When you apply, please tell us the pronouns you use and any reasonable adjustments you may need during the interview process. Please note that interviews are conducted virtually.Check out lifeatcanva.com for more info."
"Senior Manager, Indirect Tax",Finance,"San Francisco, CA, United States",San Francisco,CA,2026-04-02,6000000000975113,00c3222a-47d0-421b-967f-7f5e42da2279,REF4469J,8ed5d78c-dfee-4085-b872-c9a4176c02e5,canva,2026-06-07,2026-06-10,0.4129,B4,Tax,Finance,Finance,Employee,,Full-time,Full-time,Canva,,,United States,Canva,Computer Software,Mid-Senior Level,False,True,https://jobs.smartrecruiters.com/Canva/6000000000975113-senior-manager-indirect-tax,,"Hey, g'day, mabuhay, kia ora, 你好, hallo, vítejte!Thanks for stopping by. We know job hunting can be a little time-consuming and you're probably keen to find out what's on offer, so we'll get straight to the point.Where and how you can workOur flagship office is in Sydney, Australia, but we've made our way from down under, to our hubs in San Francisco and Austin, which is now home to our US operations. We offer flexibility in how and where you work. We trust our Canvanauts to choose the balance that empowers them and their team to achieve their goals.About the teamOur Tax team’s mission is to modernise a traditional tax cost centre into “Tax-as-a-Partner” to ‘protect and serve’ the business, the needs of our employees, our investors, global Government and Tax Authorities where we operate, and ultimately the users of Canva’s amazing product.Our guiding principle is to operate in a manner that reflects our core value of being a good global citizen. We’re focussed on enhancing the foundations of the Tax function as Canva enters an exciting era of operating as a Big Company! We want to do all this within a fun and engaging environment that promotes collaboration, forward thinking and continuous improvement all whilst making tax as painless as possible.What you’ll be doing in this roleWe’re seeking a highly motivated and experienced Senior Indirect Tax Manager to join our dynamic team. You’ll have a strong background in indirect tax compliance, accounting for indirect taxes, preparing commercially focused indirect tax advice, an aptitude for project management and utilising technology and automation. The ideal candidate will have experience in both private and public companies. You will be hands-on, responsible for overseeing the day-to-day indirect tax operations of the company in the US, Canada and Latin America, ensuring compliance, transparency and accuracy. Your expertise will play a pivotal role in ensuring that our processes and policies support the scale and complexity of a rapidly-expanding company.At the moment, the role is focused on:Overseeing the timely and accurate preparation of monthly, quarterly and annual indirect tax compliance obligations in the US, Canada and Latin America.Delivering global accounting and reporting of indirect taxes for financial statement purposes, including reconciling and supporting any provision balances.Assessing and mitigating indirect tax risks, providing recommendations for improvement and optimisation through the use of technology and automation to enhance efficiency and accuracy.Driving collaboration across departments to enhance cross-functional understanding of indirect tax.Diving into complex indirect tax technical matters to develop and implement solutions for critical business needs, drafting position papers and being a key point of contact for indirect tax matters within your scope of responsibility.Supporting the development and implementation of indirect tax strategies that align with business objectivesTaking your continuous learning style to the next level as you plunge into the ever changing indirect tax developments around the world to help identify and address impacts to Canva.You’re probably a match if you have:Exceptional communication and stakeholder management skills with the ability to effectively collaborate with cross-functional teams to drive momentum across critical projectsAn eye for detail, with excellent analytical, problem-solving and organisational skillsProven experience in US sales and use tax compliance, technical advisory (including digital services tax) and driving strategies from MVP to high fidelity solutions. Experience with Canadian and LATAM indirect taxes would be a bonus.The ability to work independently to develop and drive projects and compliance to completion as part of a team in a fast-paced environment.Implemented AI into your day-to-day ways of working in your current role and are already thinking about new ways that AI can amplify your impactProficiency in financial softwares and systems; experience with Netsuite and Fonoa would be a valued asset!What's in it for you?At Canva we value fairness, and we strive to provide competitive, market-informed compensation whilst ensuring internal equity within the team in each region. We make hiring decisions based on your skills, experience and our overall assessment of what we observed and learnt in the hiring process. The target salary range for this position is $166,000 - $245,000. When calculating offers, we make salary decisions based on market data and candidates' skills and experience.Achieving our crazy big goals motivates us to work hard - and we do - but you'll experience lots of moments of magic, connectivity and fun woven throughout life at Canva, too. We also offer a stack of benefits to set you up for every success in and outside of work.Here's a taste of what's on offer:Equity packages - we want our success to be yours tooHealth benefits plans to support you and your wellbeing401(k) retirement plan with company contributionInclusive parental leave policy that supports all parents & carersAn annual Vibe & Thrive allowance to support your wellbeing, social connection, office setup & moreFlexible leave options that empower you to be a force for good, take time to recharge and supports you personallyOther stuff to knowWe celebrate all types of skills and backgrounds at Canva so even if you don’t feel like your skills quite match what’s listed above - we still want to hear from you!When you apply, please tell us the pronouns you use and any reasonable adjustments you may need during the interview process. Please note that interviews are conducted virtually.Check out lifeatcanva.com for more info."
Staff Software Engineer - Video Performance - (Bay area only),Information Technology,"San Francisco, CA, United States",San Francisco,CA,2026-04-01,6000000000973222,667cb2e0-31f6-4812-93d6-f976177e8487,REF4433T,fe1e6849-4798-4bc3-9dc3-9dbe4532bd82,canva,2026-06-07,2026-06-24,0.4488,B4,Software Engineering,Information Technology,Technology,Employee,,Full-time,Full-time,Canva,,,United States,Canva,Computer Software,Mid-Senior Level,False,False,https://jobs.smartrecruiters.com/Canva/6000000000973222-staff-software-engineer-video-performance-bay-area-only-,,"Join the team redefining how the world experiences design.Hello, g'day, mabuhay, kia ora, 你好, hallo, vítejte!Thanks for stopping by. We know job hunting can be a little time consuming and you're probably keen to find out what's on offer, so we'll get straight to the point.Where and how you can workOur flagship office is in Sydney, Australia, but we've made our way from down under, to a hub in San Francisco, which is now home to our US operations. We offer flexibility in how and where you work. We trust our Canvanauts to choose the balance that empowers them and their team to achieve their goals.What you’d be doing in this roleAs Canva scales change continues to be part of our DNA. But we like to think that's all part of the fun. So this will give you the flavour of the type of things you'll be working on when you start, but this will likely evolve.Lead end-to-end performance strategy across the video creation lifecycle — from timeline scrubbing and real-time preview through to export and rendering. You’ll identify bottlenecks and drive measurable improvements to the editing experience.Profile and optimize critical paths in our C++ native engine, GLSL/HLSL shaders, and ML-powered effect pipelines to reduce latency and memory footprint.Design and build observability systems including internal profiling tools and automated regression suites that capture key performance metrics (FPS, jank, memory usage, thermal behavior) across Web, iOS, and Android.Define and own performance metrics that directly reflect user-perceived fluidity and creative flow — ensuring performance remains a first-class product feature.Collaborate across teams with Video Engine and AI engineers to evolve system architecture for improved parallelism, cache locality, and asynchronous processing.Leverage hardware acceleration using platform-specific APIs (Metal, Vulkan, WebGPU) to unlock maximum performance across diverse consumer hardware.You're probably a match ifYou treat performance as a product feature. You’ve optimized complex, multi-threaded systems and can reason clearly about trade-offs between latency, memory, and maintainability.You think in systems. You understand how frontend, backend, and native engines interact to create seamless user experiences at scale.Strong proficiency in C++Experience with modern systems languages (e.g., Rust) is a plusStrong understanding of CPU/GPU architectures, memory hierarchies, and SIMDExperience working with graphics APIs such as OpenGL, Metal, or VulkanYou’re fluent in profiling and diagnostics. You’ve used tools such as Perf, Instruments, Chrome DevTools, Systrace, or custom telemetry systems to uncover bottlenecks and guide engineering decisions.You understand multimedia fundamentals. You have experience with video codecs (H.264/5, VP9, AV1), container formats, and frame-accurate seeking and composition.You use data to validate impact. You analyze telemetry at scale to identify regressions and measure improvements.You elevate those around you. You influence peers and partner teams to prioritize performance and long-term quality.
About the teamThe Video Group at Canva is redefining how millions of people tell stories. We’re a global, interdisciplinary team of rendering engineers, AI researchers, and product builders working toward ambitious goals. In San Francisco, you’ll join a high-impact team building the performant foundation that enables our creative ambitions.We value technical excellence, thoughtful collaboration, and building systems that empower creativity for everyone.What's in it for you?Achieving our crazy big goals motivates us to work hard - and we do - but you'll experience lots of moments of magic, connectivity and fun woven throughout life at Canva, too. We also offer a range of benefits to set you up for every success in and outside of work.Here's a taste of what's on offer:Equity packages - we want our success to be yours tooHealth benefits plans to support you and your wellbeing401(k) retirement plan with company contributionInclusive parental leave policy that supports all parents & carersAn annual Vibe & Thrive allowance to support your wellbeing, social connection, office setup & moreFlexible leave options that empower you to be a force for good, take time to recharge and supports you personallyCheck out lifeatcanva.com for more info.At Canva we value fairness, and we strive to provide competitive, market-informed compensation whilst ensuring internal equity within the team in each region. We make hiring decisions based on your skills, experience and our overall assessment of what we observed and learnt in the hiring process. The target salary range for this position is $251,000 to $329,000. When calculating offers, we make salary decisions based on market data and candidates' skills and experience.Other stuff to knowWe make hiring decisions based on your experience, skills, merit and business needs, in compliance with applicable local laws.We celebrate all types of skills and backgrounds at Canva so even if you don’t feel like your skills quite match what’s listed above - we still want to hear from you!When you apply, please tell us the pronouns you use and any reasonable adjustments you may need during the interview process. Please note that interviews are conducted virtually.Check out lifeatcanva.com for more info."
Enterprise Account Executive,AMER Sales,"Los Angeles, CA, United States",Los Angeles,CA,2026-03-30,6000000000966038,be6d0a5c-fb0c-4988-b2b6-6f3730fcfa30,R101479,600c5a6f-6bde-421c-9a70-4f7751bf1f32,canva,2026-06-07,2026-06-24,0.3744,S2,Account Management,Sales,Sales & Success,Employee,,Full-time,Full-time,Canva,Go To Market,Sales & Success,United States,Canva,Computer Software,Not Applicable,True,False,https://jobs.smartrecruiters.com/Canva/6000000000966038-enterprise-account-executive,,"Join the team redefining how the world experiences design.Hello, hey, g'day, mabuhay, kia ora, 你好, hallo, vítejte!Thanks for stopping by. We know job hunting can be a little time consuming and you're probably keen to find out what's on offer, so we'll get straight to the point.Where and how you can workOur flagship office is in Sydney, Australia, but we've made our way from down under, to San Francisco. We offer flexibility in how and where you work. We trust our Canvanauts to choose the balance that empowers them and their team to achieve their goals.About the Team
Our Sales and Success team support Canva Enterprise, with the mission to empower every organisation to design. Canva Enterprise lets organisations consolidate design, content production, and collaboration tools under one secure and centralised account. From whiteboards to docs, to presentations and our AI platform magic Studio, our Sales team work with all departments empowering them to create and collaborate at scale.
About the RoleOur Account Executives work closely with our customers to understand their goals and provide tailored solutions to meet their needs. Whether it's creating eye-catching pitch decks for their sales teams, designing creative marketing materials at scale, or ensuring everyone is on-brand, our team has the expertise to help our customers in all departments succeed.We're teaming up with colleagues across the board - from Product to Marketing - all supporting our sales team. As we branch out into new markets and develop fresh Enterprise solutions, we're crafting something truly unique. Together, we're redesigning work.What you’ll do:Account Planning: You will lead with a data-driven approach to identify and reach out to potential customers who are likely to benefit from Canva's products. Analyze market landscapes, trends, and dynamics to translate high-level plans into targeted sales activities.Managing Pipeline + Revenue Growth: You will manage pipeline, revenue forecasts, sales activity using Salesforce for maximum efficiency and visibilityCustomer Centric: You will leverage compelling storytelling and vision transfer, presented through a creative lens, to guide customers on a journey that feels personalized and right for them.Be a product expert: Exhibit a deep love for Canva’s product and an ability to sell creative solutions that address customers’ unique problems. You will gather customer feedback and convey market needs to inform the Product roadmap and provide insights that strengthen our value proposition and enhance the customer experienceFoster long-term relationships: Recognize the value of building long-term relationships and strive to create lasting partnerships both with customers and internal cross functional teams (Product, Eng, Post-Sales, Customer Success).Bring clarity to chaos: Simplifying complex situations into digestible customer-ready stories and materials using Canva’s worksuite (presentations, doc etc.)What we're looking forYou've got experience working with a range of customers, from medium-sized businesses to large corporations within a technology company, demonstrating a history of top performance.You have proven success managing a full sales cycle, including prospecting with a focus on new logo attainment.You’re a pro at navigating complexity by understanding and addressing complex business challenges, crafting solutions .You've got a talent for creating detailed plans that cover all the bases within intricate organizations.You've got the skills to captivate an audience, especially during face-to-face meetings with multiple key players.You've got a track record of leading successful (and complex) negotiations.You're comfortable navigating uncertainty and can keep up in a fast-paced environment.What's in it for you?At Canva we value fairness, and we strive to provide competitive, market-informed compensation whilst ensuring internal equity within the team in each region. We make hiring decisions based on your skills, experience and our overall assessment of what we observed and learnt in the hiring process. The target salary range for this position is $212,000-$326,000. When calculating offers, we make salary decisions based on market data and candidates' skills and experience.Achieving our crazy big goals motivates us to work hard - and we do - but you'll experience lots of moments of magic, connectivity and fun woven throughout life at Canva, too. We also offer a range of benefits to set you up for every success in and outside of work.Here's a taste of what's on offer:Equity packages - we want our success to be yours tooHealth benefits plans to support you and your wellbeing401(k) retirement plan with company contributionInclusive parental leave policy that supports all parents & carersAn annual Vibe & Thrive allowance to support your wellbeing, social connection, office setup & moreFlexible leave options that empower you to be a force for good, take time to recharge and supports you personallyCheck out lifeatcanva.com for more info.Other stuff to knowWe make hiring decisions based on your experience, skills, merit and business needs, in compliance with applicable local laws.We celebrate all types of skills and backgrounds at Canva so even if you don’t feel like your skills quite match what’s listed above - we still want to hear from you!When you apply, please tell us the pronouns you use and any reasonable adjustments you may need during the interview process. Please note that interviews are conducted virtually."
