title,team,location,city,state,posted_date,job_id,internal_job_id,requisition_id,position_id,source,first_seen_date,last_seen_date,semantic_similarity,management_level,job_profile,job_category,job_family,worker_type,worker_sub_type,schedule_type,time_type,company_name,cost_center,office,country,brand,industry,experience_level,remote,hybrid,url,description_short,description
Principal Partner Engineer — Ecosystem,Ecosystem Go To Market,"San Francisco, , United States",San Francisco,,2026-05-26,6000000001106693,112438b7-9a56-485c-89d5-84d45cd06c99,R102135,bc0a2742-e565-49de-8cbe-99c51e7fa284,canva,2026-06-07,2026-06-24,0.4645,B5,Software Engineering,Information Technology,Technology,Employee,,Full-time,Full-time,Canva,Product,Ecosystem,United States,Canva,Computer Software,Executive,True,False,https://jobs.smartrecruiters.com/Canva/6000000001106693-principal-partner-engineer-ecosystem,,"Join the team redefining how the world experiences design.Hey, g'day, mabuhay, kia ora, 你好, hallo, vítejte!Thanks for stopping by. We know job hunting can be a little time-consuming, and you're probably keen to find out what's on offer, so we'll get straight to the point.Where and how you can workOur flagship campus is in Sydney. We also have a campus across the world and co-working spaces in numerous locations in the USA. But you have a choice in where and how you work, we trust our Canvanauts to choose the balance that empowers them and their team to achieve their goals. You'll work on Pacific Time hours and collaborate daily with Canva's engineering teams in AEST.What you’d be doing in this roleCanva's Ecosystem platform sits at the centre of how the world's agentic AI systems connect to visual design. Anthropic, OpenAI, Google, Microsoft, Meta, and the next wave of AI-native platforms are all building on, against, and through our MCP server, REST APIs, and Apps platform. The shape of those integrations is being decided right now, at the engineering layer, in real conversations with real technical counterparts.Drive decisions and alignment across Partners and Canva engineering. When a partner proposes a solution that won't work, you'll explain why, generate the realistic option set, and drive it to a decision with the owning Canva teams. You'll hold the technical detail on both sides and translate without losing precision.Set technical direction for Canva's external platform surface. The strategic question of where to invest, deprecate, and evolve doesn't sit inside any single team. You'll contribute to that direction, grounded in partner signal and engineering reality.Ground partner conversations in working code. At this level, partner conversations need to be grounded in what's actually runnable. You validate proposed solutions against Canva's real architecture to drive decisions that span multiple teams and partners, using working code as the proof point.. When it helps unblock a decision, you'll sketch what a change could look like in code, giving the owning Canva team a concrete starting point while leaving the change itself to them. The outcome is a partner decision backed by a runnable artifact.Drive product-line engineering across our external platform surfaces. Canva's agentic AI story is delivered across MCP, REST APIs, Apps-in-Canva, and the middleware PaaS. You'll work across all of them, making sure the overall surface stays coherent as new capabilities land. This is the product-line engineering layer that today falls between teams.Carry the platform direction outward early. Canva pivots on a dime. You'll sit inside Ecosystem engineering leadership, hear direction as it forms, and carry it to partners before they're reacting to it. This is the single highest-leverage thing the role does for GTM.Shape strategic partner and customer engagements. For a small number of flagship engagements (major AI platforms, and at a stretch, strategically significant enterprise customers), you'll lead the technical relationship end-to-end: shaping the roadmap, driving the spikes, carrying the decisions back through Canva.You'll hold product shape, engineering feasibility, and partner intent in the same conversation. In a single afternoon, you might move between a product-roadmap discussion, an API design review, and a partnership alignment call, and bring each of them closer to resolution.You're probably a match ifYou have 10+ years of software engineering experience, with several of those in roles operating at the seam between partner engineering, platform engineering, and product.You've built developer platforms, not just evangelised them. You've shipped code in production on platforms used by external developers.You move fluidly between a product roadmap conversation, a system design discussion, and a partner negotiation, and you bring each one forward.You bring a prototype or sample code to a hard conversation. You don't oversell what's doable, and you don't overbuild what isn't needed.You're technically deep on the modern AI platform stack. You have real opinions on MCP, tool-use, agentic API design, and the tradeoffs between them.You communicate directly. You resolve misalignments by writing clearly.You've worked inside product stacks that are heterogeneous and move fast. You know how to orient yourself quickly in a codebase you didn't write.You raise the technical bar across Ecosystem engineering by sharing knowledge, feedback and bringing others into partner facing wins.It would be great if you also hadHands-on experience shipping or integrating with MCP (Anthropic, OpenAI, Copilot, or Gemini flavours).Strong TypeScript, comfortable across front-end (React) and server-side JavaScript, and the ability to read a Java backend even if you don't want to write one.A track record of turning ambiguous partner signal into crisp engineering decisions that Product and Engineering acted on.Why this role mattersThe agentic AI ecosystem is being wired together right now, at the platform layer, by a small number of people at a small number of companies. This role is one of the seats at that table on Canva's side. What you help decide in the next twelve months will shape how the world's most-used visual design platform shows up in the world's most-used AI systems for years. If you've been looking for an IC role with real leverage on what gets built, this is it.About the teamThis role sits in the Ecosystem supergroup. Ecosystem owns Canva's external platform surface: MCP, REST APIs, Apps-in-Canva, and the middleware PaaS. Ecosystem is ~150 engineers (and ~200 people overall) across developer experience, apps, and platform APIs, plus a Solutions group that covers toolkits solutions engineering and Systems Integrators. This role works closely with the Ecosystem leadership team, and partners directly with our Head of Partnerships on flagship partner engagements.What's in it for you?Achieving our crazy big goals motivates us to work hard - and we do - but you'll experience lots of moments of magic, connectivity and fun woven throughout life at Canva, too. We also offer a range of benefits to set you up for every success in and outside of work.Here's a taste of what's on offer:Equity packages - we want our success to be yours tooInclusive parental leave policy that supports all parents & carersAn annual Vibe & Thrive allowance to support your wellbeing, social connection, office setup & moreFlexible leave options that empower you to be a force for good, take time to recharge and supports you personallyCheck out lifeatcanva.com for more info.Other stuff to knowWe make hiring decisions based on your experience, skills and passion, as well as how you can enhance Canva and our culture. When you apply, please tell us the pronouns you use and any reasonable adjustments you may need during the interview process.We celebrate all types of skills and backgrounds at Canva so even if you don’t feel like your skills quite match what’s listed above - we still want to hear from you!Please note that interviews are conducted virtually."
Principal Partner Engineer — Ecosystem,Ecosystem Go To Market,"Texas, KY, United States",Texas,KY,2026-05-26,6000000001106698,112438b7-9a56-485c-89d5-84d45cd06c99,R102135,dc12bc4a-706e-4af7-add5-9006baf4331a,canva,2026-06-07,2026-06-24,0.4888,B5,Software Engineering,Information Technology,Technology,Employee,,Full-time,Full-time,Canva,Product,Ecosystem,United States,Canva,Computer Software,Executive,True,False,https://jobs.smartrecruiters.com/Canva/6000000001106698-principal-partner-engineer-ecosystem,,"Join the team redefining how the world experiences design.Hey, g'day, mabuhay, kia ora, 你好, hallo, vítejte!Thanks for stopping by. We know job hunting can be a little time-consuming, and you're probably keen to find out what's on offer, so we'll get straight to the point.Where and how you can workOur flagship campus is in Sydney. We also have a campus across the world and co-working spaces in numerous locations in the USA. But you have a choice in where and how you work, we trust our Canvanauts to choose the balance that empowers them and their team to achieve their goals. You'll work on Pacific Time hours and collaborate daily with Canva's engineering teams in AEST.What you’d be doing in this roleCanva's Ecosystem platform sits at the centre of how the world's agentic AI systems connect to visual design. Anthropic, OpenAI, Google, Microsoft, Meta, and the next wave of AI-native platforms are all building on, against, and through our MCP server, REST APIs, and Apps platform. The shape of those integrations is being decided right now, at the engineering layer, in real conversations with real technical counterparts.Drive decisions and alignment across Partners and Canva engineering. When a partner proposes a solution that won't work, you'll explain why, generate the realistic option set, and drive it to a decision with the owning Canva teams. You'll hold the technical detail on both sides and translate without losing precision.Set technical direction for Canva's external platform surface. The strategic question of where to invest, deprecate, and evolve doesn't sit inside any single team. You'll contribute to that direction, grounded in partner signal and engineering reality.Ground partner conversations in working code. At this level, partner conversations need to be grounded in what's actually runnable. You validate proposed solutions against Canva's real architecture to drive decisions that span multiple teams and partners, using working code as the proof point.. When it helps unblock a decision, you'll sketch what a change could look like in code, giving the owning Canva team a concrete starting point while leaving the change itself to them. The outcome is a partner decision backed by a runnable artifact.Drive product-line engineering across our external platform surfaces. Canva's agentic AI story is delivered across MCP, REST APIs, Apps-in-Canva, and the middleware PaaS. You'll work across all of them, making sure the overall surface stays coherent as new capabilities land. This is the product-line engineering layer that today falls between teams.Carry the platform direction outward early. Canva pivots on a dime. You'll sit inside Ecosystem engineering leadership, hear direction as it forms, and carry it to partners before they're reacting to it. This is the single highest-leverage thing the role does for GTM.Shape strategic partner and customer engagements. For a small number of flagship engagements (major AI platforms, and at a stretch, strategically significant enterprise customers), you'll lead the technical relationship end-to-end: shaping the roadmap, driving the spikes, carrying the decisions back through Canva.You'll hold product shape, engineering feasibility, and partner intent in the same conversation. In a single afternoon, you might move between a product-roadmap discussion, an API design review, and a partnership alignment call, and bring each of them closer to resolution.You're probably a match ifYou have 10+ years of software engineering experience, with several of those in roles operating at the seam between partner engineering, platform engineering, and product.You've built developer platforms, not just evangelised them. You've shipped code in production on platforms used by external developers.You move fluidly between a product roadmap conversation, a system design discussion, and a partner negotiation, and you bring each one forward.You bring a prototype or sample code to a hard conversation. You don't oversell what's doable, and you don't overbuild what isn't needed.You're technically deep on the modern AI platform stack. You have real opinions on MCP, tool-use, agentic API design, and the tradeoffs between them.You communicate directly. You resolve misalignments by writing clearly.You've worked inside product stacks that are heterogeneous and move fast. You know how to orient yourself quickly in a codebase you didn't write.You raise the technical bar across Ecosystem engineering by sharing knowledge, feedback and bringing others into partner facing wins.It would be great if you also hadHands-on experience shipping or integrating with MCP (Anthropic, OpenAI, Copilot, or Gemini flavours).Strong TypeScript, comfortable across front-end (React) and server-side JavaScript, and the ability to read a Java backend even if you don't want to write one.A track record of turning ambiguous partner signal into crisp engineering decisions that Product and Engineering acted on.Why this role mattersThe agentic AI ecosystem is being wired together right now, at the platform layer, by a small number of people at a small number of companies. This role is one of the seats at that table on Canva's side. What you help decide in the next twelve months will shape how the world's most-used visual design platform shows up in the world's most-used AI systems for years. If you've been looking for an IC role with real leverage on what gets built, this is it.About the teamThis role sits in the Ecosystem supergroup. Ecosystem owns Canva's external platform surface: MCP, REST APIs, Apps-in-Canva, and the middleware PaaS. Ecosystem is ~150 engineers (and ~200 people overall) across developer experience, apps, and platform APIs, plus a Solutions group that covers toolkits solutions engineering and Systems Integrators. This role works closely with the Ecosystem leadership team, and partners directly with our Head of Partnerships on flagship partner engagements.What's in it for you?Achieving our crazy big goals motivates us to work hard - and we do - but you'll experience lots of moments of magic, connectivity and fun woven throughout life at Canva, too. We also offer a range of benefits to set you up for every success in and outside of work.Here's a taste of what's on offer:Equity packages - we want our success to be yours tooInclusive parental leave policy that supports all parents & carersAn annual Vibe & Thrive allowance to support your wellbeing, social connection, office setup & moreFlexible leave options that empower you to be a force for good, take time to recharge and supports you personallyCheck out lifeatcanva.com for more info.Other stuff to knowWe make hiring decisions based on your experience, skills and passion, as well as how you can enhance Canva and our culture. When you apply, please tell us the pronouns you use and any reasonable adjustments you may need during the interview process.We celebrate all types of skills and backgrounds at Canva so even if you don’t feel like your skills quite match what’s listed above - we still want to hear from you!Please note that interviews are conducted virtually."
Enterprise Customer Success Manager,Customer Success,"Austin, , United States",Austin,,2026-05-22,6000000001099097,5842b86a-d7d4-453b-a4a7-d06793c48bdd,R102290,0094a111-e769-4c29-b7e6-ed243012ffdc,canva,2026-06-07,2026-06-24,0.448,S3,Customer Success Management,Sales,Sales & Success,Employee,,Full-time,Full-time,Canva,Go To Market,Sales & Success,United States,Canva,Computer Software,Not Applicable,False,True,https://jobs.smartrecruiters.com/Canva/6000000001099097-enterprise-customer-success-manager,,"Join the team redefining how the world experiences design.Hello, g'day, mabuhay, kia ora, 你好, hallo, vítejte!Thanks for stopping by. We know job hunting can be a little time consuming and you're probably keen to find out what's on offer, so we'll get straight to the point.
Where and how you can workOur flagship office is in Sydney, Australia, but we've made our way from down under, to a campus in Austin, Texas which is now home to our US operations. This is a hybrid role in Austin, Texas, so you must be able to commute to our office 1-2 times a week. 
About the TeamAt Canva, we've developed our own sales methodology leveraging our product and creativity to drive value in organizations that are already engaged with our product. The core focus of our team is to prove the power of Canva within recognizable global brands and Enterprise customers. We help our customers realize more value with Canva by educating, enabling and empowering them to be their most creative self. In short, we want to bring as much value to our partnership with our customers as possible.Our rapid growth (100+ million monthly active users and growing) means we don’t have all the answers - and we’re hoping you’ll think that’s all part of the fun of it. Our business is growing quickly so every interaction is a chance for you to learn valuable insights about our markets. Of course with growth comes some ambiguity, but if you’re curious and open to change then you’ll thrive in Sales and Success. 
About the RoleThe mission of the Enterprise Customer Success Manager is to nurture and grow the relationships with our enteprise Canva Enterprise accounts.  You will help Canva develop the company’s Enterprise sales and success approach and implement best practices for building a world-class sales organization.
What you'll do 
As Canva scales, change continues to be part of our DNA. But we like to think that's all part of the fun. So this will give you the flavour of the type of things you'll be working on when you start, but this will likely evolve.At the moment, this role is focused on:Customer success and enthusiasm: extend Canva’s tradition of high customer satisfaction across teams by leading the post-sale relationship of Canva’s strategic accounts within the customer journey, including onboarding, training, adoption, and advocacy.Account growth: work to understand your customer’s objectives through relationship building and multithreading, identifying areas for growth within existing accounts through forecasting, and partnering closely with your account team to renew and expand.Best-in-class processes, practices, and efficiency: create, educate, experiment, and collaborate with senior leadership and our growing customer base while building team practices and playbooks for operating as a top SaaS business and solutions providerIdentify opportunities: you will work closely with cross-functional teams to identify product improvements, and you will be responsible for ensuring that our clients are up-to-date on the latest features and offerings.
What we're looking forSuccess: You have a proven track record exceeding quota and 3+ years of enterprise-level post sales experience in B2B SaaSCommercially minded: You think strategically and outside the box to not only renew your customers, but look for growth opportunitiesLeverage data: You will be able to tell a story through data and analytics to support your conversations and influence decision-making.Communication skills: You communicate passionately, collaborate, and rally othersAgility & Creativity: You are willing to learn and adapt, as well as dream bigIntegrity and trustworthiness: You develop rapport and credibility internally and externally.Grit: You are biased towards action and resourcefulHumility: You are willing to question your assumptions with the desire to constantly improve
What's in it for you?
Achieving our crazy big goals motivates us to work hard - and we do - but you'll also experience lots of moments of magic, connectivity, and fun woven throughout life at Canva. We also offer a range of benefits designed to set you up for success, both in and outside of work.Here's a taste of what's on offer:Equity packages — we want our success to be yours tooHealth benefits plans to support you and your wellbeing401(k) retirement plan with company contributionInclusive parental leave policy that supports all parents and carersAn annual Vibe & Thrive allowance to support your wellbeing, social connection, office setup, and moreFlexible leave options that empower you to be a force for good, take time to recharge, and support you personallyOther stuff to knowWe make hiring decisions based on your experience, skills, merit and business needs, in compliance with applicable local laws.We celebrate all types of skills and backgrounds at Canva so even if you don’t feel like your skills quite match what’s listed above - we still want to hear from you!When you apply, please tell us the pronouns you use and any reasonable adjustments you may need during the interview process. Please note that interviews are conducted virtually.Check out lifeatcanva.com for more info."
