title,team,location,city,state,posted_date,job_id,internal_job_id,requisition_id,position_id,source,first_seen_date,last_seen_date,semantic_similarity,management_level,job_profile,job_category,job_family,worker_type,worker_sub_type,schedule_type,time_type,company_name,cost_center,office,country,brand,industry,experience_level,remote,hybrid,url,description_short,description
Social Content Videographer ( 12 month Fixed Term Contract) ,Marketing Creative,"Los Angeles, , United States",Los Angeles,,2026-06-11,6000000001146084,d8ca2847-72bd-43f7-8818-1ce787d7400a,R102401,aa28bd3c-5faa-4c21-aede-8bc9dec89176,canva,2026-06-11,2026-06-14,0.3867,B3,Video & Photo,Design,Design,Employee,,Full-time,Full-time,Canva,Marketing,Marketing,United States,Canva,Computer Software,Mid-Senior Level,True,False,https://jobs.smartrecruiters.com/Canva/6000000001146084-social-content-videographer-12-month-fixed-term-contract-,,"Join the team redefining how the world experiences design. Hello, g'day, mabuhay, kia ora, 你好, hallo, vítejte!Thanks for stopping by. We know job descriptions can feel a bit formulaic sometimes, but we promise Canva  is anything but. If you're drawn to what we're building and you see yourself in this role, we'd love to hear from you.

Where and how you can workThis role is a 12 month Fixed Term Contract -  working full-time hours per week.Our flagship office is in Sydney, Australia, but we've made our way from down under, to a hub San Francisco, which is now home to our US operations. This is a fully remote role based in the US - Los Angeles is strongly preferred so you can overlap with our Sydney-based team during key creative touch points. You'll be set up to produce content independently from home, and Canva provides all the gear you need to do your best work.We offer flexibility in how and where you work, we trust our Canvanauts to choose the balance that empowers them and their team to achieve their goals.What you’d be doing in this roleAs Canva scales change continues to be part of our DNA. But we like to think that's all part of the fun. So this will give you the flavour of the type of things you'll be working on when you start, but this will likely evolve.This isn't a traditional videographer role. Think less ""receives a brief, shoots, delivers back"" and more creative collaborator who also happens to be great with a camera (or a phone). You'll be embedded in Canva's organic social team - the people behind @Canva on Instagram, TikTok, Facebook, and LinkedIn - helping to build Canva's presence in the US at the speed of culture.At the moment, this role is focused on:Shooting and editing social-first content, primarily on iPhone - fast, reactive, and built for TikTok and InstagramConcepting original ideas and bringing them to the table, not just executing briefsMonitoring US trends, pop culture, and breaking moments in real time, and turning them into content same-day when neededCollaborating closely with the Social Lead to develop entertainment-led series and culturally resonant brand acts that build audience engagement at scaleDelivering a mix of lo-fi reactive content and more polished, cinematic edits - knowing when each is rightJumping into light graphic or meme formats if that's in your wheelhouseYou're probably a match if:You're a social-first creator, equally comfortable shooting on an iPhone as you are behind a camera, and you know which one to reach forYou live on TikTok and Instagram - you understand hooks, trends, and what makes people stop scrolling, and you bring that instinct to every briefYou concept, not just execute, you bring ideas to the table proactively and can take one from spark to post independentlyYou've worked at speed: Reactive, same-day production is something you're used to, not something that stresses you outYou're fluent in Adobe Premiere Pro; CapCut or DaVinci Resolve works tooYou have some experience in a corporate or agency environment and handle structure and process well
About the teamCanva's Social team is obsessed with one thing: making content people actually want to watch, share, and talk about. We're in an entertainment-led era - backing bold ideas, moving fast, and never being precious about how things have always been done. Our goal is to become the #1 brand on social, and we're building the creative engine to get there.Other stuff to knowWe make hiring decisions based on your experience, skills, merit and business needs, in compliance with applicable local laws.We celebrate all types of skills and backgrounds at Canva so even if you don’t feel like your skills quite match what’s listed above - we still want to hear from you!When you apply, please tell us the pronouns you use and any reasonable adjustments you may need during the interview process. Please note that interviews are conducted virtually.Check out lifeatcanva.com for more info.At Canva we value fairness, and we strive to provide competitive, market-informed compensation whilst ensuring internal equity within the team in each region. We make hiring decisions based on your skills, experience and our overall assessment of what we observed and learnt in the hiring process. When calculating offers, we make salary decisions based on market data and candidates' skills and experience."
Social Content Videographer,Marketing Creative,"Los Angeles, CA, United States",Los Angeles,CA,2026-06-10,6000000001143662,d8ca2847-72bd-43f7-8818-1ce787d7400a,R102401,acf15247-4ed4-4e98-b558-9b2bad162f5d,canva,2026-06-09,2026-06-10,0.4026,B3,Video & Photo,Design,Design,Employee,,Full-time,Full-time,Canva,Marketing,Marketing,United States,Canva,Computer Software,Mid-Senior Level,True,False,https://jobs.smartrecruiters.com/Canva/6000000001143662-social-content-videographer,,"Join the team redefining how the world experiences design. Hello, g'day, mabuhay, kia ora, 你好, hallo, vítejte!Thanks for stopping by. We know job descriptions can feel a bit formulaic sometimes, but we promise Canva  is anything but. If you're drawn to what we're building and you see yourself in this role, we'd love to hear from you.

Where and how you can workOur flagship office is in Sydney, Australia, but we've made our way from down under, to a hub San Francisco, which is now home to our US operations. This is a fully remote role based in the US - Los Angeles is strongly preferred so you can overlap with our Sydney-based team during key creative touch points. You'll be set up to produce content independently from home, and Canva provides all the gear you need to do your best work.We offer flexibility in how and where you work, we trust our Canvanauts to choose the balance that empowers them and their team to achieve their goals.What you’d be doing in this roleAs Canva scales change continues to be part of our DNA. But we like to think that's all part of the fun. So this will give you the flavour of the type of things you'll be working on when you start, but this will likely evolve.This isn't a traditional videographer role. Think less ""receives a brief, shoots, delivers back"" and more creative collaborator who also happens to be great with a camera (or a phone). You'll be embedded in Canva's organic social team - the people behind @Canva on Instagram, TikTok, Facebook, and LinkedIn - helping to build Canva's presence in the US at the speed of culture.At the moment, this role is focused on:Shooting and editing social-first content, primarily on iPhone - fast, reactive, and built for TikTok and InstagramConcepting original ideas and bringing them to the table, not just executing briefsMonitoring US trends, pop culture, and breaking moments in real time, and turning them into content same-day when neededCollaborating closely with the Social Lead to develop entertainment-led series and culturally resonant brand acts that build audience engagement at scaleDelivering a mix of lo-fi reactive content and more polished, cinematic edits - knowing when each is rightJumping into light graphic or meme formats if that's in your wheelhouseYou're probably a match if:You're a social-first creator, equally comfortable shooting on an iPhone as you are behind a camera, and you know which one to reach forYou live on TikTok and Instagram - you understand hooks, trends, and what makes people stop scrolling, and you bring that instinct to every briefYou concept, not just execute, you bring ideas to the table proactively and can take one from spark to post independentlyYou've worked at speed: Reactive, same-day production is something you're used to, not something that stresses you outYou're fluent in Adobe Premiere Pro; CapCut or DaVinci Resolve works tooYou have some experience in a corporate or agency environment and handle structure and process well
About the teamCanva's Social team is obsessed with one thing: making content people actually want to watch, share, and talk about. We're in an entertainment-led era - backing bold ideas, moving fast, and never being precious about how things have always been done. Our goal is to become the #1 brand on social, and we're building the creative engine to get there.Other stuff to knowWe make hiring decisions based on your experience, skills, merit and business needs, in compliance with applicable local laws.We celebrate all types of skills and backgrounds at Canva so even if you don’t feel like your skills quite match what’s listed above - we still want to hear from you!When you apply, please tell us the pronouns you use and any reasonable adjustments you may need during the interview process. Please note that interviews are conducted virtually.Check out lifeatcanva.com for more info.At Canva we value fairness, and we strive to provide competitive, market-informed compensation whilst ensuring internal equity within the team in each region. We make hiring decisions based on your skills, experience and our overall assessment of what we observed and learnt in the hiring process. When calculating offers, we make salary decisions based on market data and candidates' skills and experience."
Strategic Account Executive,AMER Sales,"New York, NY, United States",New York,NY,2026-06-09,6000000001140968,0c11d03e-7e9f-466d-9665-28af746e8ffe,R102466,98a62e9c-a515-49e1-8878-535992f3ba9e,canva,2026-06-09,2026-06-24,0.3762,S4,Account Management,Sales,Sales & Success,Employee,,Full-time,Full-time,Canva,Go To Market,Sales & Success,United States,Canva,Computer Software,Not Applicable,True,False,https://jobs.smartrecruiters.com/Canva/6000000001140968-strategic-account-executive,,"Join the team redefining how the world experiences design.Hello, g'day, mabuhay, kia ora, 你好, hallo, vítejte!Thanks for stopping by. We know job hunting can be a little time consuming and you're probably keen to find out what's on offer, so we'll get straight to the point.Where and how you can workOur flagship office is in Sydney, Australia, but we've made our way from down under, to a campus in Austin, Texas which is now home to our US operations. This role is fully remote based in New York City.About the TeamOur Sales and Success team support Canva Enterprise, with the mission to empower every organization to design. Canva Enterprise lets organizations consolidate design, content production, and collaboration tools under one secure and centralized account. From whiteboards to docs, to presentations and our AI platform magic Studio, our Sales team work with all departments empowering them to create and collaborate at scale.About the RoleOur team consists of experienced Account Executives who have a passion for building relationships with customers who love our product.Our Account Executives work closely with our customers to understand their goals and provide tailored solutions to meet their needs. Whether it's creating eye-catching pitch decks for their sales teams, designing creative marketing materials at scale, or ensuring everyone is on-brand, our team has the expertise to help our customers in all departments succeed.We're teaming up with colleagues across the board - from Product to Marketing - all supporting our sales team. As we branch out into new markets and develop fresh Enterprise solutions, we're crafting something truly unique. Together, we're redesigning work.What you’ll doAccount Planning: You will lead with a data-driven approach to identify and reach out to potential customers who are likely to benefit from Canva's products. Analyze market landscapes, trends, and dynamics to translate high-level plans into targeted sales activities.Managing Pipeline + Revenue Growth: You will manage pipeline, revenue forecasts, sales activity using Salesforce for maximum efficiency and visibilityCustomer Centric: You will leverage compelling storytelling and vision transfer, presented through a creative lens, to guide customers on a journey that feels personalized and right for them.Be a product expert: Exhibit a deep love for Canva’s product and an ability to sell creative solutions that address customers’ unique problems. You will gather customer feedback and convey market needs to inform the Product roadmap and provide insights that strengthen our value proposition and enhance the customer experienceFoster long-term relationships: Recognize the value of building long-term relationships and strive to create lasting partnerships both with customers and internal cross functional teams (Product, Eng, Post-Sales, Customer Success).Bring chaos to clarity: Simplifying complex situations into digestible customer-ready stories and materials using Canva’s worksuite (presentations, doc etc.)What we're looking for8+ years of full cycle selling experience working with a range of customers, from medium-sized businesses to large corporations. For our Strategic role, we are looking for people with experience with large named accounts ideally on a global scale within a technology company, demonstrating a history of top performance.You have proven success managing a full sales cycle, including prospecting with a focus on new logo attainment.You’re a pro at navigating complexity by understanding and addressing complex business challenges, crafting solutions.You've got a talent for creating detailed plans that cover all the bases within intricate organizations.You've got the skills to captivate an audience, especially during face-to-face meetings with multiple key players.You've got a track record of leading successful (and complex) negotiations.You're comfortable navigating uncertainty and can keep up in a fast-paced environment.What's in it for you?Achieving our crazy big goals motivates us to work hard - and we do - but you'll experience lots of moments of magic, connectivity and fun woven throughout life at Canva, too. We also offer a range of benefits to set you up for every success in and outside of work.Here's a taste of what's on offer:Equity packages - we want our success to be yours tooHealth benefits plans to support you and your wellbeing401(k) retirement plan with company contributionInclusive parental leave policy that supports all parents & carersAn annual Vibe & Thrive allowance to support your wellbeing, social connection, office setup & moreFlexible leave options that empower you to be a force for good, take time to recharge and supports you personallyOther stuff to knowWe make hiring decisions based on your experience, skills, merit and business needs, in compliance with applicable local laws.We celebrate all types of skills and backgrounds at Canva so even if you don’t feel like your skills quite match what’s listed above - we still want to hear from you!When you apply, please tell us the pronouns you use and any reasonable adjustments you may need during the interview process. Please note that interviews are conducted virtually.Check out lifeatcanva.com for more info.
 At Canva we value fairness, and we strive to provide competitive, market-informed compensation whilst ensuring internal equity within the team in each region. We make hiring decisions based on your skills, experience and our overall assessment of what we observed and learnt in the hiring process. The target salary range for this position is $315,000 to $411,000. When calculating offers, we make salary decisions based on market data and candidates' skills and experience."
GTM Operations Business Partner,Operations Partnering,"Austin, TX, United States",Austin,TX,2026-06-09,6000000001140749,cb86258b-807a-4d47-ac0b-209189aa8f75,R102497,e0c35f15-c032-4dd2-a335-53c4c47b5b81,canva,2026-06-09,2026-06-17,0.4136,B3,Operations Business Partner,Human Resources,People,Employee,,Full-time,Full-time,Canva,People,People,United States,Canva,Computer Software,Mid-Senior Level,False,True,https://jobs.smartrecruiters.com/Canva/6000000001140749-gtm-operations-business-partner,,"Join the team redefining how the world experiences design.Hello, hey, g'day, mabuhay, kia ora, 你好, hallo, vítejte!Thanks for stopping by. We know job hunting can be a little time consuming and you're probably keen to find out what's on offer, so we'll get straight to the point.Where and how you can workOur flagship office is in Sydney, Australia, but we've made our way from down under, to a campus in Austin, Texas which is now home to our US operations. You have choice in where and how you work, we trust our Canvanauts to choose the balance that empowers them and their team to achieve their goals.What you’d be doing in this roleAs Canva scales change continues to be part of our DNA. But we like to think that's all part of the fun. So this will give you the flavor of the type of things you'll be working on when you start, but this will likely evolve.At the moment, this role is focused on:Owning the GTM Operating CadenceDesign and run the operating rhythm for the whole GTM org & Sales & Success Supergroup, from leadership forums through to all-hands, activations and QBRs.Partner with the Chief of Staff and Group Leadership so every meeting, ritual and forum has a clear purpose, the right audience, and a sharper outcome than the one before.Hold the org accountable to its cadence. Notice when a ritual has lost its edge and reset it.Owning GTM-Wide CommunicationsBe the comms drumbeat for GTM - from maintaining and keeping our Slack clean, through to dynamic newsletters & face to face touch pointsTranslate complex updates from senior leaders into clear, useful messages that land for everyone from a regional sales rep to a systems adminBuild the comms muscle of the org and define what great looks likeDriving End-to-End Program DeliveryWork hand in glove with the GTM Strategy & Operations team and set clear work streams with owners, milestones and momentum - experience in GTM programs is essentialKeep a large cross-functional team of operators on track to deliver on their work streams- from AI iniatives through to enablement masterclassesWork closely with the Chief of Staff & CCO on company-wide programs, including supporting with goal tracking, comms updates, and wrangling multiple supergroupsPartnering on Org-Wide EventsPartner with the Chief of Staff to design and run GTM’s flagship moments, including GKO and other org-wide events that shape how the team feels and performsIn conjunction with the Chief of Staff, drive the operational backbone of these events end-to-end, from concept through to logistics, content and the follow throughYou're probably a match ifYou’re a natural operator. You’ve set the operating cadence for an org before. You’ve owned org-wide communications. You’ve run big moments and made them feel effortlessYou have 5+ years of deep program and project management experience, ideally inside a fast-growing tech or scale-up environment, and you've delivered complex cross-functional programs end-to-endYou have a strong GTM instinct. You can sit with a regional sales lead and talk pipeline, sit with a Success leader and talk renewals, then turn around and document a brief to share with group leadershipYou bring top-tier communication skills across written, verbal, async and liveYou’re a relationship-building powerhouse, building trust quickly with senior leaders, peers and ICs.You bring clarity to ambiguity, making sense of shifting priorities and driving alignment when things are still formingYou spot gaps and fix them. You run experiments. You improve the system as you goYou bring great energy and a great vibe. You uplift the people around you and contribute to a positive, collaborative culture.You’re excited about leveraging AI to automate, optimize and elevate operational impact
About the teamWe’re on a mission to bring Canva into every organization across the globe. The GTM org is customer-obsessed, with our sole focus being to ensure that our customers are getting value out of Canva, and that Canva creates net-positive impact to the organizations we work with.The Operations Partnering team is a global team of 80, made up of Chiefs of Staff, Operations Business Partners, and Admin Business Partners — predominantly based in Sydney, but your coach will be based in San Francisco. Their mission: to build and optimize ways of working that empower Canvanauts around the world to achieve Canva's mission, strategy, and goals as effectively as possible.The team sits within the People (HR) specialty, but Ops BPs are deeply embedded in the business area they support day-to-day. As an Ops BP, you'll be joining a team of 25+ Operations Business Partners across the globe. It's a tight-knit group with a strong learning culture and real community.What's in it for you?Achieving our crazy big goals motivates us to work hard - and we do - but you'll experience lots of moments of magic, connectivity and fun woven throughout life at Canva, too. We also offer a range of benefits to set you up for every success in and outside of work.Here's a taste of what's on offer:Equity packages - we want our success to be yours tooHealth benefits plans to support you and your wellbeing401(k) retirement plan with company contributionInclusive parental leave policy that supports all parents & carersAn annual Vibe & Thrive allowance to support your wellbeing, social connection, office setup & moreFlexible leave options that empower you to be a force for good, take time to recharge and supports you personallyCheck out lifeatcanva.com for more info.Other stuff to knowWe make hiring decisions based on your experience, skills, merit and business needs, in compliance with applicable local laws.We celebrate all types of skills and backgrounds at Canva so even if you don’t feel like your skills quite match what’s listed above - we still want to hear from you!When you apply, please tell us the pronouns you use and any reasonable adjustments you may need during the interview process. Please note that interviews are conducted virtually.Check out lifeatcanva.com for more info."
