title,team,location,posted_date,job_id,source,first_seen_date,last_seen_date,semantic_similarity,country,url,description,department,commitment,workplace_type,description_body,additional,lists
Engineering Manager – Messaging Platform & Tooling,Subscriptions R&D,"New York, NY",2026-04-09,aaa18791-cdb6-493a-87c8-ef233f848a99,spotify,2026-06-05,2026-07-17,0.3053,US,https://jobs.lever.co/spotify/aaa18791-cdb6-493a-87c8-ef233f848a99,"The Subscriptions Mission builds and evolves Spotify’s subscription products to drive sustainable growth by improving conversion, retention, and overall user value. We create seamless, personalized experiences that make it easy for users to discover, upgrade, and stay engaged with Spotify.
Messaging Platform & Tooling is the system that decides what Spotify says to its 700M+ users — and how, when, and where it says it. Nearly every push notification, email, and in-app message flows through this platform, making it one of the highest-leverage systems at Spotify.
Within this space, the Selection squad sits at the core — acting as the decision engine that determines what message reaches each user in real time. You’ll join a high-performing, collaborative team of senior engineers and play a key role in shaping the next generation of this platform as we invest heavily in its future.",Engineering,Permanent,hybrid,"The Subscriptions Mission builds and evolves Spotify’s subscription products to drive sustainable growth by improving conversion, retention, and overall user value. We create seamless, personalized experiences that make it easy for users to discover, upgrade, and stay engaged with Spotify.
Messaging Platform & Tooling is the system that decides what Spotify says to its 700M+ users — and how, when, and where it says it. Nearly every push notification, email, and in-app message flows through this platform, making it one of the highest-leverage systems at Spotify.
Within this space, the Selection squad sits at the core — acting as the decision engine that determines what message reaches each user in real time. You’ll join a high-performing, collaborative team of senior engineers and play a key role in shaping the next generation of this platform as we invest heavily in its future.","The United States base range for this position is $164,448 - $234,926, plus equity. The benefits available for this position include health insurance, six month paid parental leave, 401(k) retirement plan, monthly meal allowance, 23 paid days off, paid flexible holidays, paid sick leave. These ranges may be modified in the future.
Spotify is an equal opportunity employer. You are welcome at Spotify for who you are, no matter where you come from, what you look like, or what’s playing in your headphones. Our platform is for everyone, and so is our workplace. The more voices we have represented and amplified in our business, the more we will all thrive, contribute, and be forward-thinking! So bring us your personal experience, your perspectives, and your background. It’s in our differences that we will find the power to keep revolutionizing the way the world listens.
 
At Spotify, we are passionate about inclusivity and making sure our entire recruitment process is accessible to everyone. We have ways to request reasonable accommodations during the interview process and help assist in what you need. If you need accommodations at any stage of the application or interview process, please let us know - we’re here to support you in any way we can.","What You'll Do:
Lead and support the Selection engineering team, focusing on growth, performance, and creating an environment where engineers can do their best work
Partner with Product, Data Science, and ML Engineering to define and deliver the technical roadmap for Selection
Guide the evolution of Selection from a rules-based system to a more advanced, signal-driven and ML-informed decision engine
Deliver platform capabilities that directly impact user engagement, retention, and conversion across Spotify
Collaborate across squads and domains to ensure seamless integration and alignment across the Subscriptions mission
Represent Selection in planning, strategy discussions, and initiative scoping tied to high-impact business goals
Balance speed, scalability, and reliability while navigating complex platform trade-offs that affect millions of users
Contribute to the broader engineering culture through hiring, architecture discussions, and cross-team collaboration

Who You Are:
You have 3+ years of experience managing software engineers and have supported teams through growth and delivery
You bring a strong sense of ownership and think beyond execution to understand impact, trade-offs, and long-term direction
You have experience working with complex systems such as distributed systems, real-time pipelines, or platform infrastructure
You care deeply about people and create an environment built on trust, clarity, and continuous development
You communicate clearly and effectively with engineers, cross-functional partners, and senior stakeholders
You are comfortable engaging in technical discussions and asking thoughtful, probing questions
You approach ambiguity with curiosity and are energized by building in evolving and high-impact environments
You value collaboration and contribute to an inclusive, supportive team culture

Where You'll Be:
This role is based in New York
We offer you the flexibility to work where you work best! There will be some in person meetings, but still allows for flexibility to work from home."
Director of Sales - Backstage,Platform,"New York, NY",2026-04-07,0eb478c8-b3e5-4722-91a1-dfbb1740d0fc,spotify,2026-06-05,2026-06-29,0.3368,US,https://jobs.lever.co/spotify/0eb478c8-b3e5-4722-91a1-dfbb1740d0fc,"The Platform team creates the technology that enables Spotify to learn quickly and scale easily, enabling rapid growth in our users and our business around the globe. Spanning many disciplines, we work to make the business work; creating the infrastructure, tooling, frameworks, and capabilities needed to welcome a billion customers.
Backstage was created at Spotify and has grown into a leading SaaS and open source platform for developer portals. Thousands of companies use Backstage to bring structure to complex microservices environments, improve developer experience, and ship high-quality software faster — including in the age of AI — without losing autonomy or control.
This role leads sales for Shipping Our Expertise (SOE), Spotify's B2B SaaS business built on our platform capabilities. Our flagship products — Backstage Portal and Confidence — are AI-first and built to support both human developers and automated systems. Everything we bring to market is battle-tested at Spotify scale, giving our customers confidence that our solutions work in the most complex R&D environments.",Operations and Business Support,Permanent,remote,"The Platform team creates the technology that enables Spotify to learn quickly and scale easily, enabling rapid growth in our users and our business around the globe. Spanning many disciplines, we work to make the business work; creating the infrastructure, tooling, frameworks, and capabilities needed to welcome a billion customers.
Backstage was created at Spotify and has grown into a leading SaaS and open source platform for developer portals. Thousands of companies use Backstage to bring structure to complex microservices environments, improve developer experience, and ship high-quality software faster — including in the age of AI — without losing autonomy or control.
This role leads sales for Shipping Our Expertise (SOE), Spotify's B2B SaaS business built on our platform capabilities. Our flagship products — Backstage Portal and Confidence — are AI-first and built to support both human developers and automated systems. Everything we bring to market is battle-tested at Spotify scale, giving our customers confidence that our solutions work in the most complex R&D environments.","The United States base range for this position is 242,533.00-346,475.00 USD, plus equity. The benefits available for this position include health insurance, six-month paid parental leave, 401(k) retirement plan, monthly meal allowance, 23 paid days off, paid flexible holidays, and paid sick leave. These ranges may be modified in the future.","What You'll Do:
Own revenue targets across new business, expansion, and retention for the SOE product portfolio
Lead, coach, and grow a distributed team across Account Executives, Sales Engineers, and Customer Support
Define and execute a sales strategy focused on engineering leaders, platform teams, and developer experience buyers
Partner closely with Marketing to align on pipeline generation, messaging, and go-to-market strategy
Collaborate with Product and Engineering to represent customer needs and influence roadmap priorities
Build deep expertise in Backstage Portal and Confidence, translating technical value into clear customer outcomes
Tell a compelling story about Spotify’s dogfooding approach and how our products are proven internally at scale
Establish strong forecasting discipline and maintain a healthy, predictable pipeline
Track and improve key metrics such as pipeline coverage, conversion rates, time to close, and net revenue retention
Design scalable sales processes, onboarding programs, and playbooks as the business grows
Represent Spotify externally at industry events, conferences, and key customer engagements

Who You Are:
You have 8+ years of experience in B2B SaaS sales, including 3+ years leading and developing high-performing teams
You are excited about how AI is transforming software development and can connect that shift to real customer value
You are comfortable engaging with engineering leaders, CTOs, and platform teams, and build credibility through understanding their challenges
You have experience selling to R&D, engineering, or developer experience buyers and understand their decision-making processes
You bring experience working alongside Sales Engineering and understand the importance of technical depth in complex sales
You have owned or partnered closely with Customer Support or Customer Success and view post-sale health as part of revenue strategy
You are data-driven and use metrics to guide forecasting, performance, and decision-making
You are able to build structure and process from the ground up without adding unnecessary complexity
You thrive in environments where the product is innovative and requires educating the market

Where You'll Be:
This role is based in the Eastern Standard Time (EST) zone
We offer you the flexibility to work where you work best! There will be some in person meetings, but still allows for flexibility to work from home"
Senior Engineering Manager - Spotify for Artists,Music,"New York, NY",2026-04-07,df494b56-c5d2-4858-a980-c082b3de65c9,spotify,2026-06-05,2026-06-16,0.3047,US,https://jobs.lever.co/spotify/df494b56-c5d2-4858-a980-c082b3de65c9,"The Music Mission team owns Spotify’s end to end proposition for music creators and the experiences they create for fans. The team is dedicated to building tools and services to enable creation, promotion, expression, and monetization at scale.
Spotify for Artists (S4A) is Spotify’s flagship platform for artists and their teams, supporting over 650,000 monthly active users across web and mobile. It’s where artists manage their presence on Spotify—exploring audience insights, promoting releases, customizing profiles, and growing their business through tools like Marquee, Showcase, and Discovery Mode.
As part of the Music Mission, this team operates across a broad technical landscape including client applications, backend systems, and large-scale data pipelines. You’ll lead a team working at the intersection of product innovation and platform reliability, shaping experiences that directly impact Spotify’s global creator community.",Engineering,Permanent,remote,"The Music Mission team owns Spotify’s end to end proposition for music creators and the experiences they create for fans. The team is dedicated to building tools and services to enable creation, promotion, expression, and monetization at scale.
Spotify for Artists (S4A) is Spotify’s flagship platform for artists and their teams, supporting over 650,000 monthly active users across web and mobile. It’s where artists manage their presence on Spotify—exploring audience insights, promoting releases, customizing profiles, and growing their business through tools like Marquee, Showcase, and Discovery Mode.
As part of the Music Mission, this team operates across a broad technical landscape including client applications, backend systems, and large-scale data pipelines. You’ll lead a team working at the intersection of product innovation and platform reliability, shaping experiences that directly impact Spotify’s global creator community.","The United States base range for this position is $203,410–$290,586 USD, plus equity. The benefits available for this position include health insurance, six-month paid parental leave, 401(k) retirement plan, monthly meal allowance, 23 paid days off, paid flexible holidays, and paid sick leave. These ranges may be modified in the future.
Spotify is an equal opportunity employer. You are welcome at Spotify for who you are, no matter where you come from, what you look like, or what’s playing in your headphones. Our platform is for everyone, and so is our workplace. The more voices we have represented and amplified in our business, the more we will all thrive, contribute, and be forward-thinking! So bring us your personal experience, your perspectives, and your background. It’s in our differences that we will find the power to keep revolutionizing the way the world listens.
 
At Spotify, we are passionate about inclusivity and making sure our entire recruitment process is accessible to everyone. We have ways to request reasonable accommodations during the interview process and help assist in what you need. If you need accommodations at any stage of the application or interview process, please let us know - we’re here to support you in any way we can.","What You'll Do:
Lead and grow a team of engineers across backend, client, and data disciplines, supporting multiple squads
Set clear technical and organizational direction across a complex, full-stack product area
Partner closely with Product, Design, Insights, and Marketing to deliver impactful features for artists
Drive execution across multiple concurrent initiatives, ensuring strong coordination and delivery
Translate ambiguity into clear priorities, helping teams navigate competing demands and inbound requests
Oversee the development of scalable systems that process and surface large volumes of artist data
Support critical platform operations and contribute to incident response readiness through team leadership
Contribute to strategic initiatives including AI-driven experiences and artist-focused product innovation

Who You Are:
You have 8+ years of experience in software engineering, with significant experience in engineering leadership, including managing managers
You have led multiple teams or orgs simultaneously and are comfortable operating across a broad, multi-disciplinary technical surface
You are experienced in setting direction through other leaders, empowering them while holding a high bar for delivery and accountability
You know how to navigate organizational complexity and drive alignment across senior cross-functional stakeholders
You are skilled at turning ambiguity into clear strategy, priorities, and execution plans across multiple teams
You have a strong technical foundation and can engage in discussions across backend systems, client applications, and data platforms
You care deeply about building inclusive, high-performing teams and have a track record of developing managers and senior engineers
You are calm and structured in high-pressure situations, able to manage competing priorities and guide teams through critical decisions
You have experience operating in environments with high data scale and understand how to translate complex data into meaningful user experiences
You are motivated by building products that serve creators, artists, or similar user communities

Where You'll Be:
This role is based in New York
We offer you the flexibility to work where you work best! There will be some in person meetings, but still allows for flexibility to work from home"
"Backend Engineer, Bonfire, Music",Music,"New York, NY",2026-04-03,ee5064af-0116-4ef2-994a-cb8fed580290,spotify,2026-06-05,2026-06-08,0.2255,US,https://jobs.lever.co/spotify/ee5064af-0116-4ef2-994a-cb8fed580290,"In the Music Mission, we build the tools and services that enable creators to express themselves, promote their work, and connect with fans.  Discovery Mode is a key promotional tool that helps artists, labels, and licensors grow their audience while maintaining a high-quality listener experience.
You’ll join the Bonfire team, where we focus on building the entire end-to-end campaign booking experience, from intuitive frontend interfaces to the backend services that power them.  As a member of the Bonfire team, you’ll own the full lifecycle of campaign management tools, ensuring that the flow—from the first click to the final execution—is seamless, reliable, and scalable.",Engineering,Permanent,remote,"In the Music Mission, we build the tools and services that enable creators to express themselves, promote their work, and connect with fans.  Discovery Mode is a key promotional tool that helps artists, labels, and licensors grow their audience while maintaining a high-quality listener experience.
You’ll join the Bonfire team, where we focus on building the entire end-to-end campaign booking experience, from intuitive frontend interfaces to the backend services that power them.  As a member of the Bonfire team, you’ll own the full lifecycle of campaign management tools, ensuring that the flow—from the first click to the final execution—is seamless, reliable, and scalable.","The United States base range for this position is $107,483- $153,547 equity. The benefits available for this position include health insurance, six month paid parental leave, 401(k) retirement plan, monthly meal allowance, 23 paid days off, 13 paid flexible holidays, paid sick leave. These ranges may be modified in the future.
Spotify is an equal opportunity employer. You are welcome at Spotify for who you are, no matter where you come from, what you look like, or what’s playing in your headphones. Our platform is for everyone, and so is our workplace. The more voices we have represented and amplified in our business, the more we will all thrive, contribute, and be forward-thinking! So bring us your personal experience, your perspectives, and your background. It’s in our differences that we will find the power to keep revolutionizing the way the world listens.
 
At Spotify, we are passionate about inclusivity and making sure our entire recruitment process is accessible to everyone. We have ways to request reasonable accommodations during the interview process and help assist in what you need. If you need accommodations at any stage of the application or interview process, please let us know - we’re here to support you in any way we can.","What You'll Do:
Build backend services that power campaign booking and management flows
Design and develop APIs that support campaign creation and execution
Work closely with product and design to bring new features to life
Improve system scalability, performance, and reliability
Contribute to a collaborative engineering culture through code reviews and knowledge sharing
Help evolve our architecture as we grow and scale

Who You Are:
You have experience developing backend systems using Java
You know how to design APIs and work with service-based architectures
You write clean, maintainable, and well-tested code
You care about performance, scalability, and system reliability
You enjoy working collaboratively in cross-functional teams
You are curious, proactive, and motivated to learn and grow
You have experience contributing to production systems
You are driven to leverage AI to improve our systems, and eager to find practical ways to apply it

Where You'll Be:
We offer you the flexibility to work where you work best! For this role, you can be within the North America region as long as we have a work location.
This team operates within the Eastern Standard time zone for collaboration."
"Senior Analyst, FP&A, Music Publishing Deal Analysis",Financial Planning and Analysis,"New York, NY",2026-04-02,a7768944-809a-43bf-972e-7221d223331f,spotify,2026-06-05,2026-06-08,0.325,US,https://jobs.lever.co/spotify/a7768944-809a-43bf-972e-7221d223331f,"You’ll join the Music Publishing Deal Analysis team within FP&A, where we partner closely with Licensing, Legal, and Finance to shape the economics behind Spotify’s music business. This team plays a key role in evaluating and structuring publishing deals that support creators while ensuring long-term sustainability for Spotify. You’ll work at the intersection of music, data, and strategy, helping translate complex agreements into clear financial insights that guide decision-making.",Finance,Permanent,hybrid,"You’ll join the Music Publishing Deal Analysis team within FP&A, where we partner closely with Licensing, Legal, and Finance to shape the economics behind Spotify’s music business. This team plays a key role in evaluating and structuring publishing deals that support creators while ensuring long-term sustainability for Spotify. You’ll work at the intersection of music, data, and strategy, helping translate complex agreements into clear financial insights that guide decision-making.","The United States base range for this position is 90521- 129316 USD, plus equity. The benefits available for this position include health insurance, six-month paid parental leave, 401(k) retirement plan, monthly meal allowance, 23 paid days off, paid flexible holidays, and paid sick leave. These ranges may be modified in the future.
Spotify is an equal opportunity employer. You are welcome at Spotify for who you are, no matter where you come from, what you look like, or what’s playing in your headphones. Our platform is for everyone, and so is our workplace. The more voices we have represented and amplified in our business, the more we will all thrive, contribute, and be forward-thinking! So bring us your personal experience, your perspectives, and your background. It’s in our differences that we will find the power to keep revolutionizing the way the world listens.
 
At Spotify, we are passionate about inclusivity and making sure our entire recruitment process is accessible to everyone. We have ways to request reasonable accommodations during the interview process and help assist in what you need. If you need accommodations at any stage of the application or interview process, please let us know - we’re here to support you in any way we can.","What You'll Do:
Partner with Licensing, Accounting, and Legal teams to evaluate global and regional music publishing deals
Build and maintain financial models to assess deal economics, including scenario and sensitivity analysis
Translate contract terms into clear financial insights and materials to support decision-making
Track and develop KPIs to evaluate deal performance and long-term cost impact
Collaborate with Finance, Data, Engineering, and Product teams to support deal implementation and strategy
Communicate financial risks and opportunities to stakeholders and leadership in a clear, actionable way
Support ongoing deal operations, including amendments, renewals, and new rights categories
Improve internal tools, templates, and processes to streamline deal analysis
Stay informed on music industry trends, including publishing, independent labels, and regulatory changes

Who You Are:
You have 3+ years experience in FP&A, deal analysis, investment banking, consulting, or a similar analytical role
You are experienced in building financial models and working through structured analytical problems independently
You are comfortable working with large datasets and have experience with SQL or similar tools
You are interested in developing technical skills, including exposure to AI-enabled tools and workflows
You can interpret commercial terms and collaborate effectively with Legal, Business Affairs, or deal-focused teams
You balance strong attention to detail with sound judgment on priorities and materiality
You communicate clearly and can explain complex analysis to a range of stakeholders
You are curious, ask thoughtful questions, and enjoy building expertise in complex domains

Where You'll Be:
This role is based in New York, NY
We offer you the flexibility to work where you work best! There will be some in person meetings, but still allows for flexibility to work from home. We ask that you come in 3 times per week"
