title,team,location,posted_date,job_id,source,first_seen_date,last_seen_date,semantic_similarity,country,url,description,department,commitment,workplace_type,description_body,additional,lists
Software Engineer - Platform Infrastructure,Platform,"New York, NY",2026-05-08,3707cd2f-202a-4aec-9de8-bf73a5a6e922,spotify,2026-06-05,2026-06-25,0.3194,US,https://jobs.lever.co/spotify/3707cd2f-202a-4aec-9de8-bf73a5a6e922,"The Platform team creates the technology that enables Spotify to learn quickly and scale easily, enabling rapid growth in our users and our business around the globe. Spanning many disciplines, we work to make the business work; creating the infrastructure, tooling, frameworks, and capabilities needed to welcome a billion customers.
What if the systems you built changed how millions of developers work, not just at Spotify, but across the industry? The Platform Developer Experience (PDX) studio builds the infrastructure and internal products that power how Spotify engineers ship software. Within PDX and Backstage Product Area, the Platform Infrastructure team is building the next generation of cloud and compute foundations that power our internal developer platform and the AI agents running on top of it, and help bring those capabilities to market through Portal, Spotify's external developer platform built on Backstage.
You'll join the Platform Infrastructure team within the Backstage Product Area. The team owns the cloud foundations, developer tooling and security posture that the rest of Platform, and ultimately all of Spotify R&D, depends on. You’ll collaborate closely with experienced engineers (both human and AI-assisted) while operating at real-world scale, with deep observability, strong safety boundaries, and the unique reliability challenges of agentic production systems.",Engineering,Permanent,remote,"The Platform team creates the technology that enables Spotify to learn quickly and scale easily, enabling rapid growth in our users and our business around the globe. Spanning many disciplines, we work to make the business work; creating the infrastructure, tooling, frameworks, and capabilities needed to welcome a billion customers.
What if the systems you built changed how millions of developers work, not just at Spotify, but across the industry? The Platform Developer Experience (PDX) studio builds the infrastructure and internal products that power how Spotify engineers ship software. Within PDX and Backstage Product Area, the Platform Infrastructure team is building the next generation of cloud and compute foundations that power our internal developer platform and the AI agents running on top of it, and help bring those capabilities to market through Portal, Spotify's external developer platform built on Backstage.
You'll join the Platform Infrastructure team within the Backstage Product Area. The team owns the cloud foundations, developer tooling and security posture that the rest of Platform, and ultimately all of Spotify R&D, depends on. You’ll collaborate closely with experienced engineers (both human and AI-assisted) while operating at real-world scale, with deep observability, strong safety boundaries, and the unique reliability challenges of agentic production systems.","Spotify is an equal opportunity employer. You are welcome at Spotify for who you are, no matter where you come from, what you look like, or what’s playing in your headphones. Our platform is for everyone, and so is our workplace. The more voices we have represented and amplified in our business, the more we will all thrive, contribute, and be forward-thinking! So bring us your personal experience, your perspectives, and your background. It’s in our differences that we will find the power to keep revolutionizing the way the world listens.
 
At Spotify, we are passionate about inclusivity and making sure our entire recruitment process is accessible to everyone. We have ways to request reasonable accommodations during the interview process and help assist in what you need. If you need accommodations at any stage of the application or interview process, please let us know - we’re here to support you in any way we can.","What You'll Do:
Build and operate components of our multi-cloud foundations across GCP and AWS, including compute, storage, networking, identity, and platform primitives
Own components and features end-to-end: from technical design through implementation, rollout, and on-call
Contribute to developer tooling (CI/CD, build systems, deployment, observability) so engineers ship safely and quickly
Participate in incident management, on-call, and postmortems, using AI assistants to accelerate root cause analysis
Collaborate across Platform and R&D to improve developer productivity
Contribute to Backstage and Portal to simplify cloud and tooling access
Grow through code reviews, design discussions, and collaboration with senior engineers

Who You Are:
You have 2+ years of backend or infrastructure engineering experience working on production systems
You have experience building or operating cloud infrastructure (GCP and/or AWS), with familiarity in Terraform and Kubernetes
You are proficient in at least one modern language (TypeScript, Java, Go, or Python)
You have experience with CI/CD, deployment systems, and observability tooling
You think about systems in terms of reliability, performance, cost, and failure modes
You are curious about AI/LLM systems and their application to infrastructure
You take ownership of your work and follow through on problems
You communicate clearly and collaborate effectively across teams
You are open to feedback and motivated to grow

Where You'll Be:
This role is based in New York, NY
We offer you the flexibility to work where you work best! There will be some in person meetings, but still allows for flexibility to work from home."
Senior Software Engineer - Platform Infrastructure,Platform,"New York, NY",2026-05-08,8b10d06e-0102-4306-831e-4949cb1cc753,spotify,2026-06-05,2026-06-25,0.3238,US,https://jobs.lever.co/spotify/8b10d06e-0102-4306-831e-4949cb1cc753,"The Platform team creates the technology that enables Spotify to learn quickly and scale easily, enabling rapid growth in our users and our business around the globe. Spanning many disciplines, we work to make the business work; creating the infrastructure, tooling, frameworks, and capabilities needed to welcome a billion customers.
What if the systems you built changed how millions of developers work, not just at Spotify, but across the industry? The Platform Developer Experience (PDX) studio builds the infrastructure and internal products that power how Spotify engineers ship software. Within PDX and Backstage Product Area, the Platform Infrastructure team is building the next generation of cloud and compute foundations that power our internal developer platform and the AI agents running on top of it, and help bring those capabilities to market through Portal, Spotify's external developer platform built on Backstage.
You'll join the Platform Infrastructure team within the Backstage Product Area. The team owns the cloud foundations, developer tooling and security posture that the rest of Platform, and ultimately all of Spotify R&D, depends on. You’ll collaborate closely with experienced engineers (both human and AI-assisted) while operating at real-world scale, with deep observability, strong safety boundaries, and the unique reliability challenges of agentic production systems.",Engineering,Permanent,remote,"The Platform team creates the technology that enables Spotify to learn quickly and scale easily, enabling rapid growth in our users and our business around the globe. Spanning many disciplines, we work to make the business work; creating the infrastructure, tooling, frameworks, and capabilities needed to welcome a billion customers.
What if the systems you built changed how millions of developers work, not just at Spotify, but across the industry? The Platform Developer Experience (PDX) studio builds the infrastructure and internal products that power how Spotify engineers ship software. Within PDX and Backstage Product Area, the Platform Infrastructure team is building the next generation of cloud and compute foundations that power our internal developer platform and the AI agents running on top of it, and help bring those capabilities to market through Portal, Spotify's external developer platform built on Backstage.
You'll join the Platform Infrastructure team within the Backstage Product Area. The team owns the cloud foundations, developer tooling and security posture that the rest of Platform, and ultimately all of Spotify R&D, depends on. You’ll collaborate closely with experienced engineers (both human and AI-assisted) while operating at real-world scale, with deep observability, strong safety boundaries, and the unique reliability challenges of agentic production systems.","Spotify is an equal opportunity employer. You are welcome at Spotify for who you are, no matter where you come from, what you look like, or what’s playing in your headphones. Our platform is for everyone, and so is our workplace. The more voices we have represented and amplified in our business, the more we will all thrive, contribute, and be forward-thinking! So bring us your personal experience, your perspectives, and your background. It’s in our differences that we will find the power to keep revolutionizing the way the world listens.
 
At Spotify, we are passionate about inclusivity and making sure our entire recruitment process is accessible to everyone. We have ways to request reasonable accommodations during the interview process and help assist in what you need. If you need accommodations at any stage of the application or interview process, please let us know - we’re here to support you in any way we can.","What You'll Do:
Design, build, and operate multi-cloud foundations across GCP and AWS
Own platform components end-to-end with a strong bar for reliability and security
Improve developer tooling and platform self-service capabilities
Build secure-by-default infrastructure patterns
Drive operational excellence through incident management and automation
Collaborate across Platform and R&D to improve developer productivity
Contribute to Backstage and Portal
Mentor engineers and raise engineering quality

Who You Are:
You have 5+ years of backend or infrastructure engineering experience
You have deep experience with cloud infrastructure (GCP/AWS), Terraform, and Kubernetes
You are proficient in a modern programming language
You have strong experience with CI/CD and developer platforms
You think in distributed systems and understand trade-offs
You are familiar with AI/LLM systems and their application to infrastructure
You take ownership of outcomes and drive impact
You communicate clearly and navigate complex trade-offs
You foster inclusive, collaborative environments

Where You'll Be:
This role is based in New York, NY
We offer you the flexibility to work where you work best! There will be some in person meetings, but still allows for flexibility to work from home."
"Machine Learning Engineer I, Personalization , Minesweeper",Personalization,"New York, NY",2026-05-08,fd79c3f5-1b2c-47c0-a3c6-4972b559e1c1,spotify,2026-06-05,2026-06-09,0.438,US,https://jobs.lever.co/spotify/fd79c3f5-1b2c-47c0-a3c6-4972b559e1c1,"The Personalization team makes deciding what to play next on Spotify easier and more enjoyable for every listener. We seek to understand the world of music, podcasts, and audiobooks better than anyone else so that we can make great recommendations to every individual person and keep the world listening. Every day, hundreds of millions of people all over the world use the products we build which include destinations like “Home” and “Search” as well as original playlists such as “Discover Weekly” and “Daily Mix.”
 
Personalization’s Minesweeper squad produces Human Understandable Language Knowledge to enrich music and talk content understanding. We use AI and ML techniques, including Large Language Models, to understand music, podcasts and audiobooks, building reliable, scalable systems to distribute that knowledge to Spotify internal teams, users, and creators. We are looking for a Machine Learning Engineer to join our team and help build the future of music, podcast and audiobook listening experiences for millions of listeners at Spotify. This is a unique opportunity to help develop and shape Spotify content enrichment, and recommendations. You’ll grow your skills in ML engineering at scale, work with a cross-functional team of Data Engineers, Backend Engineers, and researchers, and join a motivated and supportive team.",Engineering,,remote,"The Personalization team makes deciding what to play next on Spotify easier and more enjoyable for every listener. We seek to understand the world of music, podcasts, and audiobooks better than anyone else so that we can make great recommendations to every individual person and keep the world listening. Every day, hundreds of millions of people all over the world use the products we build which include destinations like “Home” and “Search” as well as original playlists such as “Discover Weekly” and “Daily Mix.”
 
Personalization’s Minesweeper squad produces Human Understandable Language Knowledge to enrich music and talk content understanding. We use AI and ML techniques, including Large Language Models, to understand music, podcasts and audiobooks, building reliable, scalable systems to distribute that knowledge to Spotify internal teams, users, and creators. We are looking for a Machine Learning Engineer to join our team and help build the future of music, podcast and audiobook listening experiences for millions of listeners at Spotify. This is a unique opportunity to help develop and shape Spotify content enrichment, and recommendations. You’ll grow your skills in ML engineering at scale, work with a cross-functional team of Data Engineers, Backend Engineers, and researchers, and join a motivated and supportive team.","The United States base range for this position is $138,250- $197,500 plus equity. The benefits available for this position include health insurance, six month paid parental leave, 401(k) retirement plan, monthly meal allowance, 23 paid days off, 13 paid flexible holidays, paid sick leave. These ranges may be modified in the future.
Spotify is an equal opportunity employer. You are welcome at Spotify for who you are, no matter where you come from, what you look like, or what’s playing in your headphones. Our platform is for everyone, and so is our workplace. The more voices we have represented and amplified in our business, the more we will all thrive, contribute, and be forward-thinking! So bring us your personal experience, your perspectives, and your background. It’s in our differences that we will find the power to keep revolutionizing the way the world listens.
 
At Spotify, we are passionate about inclusivity and making sure our entire recruitment process is accessible to everyone. We have ways to request reasonable accommodations during the interview process and help assist in what you need. If you need accommodations at any stage of the application or interview process, please let us know - we’re here to support you in any way we can.","What You'll Do:
Utilize in-house and 3rd party LLMs to solve language understanding problems
Employ techniques such as fine-tuning and RAG to improve models
Contribute to designing, building, evaluating, shipping, and refining Spotify’s product by hands-on ML development
Help drive optimization, testing, and tooling to improve quality of our content enrichment assets
Collaborate with cross-functional teams of MLEs, data and backend engineers, and other stakeholders including tech research, data science, and product to develop new features and technologies
Be a participant in our AI Foundation’s ML community and work collaboratively and efficiently within our existing platforms and systems Perform data analysis to establish baselines and inform product decisions
Stay up-to-date on the latest machine learning algorithms and techniques

Who You Are:
You have a strong background in machine learning, especially experience with Large Language Models
You have professional experience in applied machine learning
Extensive experience working in a product and data-driven environment (Python, Scala, Java, SQL, with Python experience required) and cloud platforms (GCP or AWS)
You have some hands-on experience implementing or prototyping machine learning systems at scale
You have experience architecting data pipelines and are self-sufficient in getting the data you need to build and evaluate models, using tools like Dataflow, Apache Beam, or Spark
You care about agile software processes, data-driven development, reliability, and disciplined experimentation
You have experience and passion for fostering collaborative teams
Experience with PyTorch, TensorFlow, and/or other scalable Machine learning frameworks. Experience with Ray or TFX is a plus
Bonus if you have experience with architecting near real time pipelines

Where You'll Be:
We offer you the flexibility to work where you work best! For this role, you can be within the North America region as long as we have a work location.This team operates within the Eastern Standard time zone for collaboration."
"Senior Machine Learning Engineer, Personalization, Magenta",Personalization,"New York, NY",2026-05-07,3cf07bc7-2b9f-4531-af88-a09cfdf7b3ab,spotify,2026-06-05,2026-07-17,0.298,US,https://jobs.lever.co/spotify/3cf07bc7-2b9f-4531-af88-a09cfdf7b3ab,"The Personalization team makes deciding what to play next easier and more enjoyable for every listener. From Blend to Discover Weekly, we’re behind some of Spotify’s most-loved features. We built them by understanding the world of music and podcasts better than anyone else. Join us and you’ll keep millions of users listening by making great recommendations to each and every one of them.
 The Personalization team at Spotify makes deciding what to listen to next feel effortless for hundreds of millions of users — from Discover Weekly to our newest AI-powered experiences. We’re now building conversational AI capabilities that let users interact with Spotify in natural language. You’ll join a squad working at the core of this space, shaping how users discover and engage with audio through intelligent, responsive systems.",Engineering,,remote,"The Personalization team makes deciding what to play next easier and more enjoyable for every listener. From Blend to Discover Weekly, we’re behind some of Spotify’s most-loved features. We built them by understanding the world of music and podcasts better than anyone else. Join us and you’ll keep millions of users listening by making great recommendations to each and every one of them.
 The Personalization team at Spotify makes deciding what to listen to next feel effortless for hundreds of millions of users — from Discover Weekly to our newest AI-powered experiences. We’re now building conversational AI capabilities that let users interact with Spotify in natural language. You’ll join a squad working at the core of this space, shaping how users discover and engage with audio through intelligent, responsive systems.","The United States base range for this position is $184,050- $262,928 plus equity. The benefits available for this position include health insurance, six month paid parental leave, 401(k) retirement plan, monthly meal allowance, 23 paid days off, 13 paid flexible holidays, paid sick leave. These ranges may be modified in the future.
Spotify is an equal opportunity employer. You are welcome at Spotify for who you are, no matter where you come from, what you look like, or what’s playing in your headphones. Our platform is for everyone, and so is our workplace. The more voices we have represented and amplified in our business, the more we will all thrive, contribute, and be forward-thinking! So bring us your personal experience, your perspectives, and your background. It’s in our differences that we will find the power to keep revolutionizing the way the world listens.
 
At Spotify, we are passionate about inclusivity and making sure our entire recruitment process is accessible to everyone. We have ways to request reasonable accommodations during the interview process and help assist in what you need. If you need accommodations at any stage of the application or interview process, please let us know - we’re here to support you in any way we can.","What You'll Do:
Design and ship production-grade machine learning systems powering conversational and agentic AI experiences
Build systems that interpret user intent, manage context across multi-turn interactions, and handle ambiguity reliably at scale
Develop and evolve agentic workflows including memory, context management, and multi-step tool orchestration
Create evaluation frameworks, including LLM-as-judge pipelines, to measure quality and guide iteration
Partner closely with product, engineering, and design to deliver seamless, user-facing experiences
Balance experimentation with production rigor, ensuring performance, latency, and reliability at Spotify scale
Continuously improve agent behavior through tight feedback loops between evaluation and real-world usage

Who You Are :
You have 5+ years of experience building and shipping machine learning systems in production environments
You are experienced with large language models and have worked on real-world applications beyond experimentation; shipped and maintained large scale systems with LLMs
You have a deep understanding of challenges in conversational or agentic systems, such as context handling and multi-step reasoning
You know how to evaluate ML systems rigorously and have experience designing metrics or evaluation pipelines
You are comfortable debugging complex interactions between models, tools, and system constraints like latency
You care about building reliable, scalable systems that deliver high-quality user experiences
You enjoy working cross-functionally and contributing to a collaborative, inclusive team environment

Where You'll Be:
This role is based in New York
We offer you the flexibility to work where you work best! There will be some in person meetings, but still allows for flexibility to work from home"
