title,team,location,posted_date,job_id,source,first_seen_date,last_seen_date,semantic_similarity,country,url,description,department,commitment,workplace_type,description_body,additional,lists
"Manager, Music Publishing Operations",Music Business,"New York, NY; London",2026-06-09,0bb6fa09-09b6-4f4d-8b2f-61eae0c23609,spotify,2026-06-15,2026-06-22,0.3152,US,https://jobs.lever.co/spotify/0bb6fa09-09b6-4f4d-8b2f-61eae0c23609,"We are looking for a Manager, Music Publishing Operations to join Spotify’s Music Publishing Operations team. In this role, you will lead the onboarding and ongoing support of music publishing licensors to Spotify’s right management systems, ensuring operational excellence across our global video licensing landscape.
You will serve as a key point of contact for US and ex-US partners. This role requires strong cross-functional collaboration, technical fluency, and a deep understanding of rights data workflows to ensure accuracy, alignment, and scalability.
This is an exciting opportunity to help shape the future of video publishing operations at Spotify, driving best-in-class partner experiences and ensuring the integrity of rights management systems.",Content,Permanent,onsite,"We are looking for a Manager, Music Publishing Operations to join Spotify’s Music Publishing Operations team. In this role, you will lead the onboarding and ongoing support of music publishing licensors to Spotify’s right management systems, ensuring operational excellence across our global video licensing landscape.
You will serve as a key point of contact for US and ex-US partners. This role requires strong cross-functional collaboration, technical fluency, and a deep understanding of rights data workflows to ensure accuracy, alignment, and scalability.
This is an exciting opportunity to help shape the future of video publishing operations at Spotify, driving best-in-class partner experiences and ensuring the integrity of rights management systems.","The United States base range for this position is $125,883 - $179,833, plus equity. The benefits available for this position include health insurance, six month paid parental leave, 401(k) retirement plan, monthly meal allowance, 23 paid days off, 13 paid flexible holidays. This range encompasses multiple levels. Leveling is determined during the interview process. Placement in a level depends on relevant work history and interview performance. These ranges may be modified in the future.
Spotify is an equal opportunity employer. You are welcome at Spotify for who you are, no matter where you come from, what you look like, or what’s playing in your headphones. Our platform is for everyone, and so is our workplace. The more voices we have represented and amplified in our business, the more we will all thrive, contribute, and be forward-thinking! So bring us your personal experience, your perspectives, and your background. It’s in our differences that we will find the power to keep revolutionizing the way the world listens.
 
At Spotify, we are passionate about inclusivity and making sure our entire recruitment process is accessible to everyone. We have ways to request reasonable accommodations during the interview process and help assist in what you need. If you need accommodations at any stage of the application or interview process, please let us know - we’re here to support you in any way we can.","What You'll Do:
Help music publishing partners get up and running on Spotify's rights management systems, creating a smooth and scalable onboarding experience.
Investigate, troubleshoot, and resolve partner questions related to rights data, claims, and platform functionality.
Own conflict management workflows, driving accurate rights data alignment and supporting efficient dispute resolution across rights holders.
Maintain and improve operational processes within our partner-facing tools, including onboarding workflows, issue resolution, and feature rollouts.
Monitor and support third-party data transfers to ensure reliable and consistent operations.
Manage licensor and market configurations, maintaining accurate setup, governance, and ongoing compliance.
Identify opportunities to improve tools, documentation, and processes that enhance partner experiences and increase operational efficiency.
Collaborate closely with teams across Legal, Licensing, Product, Engineering, and Finance to support music publishing operations at global scale.

Who You Are:
You have experience working in music publishing, rights management, licensing operations, or a related field.
You have successfully onboarded external partners and built strong relationships with stakeholders across multiple markets or regions.
You know how to navigate technical systems and investigate data, workflow, or configuration issues to identify practical solutions.
You have strong analytical and problem-solving skills, with a keen eye for detail and data accuracy.
You communicate clearly and effectively with both technical and non-technical audiences.
You thrive in collaborative, cross-functional environments and enjoy working with teams to solve complex operational challenges.
You are organized, adaptable, and able to manage competing priorities in a fast-moving environment.
You care about creating efficient processes and delivering a high-quality experience for partners and stakeholders.

Where You'll Be:
This role will be based in New York, NY or London, UK.
We offer you the flexibility to work where you work best! There will be some in person meetings, but still allows for flexibility to work from home."
Data Scientist,Content Analytics,"New York, NY",2026-06-09,5e91f92c-7487-40c5-92d8-b335b3b52ae9,spotify,2026-06-09,2026-06-09,0.4164,US,https://jobs.lever.co/spotify/5e91f92c-7487-40c5-92d8-b335b3b52ae9,"The Podcast & Video Analytics team sits within Spotify’s Content Analytics organisation and partners closely with Podcast, Video, Product, Engineering, and Content teams to shape the future of creator-driven experiences on Spotify. The team's mission is to empower strategic decision-making through world-class analytics, helping Spotify better understand audience behaviour, content performance, and emerging consumption trends across podcast and video formats.
Operating at the intersection of data science, content strategy, and technology, the team develops scalable measurement frameworks, uncovers actionable insights, and pioneers new analytical approaches using AI and advanced modelling techniques. By translating complex data into compelling narratives and practical recommendations, the team helps ensure Spotify continues to innovate and lead in the rapidly evolving Podcast & Video landscape.",Data and Analytics,Permanent,hybrid,"The Podcast & Video Analytics team sits within Spotify’s Content Analytics organisation and partners closely with Podcast, Video, Product, Engineering, and Content teams to shape the future of creator-driven experiences on Spotify. The team's mission is to empower strategic decision-making through world-class analytics, helping Spotify better understand audience behaviour, content performance, and emerging consumption trends across podcast and video formats.
Operating at the intersection of data science, content strategy, and technology, the team develops scalable measurement frameworks, uncovers actionable insights, and pioneers new analytical approaches using AI and advanced modelling techniques. By translating complex data into compelling narratives and practical recommendations, the team helps ensure Spotify continues to innovate and lead in the rapidly evolving Podcast & Video landscape.",,"What You'll do :
Act as a core analytics partner to Podcast & Video content teams, providing deep-dive research and insights that shape long-term, data-driven programming and product roadmaps.
Identify emerging trends in podcast listening and video consumption, pinpointing opportunities in priority markets to keep Spotify’s Podcast & Video strategy ahead of the curve.
Transform complex data into scalable, actionable playbooks that empower global content and product teams to execute high-impact strategies.
Design measurement frameworks using causal inference, experimentation, and modelling to quantify the incremental impact of Podcast & Video content and product decisions.
Build and iterate on AI-powered dashboards and data visualisations that make Podcast & Video data more accessible and intuitive for stakeholders across the business.
Leverage AI tooling, including LLMs and agentic coding assistants, to automate analytical workflows, accelerate insight generation, and explore new frontiers in data storytelling.
Synthesise data findings into compelling narratives that drive alignment across Product, Engineering, and Content stakeholders.
Gather stakeholder input to understand and translate their needs into clear data requirements and deliverables, supporting documentation, and knowledge sharing across the team.

Who You Are:
You have a degree in a quantitative field, such as Computer Science/Engineering, Mathematics, Statistics, or Economics.
You have 1+ years of relevant experience performing data analysis or data science. In particular:
You are proficient in Python and SQL and an early adopter of AI coding tools such as Cursor, Claude, Codex, or GitHub Copilot.
Experience building data visualisations and dashboards; familiarity with AI-assisted or code-driven charting approaches (e.g. D3.js) is a plus.
Experience with A/B testing and statistical modelling.
A demonstrated track record of integrating AI and LLM tools into your data science workflow, whether for analysis, automating repeatable tasks, or building intelligent data products.
You are a confident communicator who can ground subjective, creative discussions in objective data.
A storyteller who creates value for the business by translating data into actionable strategy.
You are passionate about podcasts, video, and creator-driven content. Previous experience in audio, video, or broader creative industries is an advantage.
You are based in New York and comfortable working with crossover into other US and European timezones regularly.

Where You'll Be:
This role is based in New York.
We offer you the flexibility to work where you work best! There will be some in person meetings, but still allows for flexibility to work from home."
"Manager, Consumer Business Development - Speaker and Audio Partners",Experience,"New York, NY",2026-06-08,c57d5fa0-2f0e-45f4-abdd-e3ee5fdb85c4,spotify,2026-06-09,2026-07-17,0.2631,US,https://jobs.lever.co/spotify/c57d5fa0-2f0e-45f4-abdd-e3ee5fdb85c4,"Delivering the best Spotify experience, everywhere and every time. Spotify’s ability to deliver seamless listening experiences depends on strong partnerships across hardware, audio technology, and connected device ecosystems. In this role, you’ll help shape how users experience Spotify across speakers, listening devices, and emerging audio technologies through strategic partnerships, technical integrations, and ecosystem collaboration.
You’ll strengthen and evolve Spotify’s hardware and audio ecosystem and evolve Spotify’s hardware and audio ecosystem by driving high-quality integrations and advancing technical partnerships that improve user experience. This role operates within a broader ecosystem direction and partners closely with cross-functional teams to execute against defined priorities, while contributing to the evolution of Spotify’s hardware and audio partnerships.",Operations and Business Support,Permanent,remote,"Delivering the best Spotify experience, everywhere and every time. Spotify’s ability to deliver seamless listening experiences depends on strong partnerships across hardware, audio technology, and connected device ecosystems. In this role, you’ll help shape how users experience Spotify across speakers, listening devices, and emerging audio technologies through strategic partnerships, technical integrations, and ecosystem collaboration.
You’ll strengthen and evolve Spotify’s hardware and audio ecosystem and evolve Spotify’s hardware and audio ecosystem by driving high-quality integrations and advancing technical partnerships that improve user experience. This role operates within a broader ecosystem direction and partners closely with cross-functional teams to execute against defined priorities, while contributing to the evolution of Spotify’s hardware and audio partnerships.","The United States base range for this position is $143,510 to $205,015, plus equity. The benefits available for this position include health insurance, six month paid parental leave, 401(k) retirement plan, monthly meal allowance, 23 paid days off, 13 paid flexible holidays, paid sick leave. These ranges may be modified in the future.
Spotify is an equal opportunity employer. You are welcome at Spotify for who you are, no matter where you come from, what you look like, or what’s playing in your headphones. Our platform is for everyone, and so is our workplace. The more voices we have represented and amplified in our business, the more we will all thrive, contribute, and be forward-thinking! So bring us your personal experience, your perspectives, and your background. It’s in our differences that we will find the power to keep revolutionizing the way the world listens.
 
At Spotify, we are passionate about inclusivity and making sure our entire recruitment process is accessible to everyone. We have ways to request reasonable accommodations during the interview process and help assist in what you need. If you need accommodations at any stage of the application or interview process, please let us know - we’re here to support you in any way we can.","What You'll Do :
Own and grow a portfolio of strategic hardware and audio technology partnerships
Contribute to defining and executing the long-term partnership strategy, identifying where to scale and where to deepen existing integrations
Lead negotiations for contractual agreements covering both business and technical terms, and ensure partnerships deliver against shared commitments
Partner closely with Product, Engineering, and Audio teams to ensure integrations meet high quality and performance standards
Build relationships across various function at partner organizations including business, marketing,  product and engineering teams
Interface regularly with global teams
Coordinate cross-functionally internally with Legal, Licensing, Product, Engineering, Audio, Marketing, and Premium teams to drive partnerships forward
Stay ahead of the consumer hardware and audio technology landscape, including emerging audio formats, listening device categories, and standards and bring outside-in perspective into Spotify's strategy
Use data and AI-driven insights to improve partner integrations, performance, and user experience across devices
Advance Spotify’s position in hardware/audio ecosystems, improve audio quality support across partner devices, identify and execute new technical integrations that improve user experience in the first 6-12 months

Who You Are:
You have experience working with hardware, platform, or technical ecosystems
You are comfortable navigating technical tradeoffs and partner integration challenges
You have a track record of leading and closing complex partnerships across hardware, consumer electronics, or audio technology
You are technically proficient, with the ability to engage credibly on substantive product and technology topics with both partner and internal teams
You are comfortable leveraging data and AI tools to inform partner strategy, identify opportunities, and scale decision-making
You are a  strategic thinker who can zoom out from individual deals to shape the broader partnership portfolio
You thrive in fast-paced, ambiguous environments, comfortable defining the path forward when one doesn't yet exist, prioritizing sharply, and driving outcomes without waiting for perfect information
You are deeply familiar with agreements and frameworks such as NDAs, licensing structures, and distribution deals, confident leading contractual negotiations and operationalizing agreements that include both business and technical terms
You are able to build strong, genuine relationships and communicate with clarity. You've worked with cross-functional teams and value environments where collaboration, openness, and shared problem-solving are central to success
You are organized, steady under pressure, and motivated by crafting solutions that work well for partners and users alike
Proficient in written and spoken English
Willing to frequently collaborate with partners in the GMT timezone
Flexible for periodic travel for client meetings, events and team collaboration

Where You'll Be:
This role is based in our New York office 
We offer flexibility so you can work where you work best. While some in-person meetings will take place, you will also have the option to work from home"
"Manager, Consumer Business Development -  Audiobooks and Media Partners",Experience,"New York, NY",2026-06-08,b66e964c-fbb5-4845-b250-1412b00f0b81,spotify,2026-06-09,2026-07-17,0.2794,US,https://jobs.lever.co/spotify/b66e964c-fbb5-4845-b250-1412b00f0b81,,Operations and Business Support,Permanent,remote,,"The United States base range for this position is $143,511 to $205,015, plus equity. The benefits available for this position include health insurance, six month paid parental leave, 401(k) retirement plan, monthly meal allowance, 23 paid days off, 13 paid flexible holidays, paid sick leave. These ranges may be modified in the future.
Spotify is an equal opportunity employer. You are welcome at Spotify for who you are, no matter where you come from, what you look like, or what’s playing in your headphones. Our platform is for everyone, and so is our workplace. The more voices we have represented and amplified in our business, the more we will all thrive, contribute, and be forward-thinking! So bring us your personal experience, your perspectives, and your background. It’s in our differences that we will find the power to keep revolutionizing the way the world listens.
 
At Spotify, we are passionate about inclusivity and making sure our entire recruitment process is accessible to everyone. We have ways to request reasonable accommodations during the interview process and help assist in what you need. If you need accommodations at any stage of the application or interview process, please let us know - we’re here to support you in any way we can.","What You'll Do:
Manage and grow a portfolio of strategic partnerships, with a focus on audiobooks and media partners, serving as a trusted day-to-day partner contact
Act as the primary point of contact for partners' needs, while executing long-term partner strategies that bring value to Spotify users around the world.
Lead and support the negotiation of contractual agreements and operationalize those partnerships to ensure commitments are delivered across product, marketing, reporting, and integrations.
Build deep relationships across partner organizations, from product and engineering to business, marketing, and content, interfacing regularly with global teams.
Partner closely with Product and Engineering to define and support distribution strategies and integrations across partner surfaces and platforms.
Coordinate cross-functionally internally with Legal, Licensing, Product, Technology, Marketing, Content, and Premium teams to drive partnerships forward.
Source, evaluate, and develop new partnership opportunities, with a focus on expanding Spotify’s audiobooks ecosystem, while scaling existing relationships across media and emerging partner areas
Navigate evolving partner ecosystems and translate strategy into scalable execution.
Partner closely with internal leads to operationalize and scale initiatives across a defined portfolio
Stay ahead of industry trends across audiobooks, publishing, and the broader media landscape, bringing an informed perspective to partnership opportunities and internal priorities
Leverage data and AI tools to identify emerging partnership opportunities and scale decision-making across a diverse partner set

Who You Are:
You have a strong track record in business development and independently leading complex partnership negotiations.
You are comfortable leveraging data and AI tools to inform partner strategy and identify growth opportunities.
You are comfortable operating in ambiguity and navigating evolving partner landscapes.
You have experience identifying and building new partnership opportunities from early stages through scaling.
You have experience in or strong interest in audiobooks, publishing, or audio content ecosystems is a plus
You are deeply familiar with agreements and frameworks such as NDAs, licensing structures, and distribution deals.
You are confident with contractual negotiations and operationalizing agreements that include both business and technical terms.
You are organized, steady under pressure, and motivated by crafting solutions that work well for partners and users alike.
Willing to frequently collaborate with stakeholders in the GMT timezone and flexible for periodic travel for client meetings, events and team collaboration

Where You'll Be:
This role is based in our New York office
We offer flexibility so you can work where you work best. While some in-person meetings will take place, you will also have the option to work from home"
