title,team,location,posted_date,job_id,source,first_seen_date,last_seen_date,semantic_similarity,country,url,description,department,commitment,workplace_type,description_body,additional,lists
Marketing Technology Manager,Marketing,"New York, NY",2026-07-17,6c591c8a-9aeb-4760-ace1-1942da31aca9,spotify,2026-07-17,2026-07-17,0.4819,US,https://jobs.lever.co/spotify/6c591c8a-9aeb-4760-ace1-1942da31aca9,"Join Spotify's Global Growth team and help drive user growth across both free and Premium experiences for millions of listeners around the world.
We're looking for a Marketing Technology Manager to join our team. This role sits at the intersection of marketing, product, and technology, helping us scale high-impact growth marketing campaigns through the right tools, automation, and AI-powered solutions. You'll shape the future of our marketing technology ecosystem, partner with cross-functional teams, and enable smarter, more efficient ways of reaching and engaging users.
If you're energized by solving technical challenges, translating business needs into scalable solutions, and using AI to unlock new possibilities, we'd love to hear from you.",Markets and Subscriber Growth,Permanent,hybrid,"Join Spotify's Global Growth team and help drive user growth across both free and Premium experiences for millions of listeners around the world.
We're looking for a Marketing Technology Manager to join our team. This role sits at the intersection of marketing, product, and technology, helping us scale high-impact growth marketing campaigns through the right tools, automation, and AI-powered solutions. You'll shape the future of our marketing technology ecosystem, partner with cross-functional teams, and enable smarter, more efficient ways of reaching and engaging users.
If you're energized by solving technical challenges, translating business needs into scalable solutions, and using AI to unlock new possibilities, we'd love to hear from you.","The United States base range for this position is $79,057.00-112,938.00 plus equity. The benefits available for this position include health insurance, six month paid parental leave, 401(k) retirement plan, 23 paid days off, 13 paid flexible holidays, paid sick leave. This range encompasses multiple levels. Leveling is determined during the interview process. Placement in a level depends on relevant work history and interview performance.
Spotify is an equal opportunity employer. You are welcome at Spotify for who you are, no matter where you come from, what you look like, or what’s playing in your headphones. Our platform is for everyone, and so is our workplace. The more voices we have represented and amplified in our business, the more we will all thrive, contribute, and be forward-thinking! So bring us your personal experience, your perspectives, and your background. It’s in our differences that we will find the power to keep revolutionizing the way the world listens.
 
At Spotify, we are passionate about inclusivity and making sure our entire recruitment process is accessible to everyone. We have ways to request reasonable accommodations during the interview process and help assist in what you need. If you need accommodations at any stage of the application or interview process, please let us know - we’re here to support you in any way we can.","What You'll Do:
Lead the evolution of Spotify's growth marketing technology ecosystem by identifying, implementing, and optimizing tools that enable scalable, high-performing marketing campaigns.
Take an AI-first approach to improving workflows by identifying opportunities to automate processes, enhance personalization, and accelerate experimentation.
Partner closely with Growth Marketing, Product, Engineering, Data Science, and Analytics teams to translate business needs into scalable technical solutions.
Evaluate new marketing technologies, vendors, and emerging AI capabilities, providing recommendations that improve campaign effectiveness and operational efficiency.
Support the delivery of performance marketing initiatives by ensuring the marketing technology stack enables reliable execution, measurement, and optimization.
Drive continuous improvements to campaign operations, helping teams move faster while maintaining high quality and governance.
Stay current on trends across marketing technology, AI, and digital advertising, sharing insights and best practices across the organization.

Who You Are:
You have 3+ years of experience in marketing technology, marketing operations, growth marketing, or performance marketing within a fast-growing technology company.
You understand today's marketing technology ecosystem, including customer data platforms, marketing automation platforms, advertising platforms, and measurement solutions, and you're excited to keep learning as the landscape evolves.
You have hands-on experience working with paid media platforms such as Google Ads, Meta Ads Manager, or similar platforms, and understand how campaigns are built, measured, and optimized.
You actively use AI tools such as Claude, ChatGPT, or similar assistants to improve productivity, automate repetitive work, and create more efficient workflows, and can demonstrate the impact of those solutions.
You know how to balance technical detail with business outcomes and can communicate effectively with both technical and non-technical stakeholders.
You enjoy collaborating across teams and building strong partnerships to solve complex problems.
You are comfortable working in a fast-moving environment where priorities evolve and continuous improvement is part of the culture.
You care about creating scalable solutions that improve both business outcomes and the user experience.

Where You'll Be:
This role is based in New York
We offer you the flexibility to work where you work best! There will be some in person meetings, but still allows for flexibility to work from home. We ask that you come in 2 times per week."
"Manager, Financial Planning & Analysis – Payments & Customer Service",Financial Planning and Analysis,"New York, NY; London",2026-07-15,1d7db6ea-59dd-4ebb-86c5-f0f12ee2db92,spotify,2026-07-15,2026-07-17,0.3496,US,https://jobs.lever.co/spotify/1d7db6ea-59dd-4ebb-86c5-f0f12ee2db92,"Spotify is looking for a Manager to join our Finance team and serve as a dedicated FP&A partner for our global Payments and Customer Service functions. As Spotify continues to scale across markets and monetization models, payments sit at the heart of how we acquire, convert, and retain subscribers, while customer service shapes the experience and cost of supporting them. This role owns the financial lens on both ecosystems.
This is a high-impact, partner-facing finance role responsible for the payments and customer service forecast processes, the financial evaluation of payment partner and processor deals, the pipeline of payment optimization proposals, revenue protection and payment-cost assurance, and the modeling of contact center labor needs. You will partner with Payments, Customer Service, Subscriptions, Risk, Data, Financial Engineering, Accounting, and Business leadership to translate complex operational economics into clear financial narratives, build the models that inform decisions, and govern performance against plan.",Finance,Permanent,hybrid,"Spotify is looking for a Manager to join our Finance team and serve as a dedicated FP&A partner for our global Payments and Customer Service functions. As Spotify continues to scale across markets and monetization models, payments sit at the heart of how we acquire, convert, and retain subscribers, while customer service shapes the experience and cost of supporting them. This role owns the financial lens on both ecosystems.
This is a high-impact, partner-facing finance role responsible for the payments and customer service forecast processes, the financial evaluation of payment partner and processor deals, the pipeline of payment optimization proposals, revenue protection and payment-cost assurance, and the modeling of contact center labor needs. You will partner with Payments, Customer Service, Subscriptions, Risk, Data, Financial Engineering, Accounting, and Business leadership to translate complex operational economics into clear financial narratives, build the models that inform decisions, and govern performance against plan.","The United States base range for this position is $117,677–$168,111, plus equity. The benefits available for this position include health insurance, six-month paid parental leave, 401(k) retirement plan, monthly meal allowance, 23 paid days off, paid flexible holidays, and paid sick leave. These ranges may be modified in the future.
Spotify is an equal opportunity employer. You are welcome at Spotify for who you are, no matter where you come from, what you look like, or what’s playing in your headphones. Our platform is for everyone, and so is our workplace. The more voices we have represented and amplified in our business, the more we will all thrive, contribute, and be forward-thinking! So bring us your personal experience, your perspectives, and your background. It’s in our differences that we will find the power to keep revolutionizing the way the world listens.
 
At Spotify, we are passionate about inclusivity and making sure our entire recruitment process is accessible to everyone. We have ways to request reasonable accommodations during the interview process and help assist in what you need. If you need accommodations at any stage of the application or interview process, please let us know - we’re here to support you in any way we can.","What You'll Do:
Payments Forecast Process Own the end-to-end payments forecast — including processing fees, vendor mix, and refunds — across monthly, quarterly, and annual planning cycles. Build and maintain driver-based models, analyse variances against forecast, and clearly explain the underlying drivers to leadership.
Payment Deal Making & Partner Value Serve as the finance lead on payment partner, processor, and payment-method agreements. Model deal economics, pricing tiers, volume commitments, and incentive structures; quantify margin and cash-flow impact; and maximise the value of strategic partnerships while driving cost efficiencies at scale alongside Payments, Legal, and Business Development.
Payment Optimisation & AI/ML Build business cases for payment optimisation initiatives — routing, retry logic, local payment methods, fee reduction, and authorisation-rate improvements, including ML-driven optimisation. Size the opportunity, define success metrics, and track realised impact against the original investment case.
Checkout Flow Build business cases for checkout experience investments, partnering with Product and Engineering to evaluate the financial impact of flow changes on conversion, payment success rates, and subscriber acquisition costs.
Regional & Local Payment Methods Partner with regional payments leads to evaluate the economics of local payment methods, prioritise market-level investments, and align regional performance with global priorities.
Revenue Protection & Risk Provide the financial lens on revenue protection and payment risk — fraud, authentication, disputes and chargebacks, and reselling — quantifying the trade-off between loss mitigation, margin, and genuine-user experience, and supporting the business case for risk and regulatory readiness.
Payment Cost Assurance Partner with Financial Engineering and Data Science to verify and reconcile payment fees, detect fee anomalies, and build the automation, tooling, and alerting that improve cost visibility and forecasting accuracy.
Customer Service Forecast Process Own the customer service forecast across monthly, quarterly, and annual planning cycles — contact volumes, channel mix, cost-to-serve, and outsourced and in-house support spend. Analyse variances against plan and clearly explain the drivers to leadership.
Contact Centre Labour & Vendor Management Build and maintain workforce models that translate forecasted contact volumes, handle times, and service-level targets into headcount, staffing, and labour cost. Manage the economics of the BPO/vendor portfolio and site mix across geographies, and run scenario analysis for ramp-ups, seasonality, capacity, and efficiency initiatives.
Service Automation & Deflection Economics Quantify the financial impact of self-service, automation, and AI-driven deflection on contact volume and cost-to-serve, and build the business cases that balance efficiency against customer experience.
Performance Governance Establish and own the reporting infrastructure for payments and customer service. Develop and track KPIs covering cost of payments, acceptance rates, cost-to-serve, and the long-term unit economics of both functions.
Strategic Partnership Act as the primary finance partner to the Payments and Customer Service organisations, providing scenario analysis and decision support on roadmap prioritisation, market expansion, staffing strategy, and infrastructure investment.
Cross-Functional Leadership Partner with Data and Engineering teams to improve forecasting accuracy and cost visibility, and translate operational data into financial insight for non-technical stakeholders across Spotify.

Who You Are:
Experienced Finance Professional: 5+ years in FP&A, Corporate Development, Investment Banking, or strategic finance. Experience in payments, fintech, subscriptions, customer service/contact centre operations, or other transaction- and labour-intensive businesses is highly preferred.
Sophisticated Modeller: You build dynamic, driver-based models that handle complex variables — fee structures, payment-method mix, FX, fraud and dispute rates, contact volumes, handle times, and staffing requirements — and distil them into the assumptions that matter most for a decision.
Deal-Oriented: You can structure and evaluate commercial agreements, pressure-test pricing and incentive terms, and clearly articulate trade-offs to senior stakeholders.
Clear Communicator & Influencer: You have a sharp eye for detail and the ability to influence senior stakeholders across Finance and the business through clear, data-driven narratives and investment cases.
Operational Mindset: You are comfortable navigating ambiguity and building processes from scratch in a fast-paced, flat organisational structure.
Systems Fluency: Comfortable with automated reporting and planning tools (NetSuite/Adaptive, Workday Financials), strong SQL or data fluency, and a track record of leveraging AI and ML to drive analytical throughput and optimisation.

Where You'll Be:
This role is based in London or New York.
We offer flexibility to work where you work best, with 2–3 days per week in the office.
Collaboration hours align to the EST time zone."
Producer - The Journal,Studios,"New York, NY; Washington D.C.",2026-07-13,a6134bc1-0627-4f0b-8c0b-ed81cba2d655,spotify,2026-07-13,2026-07-17,0.2398,US,https://jobs.lever.co/spotify/a6134bc1-0627-4f0b-8c0b-ed81cba2d655,"The Journal is a daily narrative news podcast produced in partnership with the Wall Street Journal. Each day, we tell one important news story in 15-20 minutes. We focus on money and business — applying those lenses to general news or zooming in on business stories other outlets don't tell. We've published explosive investigations into stand-your-ground laws and the fertility industry, covered news on the fast-moving world of OpenAI and the race to control artificial intelligence, and everything from Elon Musk’s business empire to the viral rise of Labubus. We work alongside some of the best business journalists in the world, and our show is heard by millions of listeners.",Content,Permanent,hybrid,"The Journal is a daily narrative news podcast produced in partnership with the Wall Street Journal. Each day, we tell one important news story in 15-20 minutes. We focus on money and business — applying those lenses to general news or zooming in on business stories other outlets don't tell. We've published explosive investigations into stand-your-ground laws and the fertility industry, covered news on the fast-moving world of OpenAI and the race to control artificial intelligence, and everything from Elon Musk’s business empire to the viral rise of Labubus. We work alongside some of the best business journalists in the world, and our show is heard by millions of listeners.","Spotify is an equal opportunity employer. You are welcome at Spotify for who you are, no matter where you come from, what you look like, or what’s playing in your headphones. Our platform is for everyone, and so is our workplace. The more voices we have represented and amplified in our business, the more we will all thrive, contribute, and be forward-thinking! So bring us your personal experience, your perspectives, and your background. It’s in our differences that we will find the power to keep revolutionizing the way the world listens.
 
At Spotify, we are passionate about inclusivity and making sure our entire recruitment process is accessible to everyone. We have ways to request reasonable accommodations during the interview process and help assist in what you need. If you need accommodations at any stage of the application or interview process, please let us know - we’re here to support you in any way we can.","What You'll Do:
Pitch story ideas tied to the news cycle that can be executed on a tight timeline, as well as contribute to longer-term projects
Book, prepare for, record, and produce interviews with sources inside and outside of the WSJ newsroom
Write scripts and shape narratives for episodes, with attention to pacing, tone, and story arc
Travel for and produce field reporting when stories require it
Log, cut, and arrange tape, build assemblies, score moments, and handle everything else production requires
Balance multiple episodes in production simultaneously
Build and maintain strong working relationships with Wall Street Journal reporters, editors, and staff

Who You Are:
A minimum of 4 years producing audio in a fast-paced, high-volume newsroom or podcast operation
Experience producing a daily podcast is strongly preferred
Demonstrated ability to produce both longform and shortform content across narrative and interview-driven formats
Strong scriptwriting and story editing ability, with a feel for pacing and narrative structure
Solid technical skills across editing software, including Adobe Creative Suite, Pro Tools, or similar programs
Enthusiasm for a high-intensity daily production schedule
A genuine passion for the Wall Street Journal's reporting and business news broadly

Where You'll Be:
This is a full-time role based anywhere in New York, NY or Washington, D.C., working East coast hours.
This is a full-time role hybrid role, we ask that you come into the office 2–3 times per week.
This is a position covered under the Writers Guild of America East Collective Bargaining Agreement. Our recruitment team can answer any questions you may have about this representation. The base salary for this role is $95,000 USD"
Senior Engineering Manager - ML,Personalization,"New York, NY; Boston, MA; Miami, FL",2026-07-10,13b8ecf0-0ce6-411e-ac9d-5c60d9c94000,spotify,2026-07-10,2026-07-17,0.3677,US,https://jobs.lever.co/spotify/13b8ecf0-0ce6-411e-ac9d-5c60d9c94000,"Spotify’s Personalization team is building the next generation of intelligent listening experiences. Across surfaces like DJ, Search, AI Playlists, and Home, we’re evolving from standalone features into a unified, agent-powered platform. 
Generative AI is transforming Spotify's product capabilities and technical architecture. Agent frameworks, LLM orchestration, and agentic reasoning present huge opportunities for our products to serve more user needs and use cases, and to unlock richer, more dynamic relationships between listeners and the things they love.
This Senior Engineering Manager for Agentic Systems will focus on the architecture and evolution of Spotify agent-powered features. This role sits at the intersection of production systems engineering, LLM infrastructure, evaluation science, and applied research, and it requires someone who can operate fluidly across all of them. You will work as a senior individual contributor with significant architectural authority, partnering with a cross-functional team to define the technical strategy for how Spotify's agents are built, evaluated, and scaled, and driving the consolidation of our agent implementations onto a single engine that can power the next generation of the product.",Engineering,Permanent,remote,"Spotify’s Personalization team is building the next generation of intelligent listening experiences. Across surfaces like DJ, Search, AI Playlists, and Home, we’re evolving from standalone features into a unified, agent-powered platform. 
Generative AI is transforming Spotify's product capabilities and technical architecture. Agent frameworks, LLM orchestration, and agentic reasoning present huge opportunities for our products to serve more user needs and use cases, and to unlock richer, more dynamic relationships between listeners and the things they love.
This Senior Engineering Manager for Agentic Systems will focus on the architecture and evolution of Spotify agent-powered features. This role sits at the intersection of production systems engineering, LLM infrastructure, evaluation science, and applied research, and it requires someone who can operate fluidly across all of them. You will work as a senior individual contributor with significant architectural authority, partnering with a cross-functional team to define the technical strategy for how Spotify's agents are built, evaluated, and scaled, and driving the consolidation of our agent implementations onto a single engine that can power the next generation of the product.","The United States base range for this position is $227,495–$324,993 USD, plus equity. The benefits available for this position include health insurance, six-month paid parental leave, 401(k) retirement plan, monthly meal allowance, 23 paid days off, paid flexible holidays, and paid sick leave. These ranges may be modified in the future.
 
 
Spotify is an equal opportunity employer. You are welcome at Spotify for who you are, no matter where you come from, what you look like, or what’s playing in your headphones. Our platform is for everyone, and so is our workplace. The more voices we have represented and amplified in our business, the more we will all thrive, contribute, and be forward-thinking! So bring us your personal experience, your perspectives, and your background. It’s in our differences that we will find the power to keep revolutionizing the way the world listens.
 
At Spotify, we are passionate about inclusivity and making sure our entire recruitment process is accessible to everyone. We have ways to request reasonable accommodations during the interview process and help assist in what you need. If you need accommodations at any stage of the application or interview process, please let us know - we’re here to support you in any way we can.","What You'll Do:
Be accountable for teams building Spotify Agentic Experience delivering new and innovative products at the heart of music, podcast and audiobooks users love.
Together with a wide range of collaborators, develop a generative AI tech strategy that keeps Spotify at the forefront of innovation in the field.
Provide servant leadership to several teams working across research, machine learning, engineering management, backend engineers, and data specialists.
Advocate for and increase knowledge of advanced Gen AI capabilities across the company, including influencing the company’s most senior leaders.
Cultivate a balanced, collaborative engineering culture and a diverse and inclusive team that reflects our customers and our world.
Directly manage ~5-10 people.
Collaborate with a product lead to define strategy, success metrics and roadmaps.
Influence the technical design and architecture of the Conversation team’s stack.
Influence the Personalization team’s research and roadmap. Collaborate with leaders throughout the company to plan and execute impactful initiatives requiring many teams.

Who You Are:
You have significant expertise in shipping generative AI technologies and their application to high scale consumer products.
You have demonstrated the ability to lead a modern generative AI team (e.g. transformers, diffusion and other recent technologies) to incorporate generative AI into consumer facing products, continuously making the models better for users while optimizing performance and cost.
You practice servant leadership, have strong mentorship and coaching skills, and thrive when helping individuals and teams perform to their full potential.
You love facilitating collaboration among several teams, developing and growing teams and their leaders while driving delivery.
You are able to distill complex information into easy-to-understand concepts, and understand how to lead a team through ambiguity.
You thrive when bringing research to market as amazing products for users.

Where You'll Be:
We offer you the flexibility to work where you work best! For this role, you can be within the US region as long as we have a work location
This team operates within the US Eastern timezone for collaboration"
